"DESCRIPTION","DURATION IN MS","NAME","PARENT SUITE","START TIME","STATUS","STOP TIME","SUB SUITE","SUITE","TEST CLASS","TEST METHOD"
"","2945","ORD-PUT-003: Order status is DRAFT after update","sales-portal-api","Thu Dec 18 13:09:13 UTC 2025","passed","Thu Dec 18 13:09:16 UTC 2025","[API][Orders] > [Update order]","","",""
"","4195","Should NOT assign manager with non-existing orderId","sales-portal-api","Thu Dec 18 13:08:53 UTC 2025","passed","Thu Dec 18 13:08:57 UTC 2025","[API][Orders][Assign/Unassign Manager - Negative DDT] > Order in In Process status","","",""
"","938","400 returned for id of invalid format","sales-portal-api","Thu Dec 18 13:09:53 UTC 2025","failed","Thu Dec 18 13:09:54 UTC 2025","[API][Products] > [Should NOT find product to update]","","",""
"","987","Create product with 3 character length in name","sales-portal-api","Thu Dec 18 13:09:20 UTC 2025","passed","Thu Dec 18 13:09:21 UTC 2025","[API][Products] > [Create product]","","",""
"","907","Update street with empty string — bad request","sales-portal-api","Thu Dec 18 13:08:25 UTC 2025","passed","Thu Dec 18 13:08:26 UTC 2025","[API][Customers] > [Should NOT update customer]","","",""
"","410","Create product with 1 space in name","sales-portal-api","Thu Dec 18 13:09:23 UTC 2025","passed","Thu Dec 18 13:09:23 UTC 2025","[API][Products] > [Create product]","","",""
"","716","Clear notes (empty string)","sales-portal-api","Thu Dec 18 13:09:34 UTC 2025","passed","Thu Dec 18 13:09:35 UTC 2025","[API][Products] > [Update product]","","",""
"","185","404 returned for non-existing id of valid format","sales-portal-api","Thu Dec 18 13:09:25 UTC 2025","passed","Thu Dec 18 13:09:25 UTC 2025","[API][Products] > [Should Not Delete Product]","","",""
"","4896","Update manager to another manager","sales-portal-api","Thu Dec 18 13:08:36 UTC 2025","passed","Thu Dec 18 13:08:41 UTC 2025","[API][Orders][Manager assignment flow] > Order in In Process status","","",""
"","2951","Should NOT assign manager with non-existing managerId","sales-portal-api","Thu Dec 18 13:08:59 UTC 2025","passed","Thu Dec 18 13:09:02 UTC 2025","[API][Orders][Assign/Unassign Manager - Negative DDT] > Order in Draft status","","",""
"","396","Create customer with 1 character length in house","sales-portal-api","Thu Dec 18 13:08:18 UTC 2025","passed","Thu Dec 18 13:08:18 UTC 2025","[API][Customers][Create Customer] > Positive DDT","","",""
"","2936","Should NOT assign manager with non-existing orderId","sales-portal-api","Thu Dec 18 13:08:32 UTC 2025","passed","Thu Dec 18 13:08:35 UTC 2025","[API][Orders][Assign/Unassign Manager - Negative DDT] > Order in Draft status","","",""
"","184","Product without amount not created","sales-portal-api","Thu Dec 18 13:09:22 UTC 2025","passed","Thu Dec 18 13:09:22 UTC 2025","[API][Products] > [Should NOT create product]","","",""
"","774","Update street to valid format","sales-portal-api","Thu Dec 18 13:08:23 UTC 2025","passed","Thu Dec 18 13:08:24 UTC 2025","[API][Customers] > [Update customer]","","",""
"","972","Update with empty email — bad request","sales-portal-api","Thu Dec 18 13:08:26 UTC 2025","passed","Thu Dec 18 13:08:27 UTC 2025","[API][Customers] > [Should NOT update customer]","","",""
"","653","404 returned for non-existing id of valid format","sales-portal-api","Thu Dec 18 13:09:46 UTC 2025","failed","Thu Dec 18 13:09:47 UTC 2025","[API][Products] > [Should NOT find product to update]","","",""
"","785","Clear notes (empty string)","sales-portal-api","Thu Dec 18 13:08:26 UTC 2025","passed","Thu Dec 18 13:08:26 UTC 2025","[API][Customers] > [Update customer]","","",""
"","418","Create customer with with upper-case city","sales-portal-api","Thu Dec 18 13:08:18 UTC 2025","passed","Thu Dec 18 13:08:18 UTC 2025","[API][Customers][Create Customer] > Positive DDT","","",""
"","1455","Update name with empty string — bad request","sales-portal-api","Thu Dec 18 13:08:27 UTC 2025","passed","Thu Dec 18 13:08:29 UTC 2025","[API][Customers] > [Should NOT update customer]","","",""
"","202","CST-003: GET /api/customers?country Filter customers by Belarus","sales-portal-api","Thu Dec 18 13:08:19 UTC 2025","passed","Thu Dec 18 13:08:19 UTC 2025","CST-003 Get customers list (Filter by Country)","","",""
"","902","Update notes with < or > — bad request","sales-portal-api","Thu Dec 18 13:09:40 UTC 2025","passed","Thu Dec 18 13:09:41 UTC 2025","[API][Products] > [Should NOT update product]","","",""
"","423","Create customer with 1 character length in flat","sales-portal-api","Thu Dec 18 13:08:16 UTC 2025","passed","Thu Dec 18 13:08:17 UTC 2025","[API][Customers][Create Customer] > Positive DDT","","",""
"","1213","Update amount to minimum (0)","sales-portal-api","Thu Dec 18 13:09:37 UTC 2025","passed","Thu Dec 18 13:09:38 UTC 2025","[API][Products] > [Update product]","","",""
"","5747","Should NOT update manager with non-existing managerId","sales-portal-api","Thu Dec 18 13:08:52 UTC 2025","passed","Thu Dec 18 13:08:57 UTC 2025","[API][Orders][Assign/Unassign Manager - Negative DDT] > Order in Canceled status","","",""
"","5776","Remove manager from order","sales-portal-api","Thu Dec 18 13:08:40 UTC 2025","passed","Thu Dec 18 13:08:45 UTC 2025","[API][Orders][Manager assignment flow] > Order in Received status","","",""
"","3210","Should NOT unassign manager from order with non-existing orderId","sales-portal-api","Thu Dec 18 13:08:39 UTC 2025","passed","Thu Dec 18 13:08:43 UTC 2025","[API][Orders][Assign/Unassign Manager - Negative DDT] > Order in Draft status","","",""
"","491","Not integer amount product not created","sales-portal-api","Thu Dec 18 13:09:23 UTC 2025","passed","Thu Dec 18 13:09:23 UTC 2025","[API][Products] > [Should NOT create product]","","",""
"","578","Empty city","sales-portal-api","Thu Dec 18 13:09:10 UTC 2025","passed","Thu Dec 18 13:09:11 UTC 2025","[API][Orders][Delivery] > [Add Delivery Info] > [Should NOT add Delivery Info]","","",""
"","564","Update full customer data","sales-portal-api","Thu Dec 18 13:08:26 UTC 2025","passed","Thu Dec 18 13:08:27 UTC 2025","[API][Customers] > [Update customer]","","",""
"","545","404 returned for non-existing id of valid format","sales-portal-api","Thu Dec 18 13:08:25 UTC 2025","passed","Thu Dec 18 13:08:26 UTC 2025","[API][Customers] > [Should NOT find customer to update]","","",""
"","516","Create product with empty notes","sales-portal-api","Thu Dec 18 13:09:23 UTC 2025","passed","Thu Dec 18 13:09:24 UTC 2025","[API][Products] > [Create product]","","",""
"","476","Exceeded Max length street name (>40 chars)","sales-portal-api","Thu Dec 18 13:09:09 UTC 2025","passed","Thu Dec 18 13:09:09 UTC 2025","[API][Orders][Delivery] > [Add Delivery Info] > [Should NOT add Delivery Info]","","",""
"","905","Update only manufacturer","sales-portal-api","Thu Dec 18 13:09:35 UTC 2025","passed","Thu Dec 18 13:09:36 UTC 2025","[API][Products] > [Update product]","","",""
"","1582","Update amount to 1000 — bad request","sales-portal-api","Thu Dec 18 13:09:37 UTC 2025","passed","Thu Dec 18 13:09:38 UTC 2025","[API][Products] > [Should NOT update product]","","",""
"","516","Exeeded Max house number (>999)","sales-portal-api","Thu Dec 18 13:09:11 UTC 2025","passed","Thu Dec 18 13:09:11 UTC 2025","[API][Orders][Delivery] > [Add Delivery Info] > [Should NOT add Delivery Info]","","",""
"","4160","Assign manager to order","sales-portal-api","Thu Dec 18 13:08:32 UTC 2025","passed","Thu Dec 18 13:08:36 UTC 2025","[API][Orders][Manager assignment flow] > Order in In Process status","","",""
"","575","Invalid date format","sales-portal-api","Thu Dec 18 13:09:09 UTC 2025","passed","Thu Dec 18 13:09:10 UTC 2025","[API][Orders][Delivery] > [Add Delivery Info] > [Should NOT add Delivery Info]","","",""
"","578","Update city to 20 characters","sales-portal-api","Thu Dec 18 13:08:24 UTC 2025","passed","Thu Dec 18 13:08:24 UTC 2025","[API][Customers] > [Update customer]","","",""
"","2029","Create order with product quantity = 1 (min)","sales-portal-api","Thu Dec 18 13:08:58 UTC 2025","passed","Thu Dec 18 13:09:00 UTC 2025","[API][Orders][Create Order] > Positive DDT","","",""
"","855","Update notes with < or > symbols — bad request","sales-portal-api","Thu Dec 18 13:08:24 UTC 2025","passed","Thu Dec 18 13:08:25 UTC 2025","[API][Customers] > [Should NOT update customer]","","",""
"","187","Invalid condition value","sales-portal-api","Thu Dec 18 13:09:08 UTC 2025","passed","Thu Dec 18 13:09:08 UTC 2025","[API][Orders][Delivery] > [Add Delivery Info] > [Should NOT add Delivery Info]","","",""
"","209","CST-003: GET /api/customers?country Filter customers by Germany","sales-portal-api","Thu Dec 18 13:08:19 UTC 2025","passed","Thu Dec 18 13:08:19 UTC 2025","CST-003 Get customers list (Filter by Country)","","",""
"","639","Update notes to 250 characters","sales-portal-api","Thu Dec 18 13:09:34 UTC 2025","passed","Thu Dec 18 13:09:34 UTC 2025","[API][Products] > [Update product]","","",""
"","498","Not integer price product not created","sales-portal-api","Thu Dec 18 13:09:23 UTC 2025","passed","Thu Dec 18 13:09:24 UTC 2025","[API][Products] > [Should NOT create product]","","",""
"","2598","404 returned for non-existing product id","sales-portal-api","Thu Dec 18 13:09:16 UTC 2025","passed","Thu Dec 18 13:09:19 UTC 2025","[API][Orders] > [Should NOT update order]","","",""
"","1320","Update phone with invalid format — bad request","sales-portal-api","Thu Dec 18 13:08:27 UTC 2025","passed","Thu Dec 18 13:08:29 UTC 2025","[API][Customers] > [Should NOT update customer]","","",""
"","189","500 returned for id of invalid format","sales-portal-api","Thu Dec 18 13:09:33 UTC 2025","failed","Thu Dec 18 13:09:34 UTC 2025","[API] [Sales Portal] [Products] [Get By Id] > [Negative]","","",""
"","511","41 character name product not created","sales-portal-api","Thu Dec 18 13:09:27 UTC 2025","passed","Thu Dec 18 13:09:27 UTC 2025","[API][Products] > [Should NOT create product]","","",""
"","6150","Should NOT update manager with non-existing managerId","sales-portal-api","Thu Dec 18 13:08:42 UTC 2025","passed","Thu Dec 18 13:08:48 UTC 2025","[API][Orders][Assign/Unassign Manager - Negative DDT] > Order in Partially Received status","","",""
"","715","Name with special characters product not created","sales-portal-api","Thu Dec 18 13:09:22 UTC 2025","passed","Thu Dec 18 13:09:23 UTC 2025","[API][Products] > [Should NOT create product]","","",""
"","5609","Should NOT update manager with non-existing orderId","sales-portal-api","Thu Dec 18 13:09:01 UTC 2025","passed","Thu Dec 18 13:09:07 UTC 2025","[API][Orders][Assign/Unassign Manager - Negative DDT] > Order in Canceled status","","",""
"","2655","ORD-PUT-004: History entry recorded when order composition changes","sales-portal-api","Thu Dec 18 13:09:13 UTC 2025","passed","Thu Dec 18 13:09:16 UTC 2025","[API][Orders] > [Update order]","","",""
"","187","Zero flat number","sales-portal-api","Thu Dec 18 13:09:09 UTC 2025","passed","Thu Dec 18 13:09:09 UTC 2025","[API][Orders][Delivery] > [Add Delivery Info] > [Should NOT add Delivery Info]","","",""
"","403","Create customer with 20 characters length in phone","sales-portal-api","Thu Dec 18 13:08:18 UTC 2025","passed","Thu Dec 18 13:08:19 UTC 2025","[API][Customers][Create Customer] > Positive DDT","","",""
"","963","Update price to maximum (99999)","sales-portal-api","Thu Dec 18 13:09:36 UTC 2025","passed","Thu Dec 18 13:09:37 UTC 2025","[API][Products] > [Update product]","","",""
"","978","Update city with empty string — bad request","sales-portal-api","Thu Dec 18 13:08:23 UTC 2025","passed","Thu Dec 18 13:08:24 UTC 2025","[API][Customers] > [Should NOT update customer]","","",""
"","564","Update flat number","sales-portal-api","Thu Dec 18 13:08:24 UTC 2025","passed","Thu Dec 18 13:08:25 UTC 2025","[API][Customers] > [Update customer]","","",""
"","5929","Assign manager to order","sales-portal-api","Thu Dec 18 13:08:46 UTC 2025","passed","Thu Dec 18 13:08:52 UTC 2025","[API][Orders][Manager assignment flow] > Order in Partially Received status","","",""
"","411","Create customer with 10 characters length in phone","sales-portal-api","Thu Dec 18 13:08:18 UTC 2025","passed","Thu Dec 18 13:08:18 UTC 2025","[API][Customers][Create Customer] > Positive DDT","","",""
"","539","Create product with 1 price","sales-portal-api","Thu Dec 18 13:09:23 UTC 2025","passed","Thu Dec 18 13:09:24 UTC 2025","[API][Products] > [Create product]","","",""
"","3001","500 returned on invalid ObjectId format for customer","sales-portal-api","Thu Dec 18 13:09:19 UTC 2025","passed","Thu Dec 18 13:09:22 UTC 2025","[API][Orders] > [Should NOT update order]","","",""
"","2770","Remove manager from order","sales-portal-api","Thu Dec 18 13:08:29 UTC 2025","passed","Thu Dec 18 13:08:32 UTC 2025","[API][Orders][Manager assignment flow] > Order in Draft status","","",""
"","936","Update price to negative value — bad request","sales-portal-api","Thu Dec 18 13:09:39 UTC 2025","passed","Thu Dec 18 13:09:40 UTC 2025","[API][Products] > [Should NOT update product]","","",""
"","432","Create customer with 1 character length in name","sales-portal-api","Thu Dec 18 13:08:16 UTC 2025","passed","Thu Dec 18 13:08:17 UTC 2025","[API][Customers][Create Customer] > Positive DDT","","",""
"","401","Create product without notes","sales-portal-api","Thu Dec 18 13:09:23 UTC 2025","passed","Thu Dec 18 13:09:23 UTC 2025","[API][Products] > [Create product]","","",""
"","2317","500 returned on invalid ObjectId format for order","sales-portal-api","Thu Dec 18 13:09:19 UTC 2025","passed","Thu Dec 18 13:09:21 UTC 2025","[API][Orders] > [Should NOT update order]","","",""
"","210","CST-003: GET /api/customers?country Filter customers by Great Britain","sales-portal-api","Thu Dec 18 13:08:19 UTC 2025","passed","Thu Dec 18 13:08:19 UTC 2025","CST-003 Get customers list (Filter by Country)","","",""
"","234","Successfully update with future date","sales-portal-api","Thu Dec 18 13:09:08 UTC 2025","passed","Thu Dec 18 13:09:08 UTC 2025","[API][Orders][Delivery] > [Add Delivery Info]","","",""
"","2171","404 returned for non-existing customer","sales-portal-api","Thu Dec 18 13:09:19 UTC 2025","passed","Thu Dec 18 13:09:21 UTC 2025","[API][Orders] > [Should NOT update order]","","",""
"","917","Update price to minimum (1)","sales-portal-api","Thu Dec 18 13:09:35 UTC 2025","passed","Thu Dec 18 13:09:36 UTC 2025","[API][Products] > [Update product]","","",""
"","2403","Update manager to another manager","sales-portal-api","Thu Dec 18 13:08:27 UTC 2025","passed","Thu Dec 18 13:08:29 UTC 2025","[API][Orders][Manager assignment flow] > Order in Draft status","","",""
"","5748","Should NOT update manager with non-existing managerId","sales-portal-api","Thu Dec 18 13:08:47 UTC 2025","passed","Thu Dec 18 13:08:53 UTC 2025","[API][Orders][Assign/Unassign Manager - Negative DDT] > Order in In Process status","","",""
"","577","Update customer name to 40 characters","sales-portal-api","Thu Dec 18 13:08:20 UTC 2025","passed","Thu Dec 18 13:08:21 UTC 2025","[API][Customers] > [Update customer]","","",""
"","4314","Should NOT assign manager with non-existing orderId","sales-portal-api","Thu Dec 18 13:08:31 UTC 2025","passed","Thu Dec 18 13:08:35 UTC 2025","[API][Orders][Assign/Unassign Manager - Negative DDT] > Order in Received status","","",""
"","1016","Update name with double spaces — bad request","sales-portal-api","Thu Dec 18 13:09:34 UTC 2025","passed","Thu Dec 18 13:09:35 UTC 2025","[API][Products] > [Should NOT update product]","","",""
"","953","Update house with negative number — bad request","sales-portal-api","Thu Dec 18 13:08:26 UTC 2025","passed","Thu Dec 18 13:08:27 UTC 2025","[API][Customers] > [Should NOT update customer]","","",""
"","4954","Should NOT update manager with non-existing orderId","sales-portal-api","Thu Dec 18 13:08:57 UTC 2025","passed","Thu Dec 18 13:09:02 UTC 2025","[API][Orders][Assign/Unassign Manager - Negative DDT] > Order in In Process status","","",""
"","498","Special characters in street","sales-portal-api","Thu Dec 18 13:09:11 UTC 2025","passed","Thu Dec 18 13:09:12 UTC 2025","[API][Orders][Delivery] > [Add Delivery Info] > [Should NOT add Delivery Info]","","",""
"","1347","Update house with 1000 — bad request","sales-portal-api","Thu Dec 18 13:08:27 UTC 2025","passed","Thu Dec 18 13:08:29 UTC 2025","[API][Customers] > [Should NOT update customer]","","",""
"","514","Exceeded Max length city name (>20 chars)","sales-portal-api","Thu Dec 18 13:09:11 UTC 2025","passed","Thu Dec 18 13:09:12 UTC 2025","[API][Orders][Delivery] > [Add Delivery Info] > [Should NOT add Delivery Info]","","",""
"","5906","Should NOT unassign manager from order with non-existing orderId","sales-portal-api","Thu Dec 18 13:09:01 UTC 2025","passed","Thu Dec 18 13:09:07 UTC 2025","[API][Orders][Assign/Unassign Manager - Negative DDT] > Order in Partially Received status","","",""
"","4123","Should NOT unassign manager from order with non-existing orderId","sales-portal-api","Thu Dec 18 13:09:07 UTC 2025","passed","Thu Dec 18 13:09:11 UTC 2025","[API][Orders][Assign/Unassign Manager - Negative DDT] > Order in Canceled status","","",""
"","969","Update street with 41 characters — bad request","sales-portal-api","Thu Dec 18 13:08:24 UTC 2025","passed","Thu Dec 18 13:08:25 UTC 2025","[API][Customers] > [Should NOT update customer]","","",""
"","986","Update name with special characters — bad request","sales-portal-api","Thu Dec 18 13:08:24 UTC 2025","passed","Thu Dec 18 13:08:25 UTC 2025","[API][Customers] > [Should NOT update customer]","","",""
"","4753","Should NOT update manager with non-existing orderId","sales-portal-api","Thu Dec 18 13:08:35 UTC 2025","passed","Thu Dec 18 13:08:39 UTC 2025","[API][Orders][Assign/Unassign Manager - Negative DDT] > Order in Draft status","","",""
"","5099","Should NOT unassign manager from order with non-existing orderId","sales-portal-api","Thu Dec 18 13:08:42 UTC 2025","passed","Thu Dec 18 13:08:47 UTC 2025","[API][Orders][Assign/Unassign Manager - Negative DDT] > Order in Received status","","",""
"","810","Update city to 1 character","sales-portal-api","Thu Dec 18 13:08:23 UTC 2025","passed","Thu Dec 18 13:08:24 UTC 2025","[API][Customers] > [Update customer]","","",""
"","223","Past date","sales-portal-api","Thu Dec 18 13:09:14 UTC 2025","failed","Thu Dec 18 13:09:14 UTC 2025","[API][Orders][Delivery] > [Add Delivery Info] > [Should NOT add Delivery Info]","","",""
"","3127","ORD-PUT-002: Successful update of customer in order","sales-portal-api","Thu Dec 18 13:09:12 UTC 2025","passed","Thu Dec 18 13:09:15 UTC 2025","[API][Orders] > [Update order]","","",""
"","390","Create customer with 3 characters length in house","sales-portal-api","Thu Dec 18 13:08:18 UTC 2025","passed","Thu Dec 18 13:08:19 UTC 2025","[API][Customers][Create Customer] > Positive DDT","","",""
"","214","CST-003: GET /api/customers?country Filter customers by Ukraine","sales-portal-api","Thu Dec 18 13:08:21 UTC 2025","passed","Thu Dec 18 13:08:21 UTC 2025","CST-003 Get customers list (Filter by Country)","","",""
"","215","2 character name product not created","sales-portal-api","Thu Dec 18 13:09:26 UTC 2025","passed","Thu Dec 18 13:09:26 UTC 2025","[API][Products] > [Should NOT create product]","","",""
"","921","Update notes to 251 characters — bad request","sales-portal-api","Thu Dec 18 13:09:39 UTC 2025","passed","Thu Dec 18 13:09:40 UTC 2025","[API][Products] > [Should NOT update product]","","",""
"","1130","Update name with 41 characters — bad request","sales-portal-api","Thu Dec 18 13:08:23 UTC 2025","passed","Thu Dec 18 13:08:24 UTC 2025","[API][Customers] > [Should NOT update customer]","","",""
"","181","Missing address field","sales-portal-api","Thu Dec 18 13:09:08 UTC 2025","passed","Thu Dec 18 13:09:08 UTC 2025","[API][Orders][Delivery] > [Add Delivery Info] > [Should NOT add Delivery Info]","","",""
"","4313","Should NOT unassign manager from order with non-existing orderId","sales-portal-api","Thu Dec 18 13:08:31 UTC 2025","passed","Thu Dec 18 13:08:35 UTC 2025","[API][Orders][Assign/Unassign Manager - Negative DDT] > Order in In Process status","","",""
"","496","Product without name not created","sales-portal-api","Thu Dec 18 13:09:23 UTC 2025","passed","Thu Dec 18 13:09:23 UTC 2025","[API][Products] > [Should NOT create product]","","",""
"","574","Update house number","sales-portal-api","Thu Dec 18 13:08:24 UTC 2025","passed","Thu Dec 18 13:08:24 UTC 2025","[API][Customers] > [Update customer]","","",""
"","4844","Remove manager from order","sales-portal-api","Thu Dec 18 13:08:41 UTC 2025","passed","Thu Dec 18 13:08:46 UTC 2025","[API][Orders][Manager assignment flow] > Order in In Process status","","",""
"","523","Delete product","sales-portal-api","Thu Dec 18 13:09:29 UTC 2025","failed","Thu Dec 18 13:09:30 UTC 2025","[API][Products] > [Delete Product]","","",""
"","582","Update customer name with mixed case","sales-portal-api","Thu Dec 18 13:08:21 UTC 2025","passed","Thu Dec 18 13:08:22 UTC 2025","[API][Customers] > [Update customer]","","",""
"","428","Create customer with empty notes","sales-portal-api","Thu Dec 18 13:08:16 UTC 2025","passed","Thu Dec 18 13:08:16 UTC 2025","[API][Customers][Create Customer] > Positive DDT","","",""
"","438","Create customer with 20 characters length in city","sales-portal-api","Thu Dec 18 13:08:18 UTC 2025","passed","Thu Dec 18 13:08:18 UTC 2025","[API][Customers][Create Customer] > Positive DDT","","",""
"","183","404 returned for empty id","sales-portal-api","Thu Dec 18 13:09:29 UTC 2025","failed","Thu Dec 18 13:09:29 UTC 2025","[API][Products] > [Should Not Delete Product]","","",""
"","499","Notes with < or > symbols product not created","sales-portal-api","Thu Dec 18 13:09:24 UTC 2025","passed","Thu Dec 18 13:09:24 UTC 2025","[API][Products] > [Should NOT create product]","","",""
"","976","Create product with 999 amount","sales-portal-api","Thu Dec 18 13:09:21 UTC 2025","passed","Thu Dec 18 13:09:22 UTC 2025","[API][Products] > [Create product]","","",""
"","498","251 notes product not created","sales-portal-api","Thu Dec 18 13:09:23 UTC 2025","passed","Thu Dec 18 13:09:24 UTC 2025","[API][Products] > [Should NOT create product]","","",""
"","510","Negative amount product not created","sales-portal-api","Thu Dec 18 13:09:24 UTC 2025","passed","Thu Dec 18 13:09:24 UTC 2025","[API][Products] > [Should NOT create product]","","",""
"","1610","Update price to 0 — bad request","sales-portal-api","Thu Dec 18 13:09:37 UTC 2025","passed","Thu Dec 18 13:09:38 UTC 2025","[API][Products] > [Should NOT update product]","","",""
"","948","Update notes with 251 characters — bad request","sales-portal-api","Thu Dec 18 13:08:23 UTC 2025","passed","Thu Dec 18 13:08:24 UTC 2025","[API][Customers] > [Should NOT update customer]","","",""
"","6182","Update manager to another manager","sales-portal-api","Thu Dec 18 13:08:52 UTC 2025","passed","Thu Dec 18 13:08:58 UTC 2025","[API][Orders][Manager assignment flow] > Order in Partially Received status","","",""
"","962","Missing finalDate field","sales-portal-api","Thu Dec 18 13:09:05 UTC 2025","passed","Thu Dec 18 13:09:06 UTC 2025","[API][Orders][Delivery] > [Add Delivery Info] > [Should NOT add Delivery Info]","","",""
"","949","Update price with non-integer — bad request","sales-portal-api","Thu Dec 18 13:09:34 UTC 2025","passed","Thu Dec 18 13:09:35 UTC 2025","[API][Products] > [Should NOT update product]","","",""
"","6977","Should NOT update manager with non-existing orderId","sales-portal-api","Thu Dec 18 13:08:54 UTC 2025","passed","Thu Dec 18 13:09:01 UTC 2025","[API][Orders][Assign/Unassign Manager - Negative DDT] > Order in Partially Received status","","",""
"","3998","Assign manager to order","sales-portal-api","Thu Dec 18 13:08:30 UTC 2025","passed","Thu Dec 18 13:08:34 UTC 2025","[API][Orders][Manager assignment flow] > Order in Received status","","",""
"","209","CST-003: GET /api/customers?country Filter customers by Russia","sales-portal-api","Thu Dec 18 13:08:21 UTC 2025","passed","Thu Dec 18 13:08:21 UTC 2025","CST-003 Get customers list (Filter by Country)","","",""
"","206","404 returned for empty id","sales-portal-api","Thu Dec 18 13:09:32 UTC 2025","failed","Thu Dec 18 13:09:32 UTC 2025","[API] [Sales Portal] [Products] [Get By Id] > [Negative]","","",""
"","3699","ORD-PUT-012: Cannot delete linked product/customer until order is deleted","sales-portal-api","Thu Dec 18 13:09:15 UTC 2025","passed","Thu Dec 18 13:09:19 UTC 2025","[API][Orders] > [Update order]","","",""
"","573","Should NOT create customer with existing email","sales-portal-api","Thu Dec 18 13:08:17 UTC 2025","passed","Thu Dec 18 13:08:18 UTC 2025","[API][Customers][Create Customer] > Unique email","","",""
"","887","Update with invalid email format — bad request","sales-portal-api","Thu Dec 18 13:08:25 UTC 2025","passed","Thu Dec 18 13:08:26 UTC 2025","[API][Customers] > [Should NOT update customer]","","",""
"","722","Product without price not created","sales-portal-api","Thu Dec 18 13:09:22 UTC 2025","passed","Thu Dec 18 13:09:23 UTC 2025","[API][Products] > [Should NOT create product]","","",""
"","166","401 returned for request without token","sales-portal-api","Thu Dec 18 13:09:27 UTC 2025","passed","Thu Dec 18 13:09:27 UTC 2025","[API] [Sales Portal] [Products] [Get All] > [Negative]","","",""
"","228","404 returned for non-existing id of valid format","sales-portal-api","Thu Dec 18 13:08:19 UTC 2025","passed","Thu Dec 18 13:08:19 UTC 2025","[API] [Sales Portal] [Customers] [Get By Id] > [Negative]","","",""
"","2741","ORD-PUT-013: PUT without changes does not add REQUIRED_PRODUCTS_CHANGED history entry","sales-portal-api","Thu Dec 18 13:09:15 UTC 2025","passed","Thu Dec 18 13:09:18 UTC 2025","[API][Orders] > [Update order]","","",""
