"DESCRIPTION","DURATION IN MS","NAME","PARENT SUITE","START TIME","STATUS","STOP TIME","SUB SUITE","SUITE","TEST CLASS","TEST METHOD"
"","7893","Should NOT assign manager with non-existing managerId","sales-portal-api","Fri Dec 26 14:14:47 UTC 2025","passed","Fri Dec 26 14:14:55 UTC 2025","[API][Orders][Assign/Unassign Manager - Negative DDT] > Order in Received status","","",""
"","11896","Order status transition from Draft to","sales-portal-api","Fri Dec 26 14:15:56 UTC 2025","passed","Fri Dec 26 14:16:08 UTC 2025","[API][Orders][Invalid Orders statuses]","","",""
"","12957","Update manager to another manager","sales-portal-api","Fri Dec 26 14:13:30 UTC 2025","passed","Fri Dec 26 14:13:43 UTC 2025","[API][Orders][Manager assignment flow] > Order in In Process status","","",""
"","10941","Update manager to another manager","sales-portal-api","Fri Dec 26 14:14:00 UTC 2025","passed","Fri Dec 26 14:14:11 UTC 2025","[API][Orders][Manager assignment flow] > Order in Canceled status","","",""
"","7992","Order status transition from Draft to Canceled","sales-portal-api","Fri Dec 26 14:15:31 UTC 2025","passed","Fri Dec 26 14:15:39 UTC 2025","[API][Orders][Positive Orders statuses transition]","","",""
"","20126","Delete order with product quantity = 5 (max)","sales-portal-api","Fri Dec 26 14:14:55 UTC 2025","passed","Fri Dec 26 14:15:15 UTC 2025","[API][Orders][Delete Order]","","",""
"","445","Create customer with 1 character length in city","sales-portal-api","Fri Dec 26 14:12:54 UTC 2025","passed","Fri Dec 26 14:12:54 UTC 2025","[API][Customers][Create Customer] > Positive DDT","","",""
