"DESCRIPTION","DURATION IN MS","NAME","PARENT SUITE","START TIME","STATUS","STOP TIME","SUB SUITE","SUITE","TEST CLASS","TEST METHOD"
"","560","Create product with 0 amount","sales-portal-api","Thu Dec 18 13:09:24 UTC 2025","passed","Thu Dec 18 13:09:25 UTC 2025","[API][Products] > [Create product]","","",""
"","435","Create customer with 40 characters length in street","sales-portal-api","Thu Dec 18 13:08:16 UTC 2025","passed","Thu Dec 18 13:08:17 UTC 2025","[API][Customers][Create Customer] > Positive DDT","","",""
"","5792","Should NOT assign manager with non-existing orderId","sales-portal-api","Thu Dec 18 13:08:48 UTC 2025","passed","Thu Dec 18 13:08:54 UTC 2025","[API][Orders][Assign/Unassign Manager - Negative DDT] > Order in Partially Received status","","",""
"","2449","ORD-PUT-001: Successful products update recalculates total_price","sales-portal-api","Thu Dec 18 13:09:11 UTC 2025","passed","Thu Dec 18 13:09:13 UTC 2025","[API][Orders] > [Update order]","","",""
"","200","Name with 2 spaces product not created","sales-portal-api","Thu Dec 18 13:09:21 UTC 2025","passed","Thu Dec 18 13:09:21 UTC 2025","[API][Products] > [Should NOT create product]","","",""
"","1062","Should return list of all products","sales-portal-api","Thu Dec 18 13:09:26 UTC 2025","passed","Thu Dec 18 13:09:27 UTC 2025","[API] [Sales Portal] [Products] [Get All] > [Positive]","","",""
"","4977","Delete order with product quantity = 5 (max)","sales-portal-api","Thu Dec 18 13:09:02 UTC 2025","passed","Thu Dec 18 13:09:07 UTC 2025","[API][Orders][Delete Order]","","",""
"","221","CST-003: GET /api/customers?country Filter customers by Canada","sales-portal-api","Thu Dec 18 13:08:21 UTC 2025","passed","Thu Dec 18 13:08:21 UTC 2025","CST-003 Get customers list (Filter by Country)","","",""
"","504","Empty name product not created","sales-portal-api","Thu Dec 18 13:09:23 UTC 2025","passed","Thu Dec 18 13:09:24 UTC 2025","[API][Products] > [Should NOT create product]","","",""
"","956","Update amount to negative — bad request","sales-portal-api","Thu Dec 18 13:09:36 UTC 2025","passed","Thu Dec 18 13:09:37 UTC 2025","[API][Products] > [Should NOT update product]","","",""
"","181","Missing condition field","sales-portal-api","Thu Dec 18 13:09:08 UTC 2025","passed","Thu Dec 18 13:09:08 UTC 2025","[API][Orders][Delivery] > [Add Delivery Info] > [Should NOT add Delivery Info]","","",""
"","820","Update full product data","sales-portal-api","Thu Dec 18 13:09:36 UTC 2025","passed","Thu Dec 18 13:09:37 UTC 2025","[API][Products] > [Update product]","","",""
"","679","Update product name to 3 characters","sales-portal-api","Thu Dec 18 13:09:32 UTC 2025","passed","Thu Dec 18 13:09:32 UTC 2025","[API][Products] > [Update product]","","",""
"","494","1000 amount product not created","sales-portal-api","Thu Dec 18 13:09:24 UTC 2025","passed","Thu Dec 18 13:09:25 UTC 2025","[API][Products] > [Should NOT create product]","","",""
"","3762","Create order with product quantity = 5 (max)","sales-portal-api","Thu Dec 18 13:09:01 UTC 2025","passed","Thu Dec 18 13:09:04 UTC 2025","[API][Orders][Create Order] > Positive DDT","","",""
"","3411","Should NOT assign manager with non-existing orderId","sales-portal-api","Thu Dec 18 13:08:58 UTC 2025","passed","Thu Dec 18 13:09:01 UTC 2025","[API][Orders][Assign/Unassign Manager - Negative DDT] > Order in Canceled status","","",""
"","497","Negative price product not created","sales-portal-api","Thu Dec 18 13:09:23 UTC 2025","passed","Thu Dec 18 13:09:23 UTC 2025","[API][Products] > [Should NOT create product]","","",""
"","410","Create customer with 1 character length in street","sales-portal-api","Thu Dec 18 13:08:19 UTC 2025","passed","Thu Dec 18 13:08:19 UTC 2025","[API][Customers][Create Customer] > Positive DDT","","",""
"","1011","Update amount with non-integer — bad request","sales-portal-api","Thu Dec 18 13:09:38 UTC 2025","passed","Thu Dec 18 13:09:39 UTC 2025","[API][Products] > [Should NOT update product]","","",""
"","571","Missing country in address","sales-portal-api","Thu Dec 18 13:09:08 UTC 2025","passed","Thu Dec 18 13:09:08 UTC 2025","[API][Orders][Delivery] > [Add Delivery Info] > [Should NOT add Delivery Info]","","",""
"","5148","Update manager to another manager","sales-portal-api","Thu Dec 18 13:08:35 UTC 2025","passed","Thu Dec 18 13:08:40 UTC 2025","[API][Orders][Manager assignment flow] > Order in Received status","","",""
"","479","Single character city name","sales-portal-api","Thu Dec 18 13:09:08 UTC 2025","passed","Thu Dec 18 13:09:09 UTC 2025","[API][Orders][Delivery] > [Add Delivery Info]","","",""
"","982","Update price to 100000 — bad request","sales-portal-api","Thu Dec 18 13:09:38 UTC 2025","passed","Thu Dec 18 13:09:39 UTC 2025","[API][Products] > [Should NOT update product]","","",""
"","1027","Successfully set delivery info with all required fields","sales-portal-api","Thu Dec 18 13:09:05 UTC 2025","passed","Thu Dec 18 13:09:06 UTC 2025","[API][Orders][Delivery] > [Add Delivery Info]","","",""
"","195","100000 price product not created","sales-portal-api","Thu Dec 18 13:09:21 UTC 2025","passed","Thu Dec 18 13:09:21 UTC 2025","[API][Products] > [Should NOT create product]","","",""
"","3961","Should NOT assign manager with non-existing managerId","sales-portal-api","Thu Dec 18 13:09:07 UTC 2025","passed","Thu Dec 18 13:09:11 UTC 2025","[API][Orders][Assign/Unassign Manager - Negative DDT] > Order in Received status","","",""
"","902","Unicode characters in city","sales-portal-api","Thu Dec 18 13:09:12 UTC 2025","passed","Thu Dec 18 13:09:13 UTC 2025","[API][Orders][Delivery] > [Add Delivery Info] > [Should NOT add Delivery Info]","","",""
"","921","Create product with 250 notes","sales-portal-api","Thu Dec 18 13:09:22 UTC 2025","passed","Thu Dec 18 13:09:23 UTC 2025","[API][Products] > [Create product]","","",""
"","235","400 returned for id of invalid format","sales-portal-api","Thu Dec 18 13:09:30 UTC 2025","failed","Thu Dec 18 13:09:30 UTC 2025","[API][Products] > [Should Not Delete Product]","","",""
"","602","404 returned for empty id","sales-portal-api","Thu Dec 18 13:09:40 UTC 2025","failed","Thu Dec 18 13:09:41 UTC 2025","[API][Products] > [Should NOT find product to update]","","",""
"","569","Should get customer by valid id","sales-portal-api","Thu Dec 18 13:08:19 UTC 2025","passed","Thu Dec 18 13:08:19 UTC 2025","[API] [Sales Portal] [Customers] [Get By Id] > [Positive]","","",""
"","426","Create customer with 4 characters length in flat","sales-portal-api","Thu Dec 18 13:08:17 UTC 2025","passed","Thu Dec 18 13:08:18 UTC 2025","[API][Customers][Create Customer] > Positive DDT","","",""
"","494","Without manufacturer product not created","sales-portal-api","Thu Dec 18 13:09:24 UTC 2025","passed","Thu Dec 18 13:09:25 UTC 2025","[API][Products] > [Should NOT create product]","","",""
"","405","Create customer with with upper-case email","sales-portal-api","Thu Dec 18 13:08:19 UTC 2025","passed","Thu Dec 18 13:08:19 UTC 2025","[API][Customers][Create Customer] > Positive DDT","","",""
"","452","Create customer with 1 character length in city","sales-portal-api","Thu Dec 18 13:08:16 UTC 2025","passed","Thu Dec 18 13:08:17 UTC 2025","[API][Customers][Create Customer] > Positive DDT","","",""
"","413","Create customer with upper-case street","sales-portal-api","Thu Dec 18 13:08:18 UTC 2025","passed","Thu Dec 18 13:08:18 UTC 2025","[API][Customers][Create Customer] > Positive DDT","","",""
"","700","Update amount to maximum (999)","sales-portal-api","Thu Dec 18 13:09:32 UTC 2025","passed","Thu Dec 18 13:09:33 UTC 2025","[API][Products] > [Update product]","","",""
"","788","Should get product by valid id","sales-portal-api","Thu Dec 18 13:09:27 UTC 2025","passed","Thu Dec 18 13:09:28 UTC 2025","[API] [Sales Portal] [Products] [Get By Id] > [Positive]","","",""
"","217","Negative house number","sales-portal-api","Thu Dec 18 13:09:17 UTC 2025","passed","Thu Dec 18 13:09:17 UTC 2025","[API][Orders][Delivery] > [Add Delivery Info] > [Should NOT add Delivery Info]","","",""
"","555","Update notes to 250 characters","sales-portal-api","Thu Dec 18 13:08:25 UTC 2025","passed","Thu Dec 18 13:08:26 UTC 2025","[API][Customers] > [Update customer]","","",""
"","965","Update phone without + sign — bad request","sales-portal-api","Thu Dec 18 13:08:29 UTC 2025","passed","Thu Dec 18 13:08:30 UTC 2025","[API][Customers] > [Should NOT update customer]","","",""
"","382","CST-009: Delete customer (Invalid Id)","sales-portal-api","Thu Dec 18 13:08:18 UTC 2025","passed","Thu Dec 18 13:08:18 UTC 2025","CST-008/009 Delete customer","","",""
"","1769","Assign manager to order","sales-portal-api","Thu Dec 18 13:08:24 UTC 2025","passed","Thu Dec 18 13:08:26 UTC 2025","[API][Orders][Manager assignment flow] > Order in Draft status","","",""
"","496","0 price product not created","sales-portal-api","Thu Dec 18 13:09:24 UTC 2025","passed","Thu Dec 18 13:09:24 UTC 2025","[API][Products] > [Should NOT create product]","","",""
"","566","Update phone to valid format","sales-portal-api","Thu Dec 18 13:08:22 UTC 2025","passed","Thu Dec 18 13:08:23 UTC 2025","[API][Customers] > [Update customer]","","",""
"","1420","Update city with 21 characters — bad request","sales-portal-api","Thu Dec 18 13:08:30 UTC 2025","passed","Thu Dec 18 13:08:31 UTC 2025","[API][Customers] > [Should NOT update customer]","","",""
"","950","Update flat with negative number — bad request","sales-portal-api","Thu Dec 18 13:08:29 UTC 2025","passed","Thu Dec 18 13:08:29 UTC 2025","[API][Customers] > [Should NOT update customer]","","",""
"","5895","Should NOT assign manager with non-existing managerId","sales-portal-api","Thu Dec 18 13:08:36 UTC 2025","passed","Thu Dec 18 13:08:41 UTC 2025","[API][Orders][Assign/Unassign Manager - Negative DDT] > Order in Partially Received status","","",""
"","1722","Update with 2 character name — bad request","sales-portal-api","Thu Dec 18 13:09:37 UTC 2025","passed","Thu Dec 18 13:09:39 UTC 2025","[API][Products] > [Should NOT update product]","","",""
"","3968","Assign manager to order","sales-portal-api","Thu Dec 18 13:08:46 UTC 2025","passed","Thu Dec 18 13:08:49 UTC 2025","[API][Orders][Manager assignment flow] > Order in Canceled status","","",""
"","2297","401 returned without token","sales-portal-api","Thu Dec 18 13:09:18 UTC 2025","passed","Thu Dec 18 13:09:20 UTC 2025","[API][Orders] > [Should NOT update order]","","",""
"","517","Empty street","sales-portal-api","Thu Dec 18 13:09:11 UTC 2025","passed","Thu Dec 18 13:09:11 UTC 2025","[API][Orders][Delivery] > [Add Delivery Info] > [Should NOT add Delivery Info]","","",""
"","2021","Delete order with product quantity = 1 (min)","sales-portal-api","Thu Dec 18 13:09:02 UTC 2025","passed","Thu Dec 18 13:09:04 UTC 2025","[API][Orders][Delete Order]","","",""
"","934","Create product with 40 character length in name","sales-portal-api","Thu Dec 18 13:09:22 UTC 2025","passed","Thu Dec 18 13:09:23 UTC 2025","[API][Products] > [Create product]","","",""
"","976","Update with 41 character name — bad request","sales-portal-api","Thu Dec 18 13:09:32 UTC 2025","passed","Thu Dec 18 13:09:33 UTC 2025","[API][Products] > [Should NOT update product]","","",""
"","1990","404 returned for non-existing order","sales-portal-api","Thu Dec 18 13:09:16 UTC 2025","passed","Thu Dec 18 13:09:18 UTC 2025","[API][Orders] > [Should NOT update order]","","",""
"","199","404 returned for non-existing id of valid format","sales-portal-api","Thu Dec 18 13:09:29 UTC 2025","passed","Thu Dec 18 13:09:29 UTC 2025","[API] [Sales Portal] [Products] [Get By Id] > [Negative]","","",""
"","249","Successfully set pickup condition","sales-portal-api","Thu Dec 18 13:09:08 UTC 2025","passed","Thu Dec 18 13:09:08 UTC 2025","[API][Orders][Delivery] > [Add Delivery Info]","","",""
"","405","Create customer with with upper-case name","sales-portal-api","Thu Dec 18 13:08:18 UTC 2025","passed","Thu Dec 18 13:08:19 UTC 2025","[API][Customers][Create Customer] > Positive DDT","","",""
"","221","CST-003: GET /api/customers?country Filter customers by France","sales-portal-api","Thu Dec 18 13:08:21 UTC 2025","passed","Thu Dec 18 13:08:21 UTC 2025","CST-003 Get customers list (Filter by Country)","","",""
"","4139","Should NOT assign manager with non-existing managerId","sales-portal-api","Thu Dec 18 13:08:43 UTC 2025","passed","Thu Dec 18 13:08:47 UTC 2025","[API][Orders][Assign/Unassign Manager - Negative DDT] > Order in In Process status","","",""
"","417","Create customer 250 characters length in notes","sales-portal-api","Thu Dec 18 13:08:17 UTC 2025","passed","Thu Dec 18 13:08:17 UTC 2025","[API][Customers][Create Customer] > Positive DDT","","",""
"","395","Create product with 99999 price","sales-portal-api","Thu Dec 18 13:09:24 UTC 2025","passed","Thu Dec 18 13:09:24 UTC 2025","[API][Products] > [Create product]","","",""
"","1477","Update name with special characters — bad request","sales-portal-api","Thu Dec 18 13:09:35 UTC 2025","passed","Thu Dec 18 13:09:37 UTC 2025","[API][Products] > [Should NOT update product]","","",""
"","636","Update customer name to 1 character","sales-portal-api","Thu Dec 18 13:08:20 UTC 2025","passed","Thu Dec 18 13:08:20 UTC 2025","[API][Customers] > [Update customer]","","",""
"","767","Update email to valid format","sales-portal-api","Thu Dec 18 13:08:22 UTC 2025","passed","Thu Dec 18 13:08:22 UTC 2025","[API][Customers] > [Update customer]","","",""
"","4352","Remove manager from order","sales-portal-api","Thu Dec 18 13:08:26 UTC 2025","passed","Thu Dec 18 13:08:30 UTC 2025","[API][Orders][Manager assignment flow] > Order in Partially Received status","","",""
"","5000","Should NOT assign manager with non-existing managerId","sales-portal-api","Thu Dec 18 13:08:47 UTC 2025","passed","Thu Dec 18 13:08:52 UTC 2025","[API][Orders][Assign/Unassign Manager - Negative DDT] > Order in Canceled status","","",""
"","201","CST-003: GET /api/customers?country Filter customers by USA","sales-portal-api","Thu Dec 18 13:08:19 UTC 2025","passed","Thu Dec 18 13:08:19 UTC 2025","CST-003 Get customers list (Filter by Country)","","",""
"","945","Attempt to create duplicate product returns error","sales-portal-api","Thu Dec 18 13:09:24 UTC 2025","passed","Thu Dec 18 13:09:25 UTC 2025","[API][Products] > Should NOT create duplicate product","","",""
"","1433","Update flat with 10000 — bad request","sales-portal-api","Thu Dec 18 13:08:30 UTC 2025","passed","Thu Dec 18 13:08:31 UTC 2025","[API][Customers] > [Should NOT update customer]","","",""
"","4158","Update manager to another manager","sales-portal-api","Thu Dec 18 13:08:50 UTC 2025","passed","Thu Dec 18 13:08:54 UTC 2025","[API][Orders][Manager assignment flow] > Order in Canceled status","","",""
"","5959","Should NOT update manager with non-existing orderId","sales-portal-api","Thu Dec 18 13:08:36 UTC 2025","passed","Thu Dec 18 13:08:42 UTC 2025","[API][Orders][Assign/Unassign Manager - Negative DDT] > Order in Received status","","",""
"","722","Update product name with 1 space","sales-portal-api","Thu Dec 18 13:09:34 UTC 2025","passed","Thu Dec 18 13:09:35 UTC 2025","[API][Products] > [Update product]","","",""
"","991","Attempt to update product name with existing one returns error","sales-portal-api","Thu Dec 18 13:09:56 UTC 2025","passed","Thu Dec 18 13:09:57 UTC 2025","[API][Products] > Should NOT update with existing name","","",""
"","4944","Remove manager from order","sales-portal-api","Thu Dec 18 13:08:54 UTC 2025","passed","Thu Dec 18 13:08:59 UTC 2025","[API][Orders][Manager assignment flow] > Order in Canceled status","","",""
"","645","Update product name to 40 characters","sales-portal-api","Thu Dec 18 13:09:33 UTC 2025","passed","Thu Dec 18 13:09:34 UTC 2025","[API][Products] > [Update product]","","",""
"","2911","400 returned for empty products array","sales-portal-api","Thu Dec 18 13:09:18 UTC 2025","passed","Thu Dec 18 13:09:21 UTC 2025","[API][Orders] > [Should NOT update order]","","",""
"","422","Create customer with 40 characters length in name","sales-portal-api","Thu Dec 18 13:08:18 UTC 2025","passed","Thu Dec 18 13:08:18 UTC 2025","[API][Customers][Create Customer] > Positive DDT","","",""
"","4139","Should NOT update manager with non-existing managerId","sales-portal-api","Thu Dec 18 13:09:11 UTC 2025","passed","Thu Dec 18 13:09:15 UTC 2025","[API][Orders][Assign/Unassign Manager - Negative DDT] > Order in Received status","","",""
"","2914","Should NOT update manager with non-existing managerId","sales-portal-api","Thu Dec 18 13:08:29 UTC 2025","passed","Thu Dec 18 13:08:31 UTC 2025","[API][Orders][Assign/Unassign Manager - Negative DDT] > Order in Draft status","","",""
