"DESCRIPTION","DURATION IN MS","NAME","PARENT SUITE","START TIME","STATUS","STOP TIME","SUB SUITE","SUITE","TEST CLASS","TEST METHOD"
"","368","Unicode characters in city [15]","sales-portal-api","Thu Dec 25 21:51:46 UTC 2025","passed","Thu Dec 25 21:51:47 UTC 2025","[API][Orders][Delivery] > [Add Delivery Info] > [Should NOT add Delivery Info]","","",""
"","12967","Order status transition from In Process to Draft","sales-portal-api","Thu Dec 25 21:52:32 UTC 2025","passed","Thu Dec 25 21:52:45 UTC 2025","[API][Orders][Negative Orders statuses transition]","","",""
"","209","CST-003: GET /api/customers?country Filter customers by Germany","sales-portal-api","Thu Dec 25 21:49:45 UTC 2025","passed","Thu Dec 25 21:49:46 UTC 2025","CST-003 Get customers list (Filter by Country)","","",""
"","154","Exceeded Max length street name (>40 chars) [12]","sales-portal-api","Thu Dec 25 21:51:44 UTC 2025","passed","Thu Dec 25 21:51:44 UTC 2025","[API][Orders][Delivery] > [Add Delivery Info] > [Should NOT add Delivery Info]","","",""
"","9088","Order status transition from Draft to null","sales-portal-api","Thu Dec 25 21:52:18 UTC 2025","passed","Thu Dec 25 21:52:27 UTC 2025","[API][Orders][Invalid Orders statuses]","","",""
"","1985","Notes with < or > symbols product not created","sales-portal-api","Thu Dec 25 21:54:33 UTC 2025","passed","Thu Dec 25 21:54:35 UTC 2025","[API][Products] > [Should NOT create product]","","",""
"","6908","Order status transition from Canceled to In Process","sales-portal-api","Thu Dec 25 21:51:58 UTC 2025","passed","Thu Dec 25 21:52:05 UTC 2025","[API][Orders][Negative Orders statuses transition]","","",""
"","6984","Update only manufacturer","sales-portal-api","Thu Dec 25 21:55:02 UTC 2025","passed","Thu Dec 25 21:55:09 UTC 2025","[API][Products] > [Update product]","","",""
"","8943","Order status transition from Canceled to Draft","sales-portal-api","Thu Dec 25 21:52:01 UTC 2025","passed","Thu Dec 25 21:52:10 UTC 2025","[API][Orders][Positive Orders statuses transition]","","",""
"","11934","Remove manager from order","sales-portal-api","Thu Dec 25 21:50:19 UTC 2025","passed","Thu Dec 25 21:50:31 UTC 2025","[API][Orders][Manager assignment flow] > Order in Received status","","",""
"","2958","Attempt to create duplicate product returns error","sales-portal-api","Thu Dec 25 21:54:35 UTC 2025","passed","Thu Dec 25 21:54:38 UTC 2025","[API][Products] > Should NOT create duplicate product","","",""
"","8784","Order status transition from In Process to In Process","sales-portal-api","Thu Dec 25 21:52:21 UTC 2025","failed","Thu Dec 25 21:52:30 UTC 2025","[API][Orders][Negative Orders statuses transition]","","",""
"","4997","Missing country in address [3]","sales-portal-api","Thu Dec 25 21:51:39 UTC 2025","passed","Thu Dec 25 21:51:44 UTC 2025","[API][Orders][Delivery] > [Add Delivery Info] > [Should NOT add Delivery Info]","","",""
"","185","Past date [6]","sales-portal-api","Thu Dec 25 21:51:51 UTC 2025","failed","Thu Dec 25 21:51:51 UTC 2025","[API][Orders][Delivery] > [Add Delivery Info] > [Should NOT add Delivery Info]","","",""
"","182","CST-003: GET /api/customers?country Filter customers by Great Britain","sales-portal-api","Thu Dec 25 21:49:45 UTC 2025","passed","Thu Dec 25 21:49:46 UTC 2025","CST-003 Get customers list (Filter by Country)","","",""
"","5982","Order status transition from Draft to Canceled","sales-portal-api","Thu Dec 25 21:51:55 UTC 2025","passed","Thu Dec 25 21:52:01 UTC 2025","[API][Orders][Positive Orders statuses transition]","","",""
"","599","Create customer with 20 characters length in phone","sales-portal-api","Thu Dec 25 21:49:44 UTC 2025","passed","Thu Dec 25 21:49:45 UTC 2025","[API][Customers][Create Customer] > Positive DDT","","",""
"","632","Update notes to 250 characters","sales-portal-api","Thu Dec 25 21:49:52 UTC 2025","passed","Thu Dec 25 21:49:53 UTC 2025","[API][Customers] > [Update customer]","","",""
"","6977","Update price to maximum (99999)","sales-portal-api","Thu Dec 25 21:55:02 UTC 2025","passed","Thu Dec 25 21:55:09 UTC 2025","[API][Products] > [Update product]","","",""
"","342","Create customer with 1 character length in house","sales-portal-api","Thu Dec 25 21:49:44 UTC 2025","passed","Thu Dec 25 21:49:44 UTC 2025","[API][Customers][Create Customer] > Positive DDT","","",""
"","168","2 character name product not created","sales-portal-api","Thu Dec 25 21:54:36 UTC 2025","passed","Thu Dec 25 21:54:36 UTC 2025","[API][Products] > [Should NOT create product]","","",""
"","292","Create customer with with upper-case email","sales-portal-api","Thu Dec 25 21:49:45 UTC 2025","passed","Thu Dec 25 21:49:45 UTC 2025","[API][Customers][Create Customer] > Positive DDT","","",""
"","1426","Update phone without + sign — bad request","sales-portal-api","Thu Dec 25 21:49:56 UTC 2025","passed","Thu Dec 25 21:49:58 UTC 2025","[API][Customers] > [Should NOT update customer]","","",""
"","910","Update customer name to 1 character","sales-portal-api","Thu Dec 25 21:49:46 UTC 2025","passed","Thu Dec 25 21:49:47 UTC 2025","[API][Customers] > [Update customer]","","",""
"","3944","Update product name with 1 space","sales-portal-api","Thu Dec 25 21:54:50 UTC 2025","passed","Thu Dec 25 21:54:54 UTC 2025","[API][Products] > [Update product]","","",""
"","16107","Delete order with product quantity = 5 (max)","sales-portal-api","Thu Dec 25 21:51:27 UTC 2025","passed","Thu Dec 25 21:51:43 UTC 2025","[API][Orders][Delete Order]","","",""
"","10928","500 returned on invalid ObjectId format for order","sales-portal-api","Thu Dec 25 21:54:12 UTC 2025","passed","Thu Dec 25 21:54:23 UTC 2025","[API][Orders] > [Should NOT update order]","","",""
"","1966","Missing address field [2]","sales-portal-api","Thu Dec 25 21:51:37 UTC 2025","passed","Thu Dec 25 21:51:39 UTC 2025","[API][Orders][Delivery] > [Add Delivery Info] > [Should NOT add Delivery Info]","","",""
"","785","Update city to 1 character","sales-portal-api","Thu Dec 25 21:49:51 UTC 2025","passed","Thu Dec 25 21:49:51 UTC 2025","[API][Customers] > [Update customer]","","",""
"","871","Successfully set pickup condition [1]","sales-portal-api","Thu Dec 25 21:51:36 UTC 2025","passed","Thu Dec 25 21:51:37 UTC 2025","[API][Orders][Delivery] > [Add Delivery Info]","","",""
"","9964","Assign manager to order","sales-portal-api","Thu Dec 25 21:50:31 UTC 2025","passed","Thu Dec 25 21:50:41 UTC 2025","[API][Orders][Manager assignment flow] > Order in Canceled status","","",""
"","975","Product without name not created","sales-portal-api","Thu Dec 25 21:54:23 UTC 2025","passed","Thu Dec 25 21:54:24 UTC 2025","[API][Products] > [Should NOT create product]","","",""
"","1016","Update with empty email — bad request","sales-portal-api","Thu Dec 25 21:49:53 UTC 2025","passed","Thu Dec 25 21:49:54 UTC 2025","[API][Customers] > [Should NOT update customer]","","",""
"","196","CST-003: GET /api/customers?country Filter customers by Belarus","sales-portal-api","Thu Dec 25 21:49:45 UTC 2025","passed","Thu Dec 25 21:49:45 UTC 2025","CST-003 Get customers list (Filter by Country)","","",""
"","4930","Create product without notes","sales-portal-api","Thu Dec 25 21:54:25 UTC 2025","passed","Thu Dec 25 21:54:30 UTC 2025","[API][Products] > [Create product]","","",""
"","1817","Update house with 1000 — bad request","sales-portal-api","Thu Dec 25 21:49:54 UTC 2025","passed","Thu Dec 25 21:49:56 UTC 2025","[API][Customers] > [Should NOT update customer]","","",""
"","31539","Canceled: reopen visible, cancel/process hidden","sales-portal-ui","Thu Dec 25 21:57:23 UTC 2025","broken","Thu Dec 25 21:57:54 UTC 2025","[UI][Orders][Order Details]","","",""
"","2658","Should get product by valid id","sales-portal-api","Thu Dec 25 21:54:40 UTC 2025","passed","Thu Dec 25 21:54:43 UTC 2025","[API] [Sales Portal] [Products] [Get By Id] > [Positive]","","",""
"","453","CST-009: Delete customer (Invalid Id)","sales-portal-api","Thu Dec 25 21:49:44 UTC 2025","passed","Thu Dec 25 21:49:45 UTC 2025","CST-008/009 Delete customer","","",""
"","25949","Order status transition from Partially Received to Draft","sales-portal-api","Thu Dec 25 21:52:51 UTC 2025","passed","Thu Dec 25 21:53:17 UTC 2025","[API][Orders][Negative Orders statuses transition]","","",""
"","14959","Should NOT receive products: Received status (already fully received)","sales-portal-api","Thu Dec 25 21:52:40 UTC 2025","passed","Thu Dec 25 21:52:55 UTC 2025","[API][Orders][Receive] > [Negative][Incorrect order status to receive]","","",""
"","4943","Update price with non-integer — bad request","sales-portal-api","Thu Dec 25 21:54:52 UTC 2025","passed","Thu Dec 25 21:54:57 UTC 2025","[API][Products] > [Should NOT update product]","","",""
"","16852","Processing: receive 1 product (becomes Partially Received)","sales-portal-api","Thu Dec 25 21:52:20 UTC 2025","passed","Thu Dec 25 21:52:37 UTC 2025","[API][Orders][Receive] > [Positive][Receive order]","","",""
"","989","400 returned for id of invalid format","sales-portal-api","Thu Dec 25 21:55:35 UTC 2025","failed","Thu Dec 25 21:55:36 UTC 2025","[API][Products] > [Should NOT find product to update]","","",""
"","13972","Should NOT unassign manager from order with non-existing orderId","sales-portal-api","Thu Dec 25 21:50:25 UTC 2025","passed","Thu Dec 25 21:50:39 UTC 2025","[API][Orders][Assign/Unassign Manager - Negative DDT] > Order in Received status","","",""
"","4972","Update notes to 251 characters — bad request","sales-portal-api","Thu Dec 25 21:55:19 UTC 2025","passed","Thu Dec 25 21:55:24 UTC 2025","[API][Products] > [Should NOT update product]","","",""
"","12877","Should NOT receive products: Draft status","sales-portal-api","Thu Dec 25 21:52:25 UTC 2025","passed","Thu Dec 25 21:52:38 UTC 2025","[API][Orders][Receive] > [Negative][Incorrect order status to receive]","","",""
"","12017","Order status transition from Received to In Process","sales-portal-api","Thu Dec 25 21:52:16 UTC 2025","passed","Thu Dec 25 21:52:28 UTC 2025","[API][Orders][Negative Orders statuses transition]","","",""
"","3575","Update flat with 10000 — bad request","sales-portal-api","Thu Dec 25 21:49:58 UTC 2025","passed","Thu Dec 25 21:50:01 UTC 2025","[API][Customers] > [Should NOT update customer]","","",""
"","29735","Create order with 5 product","sales-portal-ui","Thu Dec 25 21:55:45 UTC 2025","passed","Thu Dec 25 21:56:15 UTC 2025","[UI][Orders][Create Order]","","",""
"","2994","Create product with 40 character length in name","sales-portal-api","Thu Dec 25 21:54:21 UTC 2025","passed","Thu Dec 25 21:54:24 UTC 2025","[API][Products] > [Create product]","","",""
"","6981","Order status transition from Draft with delivery to Canceled","sales-portal-api","Thu Dec 25 21:51:48 UTC 2025","passed","Thu Dec 25 21:51:55 UTC 2025","[API][Orders][Positive Orders statuses transition]","","",""
"","186","Successfully update with future date [2]","sales-portal-api","Thu Dec 25 21:51:37 UTC 2025","passed","Thu Dec 25 21:51:37 UTC 2025","[API][Orders][Delivery] > [Add Delivery Info]","","",""
"","30946","Should NOT receive products: Invalid product id: UUID string","sales-portal-api","Thu Dec 25 21:53:08 UTC 2025","passed","Thu Dec 25 21:53:39 UTC 2025","[API][Orders][Receive] > [Negative][Invalid request body]","","",""
"","21912","Processing: receive 3 products (becomes Partially Received)","sales-portal-api","Thu Dec 25 21:52:38 UTC 2025","passed","Thu Dec 25 21:53:00 UTC 2025","[API][Orders][Receive] > [Positive][Receive order]","","",""
"","6904","Should NOT assign manager with non-existing managerId","sales-portal-api","Thu Dec 25 21:51:16 UTC 2025","passed","Thu Dec 25 21:51:23 UTC 2025","[API][Orders][Assign/Unassign Manager - Negative DDT] > Order in Received status","","",""
"","31367","Draft order with delivery: can process","sales-portal-ui","Thu Dec 25 21:57:10 UTC 2025","broken","Thu Dec 25 21:57:41 UTC 2025","[UI][Orders][Order Details]","","",""
"","790","404 returned for non-existing id of valid format","sales-portal-api","Thu Dec 25 21:54:37 UTC 2025","passed","Thu Dec 25 21:54:38 UTC 2025","[API][Products] > [Should Not Delete Product]","","",""
"","14948","Should NOT update manager with non-existing orderId","sales-portal-api","Thu Dec 25 21:50:50 UTC 2025","passed","Thu Dec 25 21:51:05 UTC 2025","[API][Orders][Assign/Unassign Manager - Negative DDT] > Order in Partially Received status","","",""
"","180","CST-003: GET /api/customers?country Filter customers by France","sales-portal-api","Thu Dec 25 21:49:48 UTC 2025","passed","Thu Dec 25 21:49:48 UTC 2025","CST-003 Get customers list (Filter by Country)","","",""
"","730","41 character name product not created","sales-portal-api","Thu Dec 25 21:54:37 UTC 2025","passed","Thu Dec 25 21:54:38 UTC 2025","[API][Products] > [Should NOT create product]","","",""
"","129","Empty comment is rejected","sales-portal-api","Thu Dec 25 21:51:07 UTC 2025","passed","Thu Dec 25 21:51:07 UTC 2025","[API][Orders][Comment] > Not create","","",""
"","7857","Remove manager from order","sales-portal-api","Thu Dec 25 21:49:53 UTC 2025","passed","Thu Dec 25 21:50:01 UTC 2025","[API][Orders][Manager assignment flow] > Order in Partially Received status","","",""
"","6968","Update price to 0 — bad request","sales-portal-api","Thu Dec 25 21:55:04 UTC 2025","passed","Thu Dec 25 21:55:11 UTC 2025","[API][Products] > [Should NOT update product]","","",""
"","660","Missing condition field [1]","sales-portal-api","Thu Dec 25 21:51:36 UTC 2025","passed","Thu Dec 25 21:51:37 UTC 2025","[API][Orders][Delivery] > [Add Delivery Info] > [Should NOT add Delivery Info]","","",""
"","8964","Remove manager from order","sales-portal-api","Thu Dec 25 21:50:53 UTC 2025","passed","Thu Dec 25 21:51:02 UTC 2025","[API][Orders][Manager assignment flow] > Order in Canceled status","","",""
"","2931","Negative price product not created","sales-portal-api","Thu Dec 25 21:54:27 UTC 2025","passed","Thu Dec 25 21:54:30 UTC 2025","[API][Products] > [Should NOT create product]","","",""
"","16601","Should close modal whith close button","sales-portal-ui","Thu Dec 25 21:55:45 UTC 2025","passed","Thu Dec 25 21:56:02 UTC 2025","[UI][Orders][Create Order]","","",""
"","1076","Update street with empty string — bad request","sales-portal-api","Thu Dec 25 21:49:52 UTC 2025","passed","Thu Dec 25 21:49:53 UTC 2025","[API][Customers] > [Should NOT update customer]","","",""
"","142","404 returned for non-existing id of valid format","sales-portal-api","Thu Dec 25 21:51:44 UTC 2025","passed","Thu Dec 25 21:51:44 UTC 2025","[API] [Sales Portal] [Orders] [Get By Id] > [Negative]","","",""
"","11962","Update manager to another manager","sales-portal-api","Thu Dec 25 21:50:41 UTC 2025","passed","Thu Dec 25 21:50:53 UTC 2025","[API][Orders][Manager assignment flow] > Order in Canceled status","","",""
"","4787","Negative house number [7]","sales-portal-api","Thu Dec 25 21:51:59 UTC 2025","passed","Thu Dec 25 21:52:04 UTC 2025","[API][Orders][Delivery] > [Add Delivery Info] > [Should NOT add Delivery Info]","","",""
"","301","Create customer with 10 characters length in phone","sales-portal-api","Thu Dec 25 21:49:44 UTC 2025","passed","Thu Dec 25 21:49:44 UTC 2025","[API][Customers][Create Customer] > Positive DDT","","",""
"","359","Empty street [10]","sales-portal-api","Thu Dec 25 21:51:45 UTC 2025","passed","Thu Dec 25 21:51:45 UTC 2025","[API][Orders][Delivery] > [Add Delivery Info] > [Should NOT add Delivery Info]","","",""
"","12034","Should NOT assign manager with non-existing managerId","sales-portal-api","Thu Dec 25 21:50:11 UTC 2025","passed","Thu Dec 25 21:50:23 UTC 2025","[API][Orders][Assign/Unassign Manager - Negative DDT] > Order in Partially Received status","","",""
"","126","401 returned for request without token","sales-portal-api","Thu Dec 25 21:54:38 UTC 2025","passed","Thu Dec 25 21:54:38 UTC 2025","[API] [Sales Portal] [Products] [Get All] > [Negative]","","",""
"","935","Update notes with < or > symbols — bad request","sales-portal-api","Thu Dec 25 21:49:51 UTC 2025","passed","Thu Dec 25 21:49:52 UTC 2025","[API][Customers] > [Should NOT update customer]","","",""
"","6963","Update amount to minimum (0)","sales-portal-api","Thu Dec 25 21:55:09 UTC 2025","passed","Thu Dec 25 21:55:16 UTC 2025","[API][Products] > [Update product]","","",""
"","12781","Should close modal whith cancel button","sales-portal-ui","Thu Dec 25 21:55:45 UTC 2025","passed","Thu Dec 25 21:55:58 UTC 2025","[UI][Orders][Create Order]","","",""
"","11987","Should NOT update manager with non-existing orderId","sales-portal-api","Thu Dec 25 21:50:13 UTC 2025","passed","Thu Dec 25 21:50:25 UTC 2025","[API][Orders][Assign/Unassign Manager - Negative DDT] > Order in Received status","","",""
"","1045","Update with invalid email format — bad request","sales-portal-api","Thu Dec 25 21:49:52 UTC 2025","passed","Thu Dec 25 21:49:53 UTC 2025","[API][Customers] > [Should NOT update customer]","","",""
"","2011","Create product with empty notes","sales-portal-api","Thu Dec 25 21:54:30 UTC 2025","passed","Thu Dec 25 21:54:32 UTC 2025","[API][Products] > [Create product]","","",""
"","1954","Delete existing comment","sales-portal-api","Thu Dec 25 21:51:21 UTC 2025","passed","Thu Dec 25 21:51:23 UTC 2025","[API][Orders][Comment] > Delete","","",""
"","164","CST-003: GET /api/customers?country Filter customers by Canada","sales-portal-api","Thu Dec 25 21:49:47 UTC 2025","passed","Thu Dec 25 21:49:47 UTC 2025","CST-003 Get customers list (Filter by Country)","","",""
"","451","Create customer with 1 character length in flat","sales-portal-api","Thu Dec 25 21:49:42 UTC 2025","passed","Thu Dec 25 21:49:43 UTC 2025","[API][Customers][Create Customer] > Positive DDT","","",""
"","31513","Draft with delivery: process via header triggers receiving","sales-portal-ui","Thu Dec 25 21:57:30 UTC 2025","broken","Thu Dec 25 21:58:02 UTC 2025","[UI][Orders][Order Details]","","",""
"","8000","Should NOT update manager with non-existing orderId","sales-portal-api","Thu Dec 25 21:51:11 UTC 2025","passed","Thu Dec 25 21:51:19 UTC 2025","[API][Orders][Assign/Unassign Manager - Negative DDT] > Order in Canceled status","","",""
"","1007","Update phone to valid format","sales-portal-api","Thu Dec 25 21:49:49 UTC 2025","passed","Thu Dec 25 21:49:50 UTC 2025","[API][Customers] > [Update customer]","","",""
"","20814","ORD-PUT-012: Cannot delete linked product/customer until order is deleted","sales-portal-api","Thu Dec 25 21:53:49 UTC 2025","passed","Thu Dec 25 21:54:10 UTC 2025","[API][Orders] > [Update order]","","",""
"","7952","404 returned for non-existing customer","sales-portal-api","Thu Dec 25 21:54:10 UTC 2025","passed","Thu Dec 25 21:54:18 UTC 2025","[API][Orders] > [Should NOT update order]","","",""
"","5901","Create product with 1 space in name","sales-portal-api","Thu Dec 25 21:54:24 UTC 2025","passed","Thu Dec 25 21:54:30 UTC 2025","[API][Products] > [Create product]","","",""
"","7948","Should NOT unassign manager from order with non-existing orderId","sales-portal-api","Thu Dec 25 21:51:19 UTC 2025","passed","Thu Dec 25 21:51:27 UTC 2025","[API][Orders][Assign/Unassign Manager - Negative DDT] > Order in Canceled status","","",""
"","438","Should NOT create customer with existing email","sales-portal-api","Thu Dec 25 21:49:44 UTC 2025","passed","Thu Dec 25 21:49:44 UTC 2025","[API][Customers][Create Customer] > Unique email","","",""
"","618","Update customer name to 40 characters","sales-portal-api","Thu Dec 25 21:49:47 UTC 2025","passed","Thu Dec 25 21:49:48 UTC 2025","[API][Customers] > [Update customer]","","",""
"","12902","Assign manager to order","sales-portal-api","Thu Dec 25 21:50:34 UTC 2025","passed","Thu Dec 25 21:50:47 UTC 2025","[API][Orders][Manager assignment flow] > Order in Partially Received status","","",""
"","1615","404 returned for non-existing id of valid format","sales-portal-api","Thu Dec 25 21:55:27 UTC 2025","failed","Thu Dec 25 21:55:29 UTC 2025","[API][Products] > [Should NOT find product to update]","","",""
"","18958","Should NOT receive products: Invalid product id: null string","sales-portal-api","Thu Dec 25 21:52:49 UTC 2025","passed","Thu Dec 25 21:53:08 UTC 2025","[API][Orders][Receive] > [Negative][Invalid request body]","","",""
"","13007","500 returned on invalid ObjectId format for customer","sales-portal-api","Thu Dec 25 21:54:14 UTC 2025","passed","Thu Dec 25 21:54:27 UTC 2025","[API][Orders] > [Should NOT update order]","","",""
"","206","CST-003: GET /api/customers?country Filter customers by USA","sales-portal-api","Thu Dec 25 21:49:45 UTC 2025","passed","Thu Dec 25 21:49:45 UTC 2025","CST-003 Get customers list (Filter by Country)","","",""
"","849","Too long comment (251) is rejected","sales-portal-api","Thu Dec 25 21:51:11 UTC 2025","passed","Thu Dec 25 21:51:12 UTC 2025","[API][Orders][Comment] > Not create","","",""
"","353","Create customer with 40 characters length in name","sales-portal-api","Thu Dec 25 21:49:44 UTC 2025","passed","Thu Dec 25 21:49:44 UTC 2025","[API][Customers][Create Customer] > Positive DDT","","",""
"","995","Update city with empty string — bad request","sales-portal-api","Thu Dec 25 21:49:49 UTC 2025","passed","Thu Dec 25 21:49:50 UTC 2025","[API][Customers] > [Should NOT update customer]","","",""
"","19250","Create order with 1 product","sales-portal-ui","Thu Dec 25 21:55:46 UTC 2025","passed","Thu Dec 25 21:56:05 UTC 2025","[UI][Orders][Create Order]","","",""
"","394","Create customer with 40 characters length in street","sales-portal-api","Thu Dec 25 21:49:42 UTC 2025","passed","Thu Dec 25 21:49:43 UTC 2025","[API][Customers][Create Customer] > Positive DDT","","",""
"","7977","Update price to minimum (1)","sales-portal-api","Thu Dec 25 21:54:54 UTC 2025","passed","Thu Dec 25 21:55:02 UTC 2025","[API][Products] > [Update product]","","",""
"","194","Comment with '<' is rejected","sales-portal-api","Thu Dec 25 21:51:18 UTC 2025","failed","Thu Dec 25 21:51:19 UTC 2025","[API][Orders][Comment] > Not create","","",""
"","9997","Order status transition from Canceled to Canceled","sales-portal-api","Thu Dec 25 21:51:47 UTC 2025","passed","Thu Dec 25 21:51:57 UTC 2025","[API][Orders][Negative Orders statuses transition]","","",""
"","1604","Update product name to 3 characters","sales-portal-api","Thu Dec 25 21:54:46 UTC 2025","passed","Thu Dec 25 21:54:48 UTC 2025","[API][Products] > [Update product]","","",""
"","9984","Should NOT assign manager with non-existing managerId","sales-portal-api","Thu Dec 25 21:50:29 UTC 2025","passed","Thu Dec 25 21:50:39 UTC 2025","[API][Orders][Assign/Unassign Manager - Negative DDT] > Order in In Process status","","",""
"","6647","Zero flat number [8]","sales-portal-api","Thu Dec 25 21:51:36 UTC 2025","passed","Thu Dec 25 21:51:43 UTC 2025","[API][Orders][Delivery] > [Add Delivery Info] > [Should NOT add Delivery Info]","","",""
"","1135","0 price product not created","sales-portal-api","Thu Dec 25 21:54:26 UTC 2025","passed","Thu Dec 25 21:54:27 UTC 2025","[API][Products] > [Should NOT create product]","","",""
"","133","404 returned for empty id","sales-portal-api","Thu Dec 25 21:54:42 UTC 2025","failed","Thu Dec 25 21:54:42 UTC 2025","[API][Products] > [Should Not Delete Product]","","",""
"","8945","Should NOT assign manager with non-existing orderId","sales-portal-api","Thu Dec 25 21:51:02 UTC 2025","passed","Thu Dec 25 21:51:11 UTC 2025","[API][Orders][Assign/Unassign Manager - Negative DDT] > Order in Canceled status","","",""
"","438","Create customer 250 characters length in notes","sales-portal-api","Thu Dec 25 21:49:44 UTC 2025","passed","Thu Dec 25 21:49:44 UTC 2025","[API][Customers][Create Customer] > Positive DDT","","",""
"","8983","Order status transition from Draft to undefined","sales-portal-api","Thu Dec 25 21:52:13 UTC 2025","passed","Thu Dec 25 21:52:22 UTC 2025","[API][Orders][Invalid Orders statuses]","","",""
"","129","Product without amount not created","sales-portal-api","Thu Dec 25 21:54:27 UTC 2025","passed","Thu Dec 25 21:54:27 UTC 2025","[API][Products] > [Should NOT create product]","","",""
"","953","Update notes with 251 characters — bad request","sales-portal-api","Thu Dec 25 21:49:50 UTC 2025","passed","Thu Dec 25 21:49:51 UTC 2025","[API][Customers] > [Should NOT update customer]","","",""
"","211","CST-003: GET /api/customers?country Filter customers by Ukraine","sales-portal-api","Thu Dec 25 21:49:47 UTC 2025","passed","Thu Dec 25 21:49:48 UTC 2025","CST-003 Get customers list (Filter by Country)","","",""
"","1013","404 returned for non-existing id of valid format","sales-portal-api","Thu Dec 25 21:54:43 UTC 2025","passed","Thu Dec 25 21:54:44 UTC 2025","[API] [Sales Portal] [Products] [Get By Id] > [Negative]","","",""
"","614","Update customer name with mixed case","sales-portal-api","Thu Dec 25 21:49:48 UTC 2025","passed","Thu Dec 25 21:49:48 UTC 2025","[API][Customers] > [Update customer]","","",""
"","2011","Attempt to update product name with existing one returns error","sales-portal-api","Thu Dec 25 21:55:37 UTC 2025","passed","Thu Dec 25 21:55:39 UTC 2025","[API][Products] > Should NOT update with existing name","","",""
"","11999","Update manager to another manager","sales-portal-api","Thu Dec 25 21:50:47 UTC 2025","passed","Thu Dec 25 21:50:59 UTC 2025","[API][Orders][Manager assignment flow] > Order in Partially Received status","","",""
"","1994","Update product name to 40 characters","sales-portal-api","Thu Dec 25 21:54:48 UTC 2025","passed","Thu Dec 25 21:54:50 UTC 2025","[API][Products] > [Update product]","","",""
"","782","Should get customer by valid id","sales-portal-api","Thu Dec 25 21:49:45 UTC 2025","passed","Thu Dec 25 21:49:46 UTC 2025","[API] [Sales Portal] [Customers] [Get By Id] > [Positive]","","",""
