"DESCRIPTION","DURATION IN MS","NAME","PARENT SUITE","START TIME","STATUS","STOP TIME","SUB SUITE","SUITE","TEST CLASS","TEST METHOD"
"","6963","Update amount with non-integer — bad request","sales-portal-api","Thu Dec 25 21:55:12 UTC 2025","passed","Thu Dec 25 21:55:19 UTC 2025","[API][Products] > [Should NOT update product]","","",""
"","14945","ORD-PUT-013: PUT without changes does not add REQUIRED_PRODUCTS_CHANGED history entry","sales-portal-api","Thu Dec 25 21:53:57 UTC 2025","passed","Thu Dec 25 21:54:12 UTC 2025","[API][Orders] > [Update order]","","",""
"","2820","Without manufacturer product not created","sales-portal-api","Thu Dec 25 21:54:27 UTC 2025","passed","Thu Dec 25 21:54:30 UTC 2025","[API][Products] > [Should NOT create product]","","",""
"","6881","Single character city name [3]","sales-portal-api","Thu Dec 25 21:51:37 UTC 2025","passed","Thu Dec 25 21:51:44 UTC 2025","[API][Orders][Delivery] > [Add Delivery Info]","","",""
"","8988","Should NOT update manager with non-existing orderId","sales-portal-api","Thu Dec 25 21:51:03 UTC 2025","passed","Thu Dec 25 21:51:12 UTC 2025","[API][Orders][Assign/Unassign Manager - Negative DDT] > Order in In Process status","","",""
"","3785","Order status transition from Draft to Draft","sales-portal-api","Thu Dec 25 21:51:45 UTC 2025","passed","Thu Dec 25 21:51:49 UTC 2025","[API][Orders][Negative Orders statuses transition]","","",""
"","8627","Should NOT update manager with non-existing managerId","sales-portal-api","Thu Dec 25 21:49:57 UTC 2025","passed","Thu Dec 25 21:50:06 UTC 2025","[API][Orders][Assign/Unassign Manager - Negative DDT] > Order in Draft status","","",""
"","10943","Should NOT unassign manager from order with non-existing orderId","sales-portal-api","Thu Dec 25 21:51:05 UTC 2025","passed","Thu Dec 25 21:51:16 UTC 2025","[API][Orders][Assign/Unassign Manager - Negative DDT] > Order in Partially Received status","","",""
"","1864","Not integer amount product not created","sales-portal-api","Thu Dec 25 21:54:30 UTC 2025","passed","Thu Dec 25 21:54:32 UTC 2025","[API][Products] > [Should NOT create product]","","",""
"","8975","Should NOT unassign manager from order with non-existing orderId","sales-portal-api","Thu Dec 25 21:50:01 UTC 2025","passed","Thu Dec 25 21:50:10 UTC 2025","[API][Orders][Assign/Unassign Manager - Negative DDT] > Order in In Process status","","",""
"","1395","Update flat with negative number — bad request","sales-portal-api","Thu Dec 25 21:49:56 UTC 2025","passed","Thu Dec 25 21:49:58 UTC 2025","[API][Customers] > [Should NOT update customer]","","",""
"","31933","Processing: receive 5 products (becomes Received)","sales-portal-api","Thu Dec 25 21:53:00 UTC 2025","passed","Thu Dec 25 21:53:32 UTC 2025","[API][Orders][Receive] > [Positive][Receive order]","","",""
"","5010","Order status transition from Draft to 12345","sales-portal-api","Thu Dec 25 21:52:07 UTC 2025","passed","Thu Dec 25 21:52:12 UTC 2025","[API][Orders][Invalid Orders statuses]","","",""
"","3926","Update notes to 250 characters","sales-portal-api","Thu Dec 25 21:54:51 UTC 2025","passed","Thu Dec 25 21:54:55 UTC 2025","[API][Products] > [Update product]","","",""
"","2006","Create product with 0 amount","sales-portal-api","Thu Dec 25 21:54:35 UTC 2025","passed","Thu Dec 25 21:54:37 UTC 2025","[API][Products] > [Create product]","","",""
"","10597","Should NOT assign manager with non-existing orderId","sales-portal-api","Thu Dec 25 21:50:02 UTC 2025","passed","Thu Dec 25 21:50:13 UTC 2025","[API][Orders][Assign/Unassign Manager - Negative DDT] > Order in Received status","","",""
"","4955","Update name with double spaces — bad request","sales-portal-api","Thu Dec 25 21:54:52 UTC 2025","passed","Thu Dec 25 21:54:57 UTC 2025","[API][Products] > [Should NOT update product]","","",""
