"DESCRIPTION","DURATION IN MS","NAME","PARENT SUITE","START TIME","STATUS","STOP TIME","SUB SUITE","SUITE","TEST CLASS","TEST METHOD"
"","12988","Order status transition from Partially Received to Canceled","sales-portal-api","Thu Dec 25 21:51:54 UTC 2025","passed","Thu Dec 25 21:52:07 UTC 2025","[API][Orders][Negative Orders statuses transition]","","",""
"","471","Create customer with upper-case street","sales-portal-api","Thu Dec 25 21:49:43 UTC 2025","passed","Thu Dec 25 21:49:44 UTC 2025","[API][Customers][Create Customer] > Positive DDT","","",""
"","2884","Update notes with < or > — bad request","sales-portal-api","Thu Dec 25 21:55:24 UTC 2025","passed","Thu Dec 25 21:55:27 UTC 2025","[API][Products] > [Should NOT update product]","","",""
"","2001","Create product with 1 price","sales-portal-api","Thu Dec 25 21:54:30 UTC 2025","passed","Thu Dec 25 21:54:32 UTC 2025","[API][Products] > [Create product]","","",""
"","2038","Name with 2 spaces product not created","sales-portal-api","Thu Dec 25 21:54:18 UTC 2025","passed","Thu Dec 25 21:54:20 UTC 2025","[API][Products] > [Should NOT create product]","","",""
"","162","Missing finalDate field [0]","sales-portal-api","Thu Dec 25 21:51:28 UTC 2025","passed","Thu Dec 25 21:51:28 UTC 2025","[API][Orders][Delivery] > [Add Delivery Info] > [Should NOT add Delivery Info]","","",""
"","475","Create customer with 1 character length in name","sales-portal-api","Thu Dec 25 21:49:43 UTC 2025","passed","Thu Dec 25 21:49:43 UTC 2025","[API][Customers][Create Customer] > Positive DDT","","",""
"","813","Invalid condition value [4]","sales-portal-api","Thu Dec 25 21:51:35 UTC 2025","passed","Thu Dec 25 21:51:36 UTC 2025","[API][Orders][Delivery] > [Add Delivery Info] > [Should NOT add Delivery Info]","","",""
"","389","Special characters in street [14]","sales-portal-api","Thu Dec 25 21:51:46 UTC 2025","passed","Thu Dec 25 21:51:46 UTC 2025","[API][Orders][Delivery] > [Add Delivery Info] > [Should NOT add Delivery Info]","","",""
"","9973","Assign manager to order","sales-portal-api","Thu Dec 25 21:50:05 UTC 2025","passed","Thu Dec 25 21:50:15 UTC 2025","[API][Orders][Manager assignment flow] > Order in In Process status","","",""
"","20923","Should NOT receive products: Empty products array","sales-portal-api","Thu Dec 25 21:52:27 UTC 2025","passed","Thu Dec 25 21:52:48 UTC 2025","[API][Orders][Receive] > [Negative][Invalid request body]","","",""
"","1085","Successfully set delivery info with all required fields [0]","sales-portal-api","Thu Dec 25 21:51:28 UTC 2025","passed","Thu Dec 25 21:51:29 UTC 2025","[API][Orders][Delivery] > [Add Delivery Info]","","",""
"","1825","Update name with empty string — bad request","sales-portal-api","Thu Dec 25 21:49:55 UTC 2025","passed","Thu Dec 25 21:49:57 UTC 2025","[API][Customers] > [Should NOT update customer]","","",""
"","31937","Should NOT receive products: Invalid product id: negative value string","sales-portal-api","Thu Dec 25 21:53:14 UTC 2025","passed","Thu Dec 25 21:53:46 UTC 2025","[API][Orders][Receive] > [Negative][Invalid request body]","","",""
"","3944","404 returned for empty id","sales-portal-api","Thu Dec 25 21:55:08 UTC 2025","failed","Thu Dec 25 21:55:12 UTC 2025","[API][Products] > [Should NOT find product to update]","","",""
"","5950","404 returned for non-existing order","sales-portal-api","Thu Dec 25 21:53:57 UTC 2025","passed","Thu Dec 25 21:54:03 UTC 2025","[API][Orders] > [Should NOT update order]","","",""
"","1934","Invalid ID format rejected","sales-portal-api","Thu Dec 25 21:51:12 UTC 2025","passed","Thu Dec 25 21:51:14 UTC 2025","[API][Orders][Comment] > Not delete","","",""
"","967","404 returned for empty id","sales-portal-api","Thu Dec 25 21:54:50 UTC 2025","failed","Thu Dec 25 21:54:51 UTC 2025","[API] [Sales Portal] [Products] [Get By Id] > [Negative]","","",""
"","25048","Should NOT receive products: Invalid product id: dummy string","sales-portal-api","Thu Dec 25 21:52:42 UTC 2025","passed","Thu Dec 25 21:53:07 UTC 2025","[API][Orders][Receive] > [Negative][Invalid request body]","","",""
"","6951","401 returned without token","sales-portal-api","Thu Dec 25 21:54:10 UTC 2025","passed","Thu Dec 25 21:54:17 UTC 2025","[API][Orders] > [Should NOT update order]","","",""
"","1966","Empty name product not created","sales-portal-api","Thu Dec 25 21:54:24 UTC 2025","passed","Thu Dec 25 21:54:26 UTC 2025","[API][Products] > [Should NOT create product]","","",""
"","177","Add 1-char comment","sales-portal-api","Thu Dec 25 21:50:59 UTC 2025","passed","Thu Dec 25 21:50:59 UTC 2025","[API][Orders][Comment] > Create","","",""
"","13010","Should NOT update manager with non-existing managerId","sales-portal-api","Thu Dec 25 21:51:23 UTC 2025","passed","Thu Dec 25 21:51:36 UTC 2025","[API][Orders][Assign/Unassign Manager - Negative DDT] > Order in Received status","","",""
"","3701","Update with 41 character name — bad request","sales-portal-api","Thu Dec 25 21:54:48 UTC 2025","passed","Thu Dec 25 21:54:52 UTC 2025","[API][Products] > [Should NOT update product]","","",""
"","38983","Should NOT receive products: Product id with non-existing id","sales-portal-api","Thu Dec 25 21:53:17 UTC 2025","passed","Thu Dec 25 21:53:56 UTC 2025","[API][Orders][Receive] > [Negative][Invalid request body]","","",""
"","1016","Update street to valid format","sales-portal-api","Thu Dec 25 21:49:49 UTC 2025","passed","Thu Dec 25 21:49:50 UTC 2025","[API][Customers] > [Update customer]","","",""
"","5929","Invalid date format [5]","sales-portal-api","Thu Dec 25 21:51:38 UTC 2025","passed","Thu Dec 25 21:51:44 UTC 2025","[API][Orders][Delivery] > [Add Delivery Info] > [Should NOT add Delivery Info]","","",""
"","1936","Non-existing commentId rejected","sales-portal-api","Thu Dec 25 21:51:26 UTC 2025","passed","Thu Dec 25 21:51:28 UTC 2025","[API][Orders][Comment] > Not delete","","",""
"","837","Update city to 20 characters","sales-portal-api","Thu Dec 25 21:49:51 UTC 2025","passed","Thu Dec 25 21:49:52 UTC 2025","[API][Customers] > [Update customer]","","",""
"","2004","Not integer price product not created","sales-portal-api","Thu Dec 25 21:54:30 UTC 2025","passed","Thu Dec 25 21:54:32 UTC 2025","[API][Products] > [Should NOT create product]","","",""
"","3853","Update manager to another manager","sales-portal-api","Thu Dec 25 21:49:55 UTC 2025","passed","Thu Dec 25 21:49:59 UTC 2025","[API][Orders][Manager assignment flow] > Order in Draft status","","",""
"","4534","Update city with 21 characters — bad request","sales-portal-api","Thu Dec 25 21:49:58 UTC 2025","passed","Thu Dec 25 21:50:02 UTC 2025","[API][Customers] > [Should NOT update customer]","","",""
"","911","Negative amount product not created","sales-portal-api","Thu Dec 25 21:54:32 UTC 2025","passed","Thu Dec 25 21:54:33 UTC 2025","[API][Products] > [Should NOT create product]","","",""
"","657","Create customer with 3 characters length in house","sales-portal-api","Thu Dec 25 21:49:44 UTC 2025","passed","Thu Dec 25 21:49:45 UTC 2025","[API][Customers][Create Customer] > Positive DDT","","",""
"","3973","Create product with 250 notes","sales-portal-api","Thu Dec 25 21:54:21 UTC 2025","passed","Thu Dec 25 21:54:25 UTC 2025","[API][Products] > [Create product]","","",""
"","2029","1000 amount product not created","sales-portal-api","Thu Dec 25 21:54:33 UTC 2025","passed","Thu Dec 25 21:54:35 UTC 2025","[API][Products] > [Should NOT create product]","","",""
"","5987","Remove manager from order","sales-portal-api","Thu Dec 25 21:49:59 UTC 2025","passed","Thu Dec 25 21:50:05 UTC 2025","[API][Orders][Manager assignment flow] > Order in Draft status","","",""
"","32563","In Process: select all and save receiving marks all received","sales-portal-ui","Thu Dec 25 21:58:47 UTC 2025","broken","Thu Dec 25 21:59:20 UTC 2025","[UI][Orders][Order Details]","","",""
"","3786","Create product with 999 amount","sales-portal-api","Thu Dec 25 21:54:17 UTC 2025","passed","Thu Dec 25 21:54:21 UTC 2025","[API][Products] > [Create product]","","",""
"","2766","Assign manager to order","sales-portal-api","Thu Dec 25 21:49:52 UTC 2025","passed","Thu Dec 25 21:49:55 UTC 2025","[API][Orders][Manager assignment flow] > Order in Draft status","","",""
"","3953","Delete product","sales-portal-api","Thu Dec 25 21:54:42 UTC 2025","failed","Thu Dec 25 21:54:46 UTC 2025","[API][Products] > [Delete Product]","","",""
"","5925","Order status transition from Draft to","sales-portal-api","Thu Dec 25 21:52:12 UTC 2025","passed","Thu Dec 25 21:52:18 UTC 2025","[API][Orders][Invalid Orders statuses]","","",""
"","7957","Remove manager from order","sales-portal-api","Thu Dec 25 21:50:26 UTC 2025","passed","Thu Dec 25 21:50:34 UTC 2025","[API][Orders][Manager assignment flow] > Order in In Process status","","",""
"","4743","Delete order with product quantity = 1 (min)","sales-portal-api","Thu Dec 25 21:51:23 UTC 2025","passed","Thu Dec 25 21:51:28 UTC 2025","[API][Orders][Delete Order]","","",""
"","438","Empty city [9]","sales-portal-api","Thu Dec 25 21:51:44 UTC 2025","passed","Thu Dec 25 21:51:45 UTC 2025","[API][Orders][Delivery] > [Add Delivery Info] > [Should NOT add Delivery Info]","","",""
"","12988","ORD-PUT-004: History entry recorded when order composition changes","sales-portal-api","Thu Dec 25 21:53:48 UTC 2025","passed","Thu Dec 25 21:54:01 UTC 2025","[API][Orders] > [Update order]","","",""
"","5002","Should return list of all products","sales-portal-api","Thu Dec 25 21:54:38 UTC 2025","passed","Thu Dec 25 21:54:43 UTC 2025","[API] [Sales Portal] [Products] [Get All] > [Positive]","","",""
"","1940","100000 price product not created","sales-portal-api","Thu Dec 25 21:54:23 UTC 2025","passed","Thu Dec 25 21:54:25 UTC 2025","[API][Products] > [Should NOT create product]","","",""
"","6956","Update amount to negative — bad request","sales-portal-api","Thu Dec 25 21:54:58 UTC 2025","passed","Thu Dec 25 21:55:05 UTC 2025","[API][Products] > [Should NOT update product]","","",""
"","11918","Create order with product quantity = 5 (max)","sales-portal-api","Thu Dec 25 21:51:21 UTC 2025","passed","Thu Dec 25 21:51:33 UTC 2025","[API][Orders][Create Order] > Positive DDT","","",""
"","6966","Should NOT assign manager with non-existing orderId","sales-portal-api","Thu Dec 25 21:50:06 UTC 2025","passed","Thu Dec 25 21:50:13 UTC 2025","[API][Orders][Assign/Unassign Manager - Negative DDT] > Order in Draft status","","",""
"","987","Update name with special characters — bad request","sales-portal-api","Thu Dec 25 21:49:51 UTC 2025","passed","Thu Dec 25 21:49:52 UTC 2025","[API][Customers] > [Should NOT update customer]","","",""
"","8922","Order status transition from Draft to In Process","sales-portal-api","Thu Dec 25 21:51:49 UTC 2025","passed","Thu Dec 25 21:51:58 UTC 2025","[API][Orders][Negative Orders statuses transition]","","",""
"","325","Create customer with with upper-case city","sales-portal-api","Thu Dec 25 21:49:44 UTC 2025","passed","Thu Dec 25 21:49:44 UTC 2025","[API][Customers][Create Customer] > Positive DDT","","",""
"","14370","Check remove product from order before creation","sales-portal-ui","Thu Dec 25 21:56:09 UTC 2025","passed","Thu Dec 25 21:56:24 UTC 2025","[UI][Orders][Create Order]","","",""
"","6980","Update amount to 1000 — bad request","sales-portal-api","Thu Dec 25 21:55:05 UTC 2025","passed","Thu Dec 25 21:55:12 UTC 2025","[API][Products] > [Should NOT update product]","","",""
"","8304","Order status transition from Partially Received to In Process","sales-portal-api","Thu Dec 25 21:51:45 UTC 2025","passed","Thu Dec 25 21:51:54 UTC 2025","[API][Orders][Negative Orders statuses transition]","","",""
"","958","Update street with 41 characters — bad request","sales-portal-api","Thu Dec 25 21:49:51 UTC 2025","passed","Thu Dec 25 21:49:52 UTC 2025","[API][Customers] > [Should NOT update customer]","","",""
"","447","Create customer with 4 characters length in flat","sales-portal-api","Thu Dec 25 21:49:44 UTC 2025","passed","Thu Dec 25 21:49:44 UTC 2025","[API][Customers][Create Customer] > Positive DDT","","",""
"","973","Update email to valid format","sales-portal-api","Thu Dec 25 21:49:48 UTC 2025","passed","Thu Dec 25 21:49:49 UTC 2025","[API][Customers] > [Update customer]","","",""
"","7029","Update price to 100000 — bad request","sales-portal-api","Thu Dec 25 21:55:11 UTC 2025","passed","Thu Dec 25 21:55:18 UTC 2025","[API][Products] > [Should NOT update product]","","",""
"","6907","Update name with special characters — bad request","sales-portal-api","Thu Dec 25 21:54:57 UTC 2025","passed","Thu Dec 25 21:55:04 UTC 2025","[API][Products] > [Should NOT update product]","","",""
"","7912","Assign manager to order","sales-portal-api","Thu Dec 25 21:50:01 UTC 2025","passed","Thu Dec 25 21:50:09 UTC 2025","[API][Orders][Manager assignment flow] > Order in Received status","","",""
"","8799","Order status transition from Received to Draft","sales-portal-api","Thu Dec 25 21:52:07 UTC 2025","passed","Thu Dec 25 21:52:16 UTC 2025","[API][Orders][Negative Orders statuses transition]","","",""
"","12943","Should NOT assign manager with non-existing orderId","sales-portal-api","Thu Dec 25 21:50:37 UTC 2025","passed","Thu Dec 25 21:50:50 UTC 2025","[API][Orders][Assign/Unassign Manager - Negative DDT] > Order in Partially Received status","","",""
"","2807","Update amount to maximum (999)","sales-portal-api","Thu Dec 25 21:54:48 UTC 2025","passed","Thu Dec 25 21:54:51 UTC 2025","[API][Products] > [Update product]","","",""
"","2888","Should NOT change order status with non-existing orderId","sales-portal-api","Thu Dec 25 21:52:22 UTC 2025","passed","Thu Dec 25 21:52:25 UTC 2025","[API][Orders][Invalid Orders statuses]","","",""
"","410","Create customer with 20 characters length in city","sales-portal-api","Thu Dec 25 21:49:44 UTC 2025","passed","Thu Dec 25 21:49:44 UTC 2025","[API][Customers][Create Customer] > Positive DDT","","",""
"","1010","Product without price not created","sales-portal-api","Thu Dec 25 21:54:26 UTC 2025","passed","Thu Dec 25 21:54:27 UTC 2025","[API][Products] > [Should NOT create product]","","",""
"","12934","Should NOT update manager with non-existing managerId","sales-portal-api","Thu Dec 25 21:50:49 UTC 2025","passed","Thu Dec 25 21:51:02 UTC 2025","[API][Orders][Assign/Unassign Manager - Negative DDT] > Order in Canceled status","","",""
"","370","Exceeded Max length city name (>20 chars) [11]","sales-portal-api","Thu Dec 25 21:51:45 UTC 2025","passed","Thu Dec 25 21:51:45 UTC 2025","[API][Orders][Delivery] > [Add Delivery Info] > [Should NOT add Delivery Info]","","",""
"","798","Update house number","sales-portal-api","Thu Dec 25 21:49:50 UTC 2025","passed","Thu Dec 25 21:49:51 UTC 2025","[API][Customers] > [Update customer]","","",""
"","6980","Should NOT update manager with non-existing orderId","sales-portal-api","Thu Dec 25 21:50:13 UTC 2025","passed","Thu Dec 25 21:50:20 UTC 2025","[API][Orders][Assign/Unassign Manager - Negative DDT] > Order in Draft status","","",""
"","7992","Update with 2 character name — bad request","sales-portal-api","Thu Dec 25 21:55:16 UTC 2025","passed","Thu Dec 25 21:55:24 UTC 2025","[API][Products] > [Should NOT update product]","","",""
"","17018","ORD-PUT-002: Successful update of customer in order","sales-portal-api","Thu Dec 25 21:53:32 UTC 2025","passed","Thu Dec 25 21:53:49 UTC 2025","[API][Orders] > [Update order]","","",""
"","691","Clear notes (empty string)","sales-portal-api","Thu Dec 25 21:49:53 UTC 2025","passed","Thu Dec 25 21:49:53 UTC 2025","[API][Customers] > [Update customer]","","",""
"","996","400 returned for id of invalid format","sales-portal-api","Thu Dec 25 21:54:44 UTC 2025","failed","Thu Dec 25 21:54:45 UTC 2025","[API][Products] > [Should Not Delete Product]","","",""
"","22944","ORD-PUT-001: Successful products update recalculates total_price","sales-portal-api","Thu Dec 25 21:53:25 UTC 2025","passed","Thu Dec 25 21:53:48 UTC 2025","[API][Orders] > [Update order]","","",""
"","962","251 notes product not created","sales-portal-api","Thu Dec 25 21:54:32 UTC 2025","passed","Thu Dec 25 21:54:33 UTC 2025","[API][Products] > [Should NOT create product]","","",""
"","365","Exeeded Max house number (>999) [13]","sales-portal-api","Thu Dec 25 21:51:45 UTC 2025","passed","Thu Dec 25 21:51:46 UTC 2025","[API][Orders][Delivery] > [Add Delivery Info] > [Should NOT add Delivery Info]","","",""
"","144","500 returned for id of invalid format (CastError from backend)","sales-portal-api","Thu Dec 25 21:51:45 UTC 2025","passed","Thu Dec 25 21:51:45 UTC 2025","[API] [Sales Portal] [Orders] [Get By Id] > [Negative]","","",""
"","4909","Order status transition from Draft to testStatus","sales-portal-api","Thu Dec 25 21:52:05 UTC 2025","passed","Thu Dec 25 21:52:10 UTC 2025","[API][Orders][Invalid Orders statuses]","","",""
"","1961","Update phone with invalid format — bad request","sales-portal-api","Thu Dec 25 21:49:54 UTC 2025","passed","Thu Dec 25 21:49:56 UTC 2025","[API][Customers] > [Should NOT update customer]","","",""
"","9970","Update manager to another manager","sales-portal-api","Thu Dec 25 21:50:09 UTC 2025","passed","Thu Dec 25 21:50:19 UTC 2025","[API][Orders][Manager assignment flow] > Order in Received status","","",""
"","194","Comment with '>' is rejected","sales-portal-api","Thu Dec 25 21:51:18 UTC 2025","failed","Thu Dec 25 21:51:19 UTC 2025","[API][Orders][Comment] > Not create","","",""
"","414","Create customer with 1 character length in city","sales-portal-api","Thu Dec 25 21:49:43 UTC 2025","passed","Thu Dec 25 21:49:43 UTC 2025","[API][Customers][Create Customer] > Positive DDT","","",""
"","450","create storage state for authenticated user","setup","Thu Dec 25 21:55:43 UTC 2025","passed","Thu Dec 25 21:55:43 UTC 2025","","","",""
"","5969","Should NOT assign manager with non-existing managerId","sales-portal-api","Thu Dec 25 21:51:02 UTC 2025","passed","Thu Dec 25 21:51:08 UTC 2025","[API][Orders][Assign/Unassign Manager - Negative DDT] > Order in Draft status","","",""
"","9946","Should NOT assign manager with non-existing orderId","sales-portal-api","Thu Dec 25 21:50:53 UTC 2025","passed","Thu Dec 25 21:51:03 UTC 2025","[API][Orders][Assign/Unassign Manager - Negative DDT] > Order in In Process status","","",""
"","1945","Name with special characters product not created","sales-portal-api","Thu Dec 25 21:54:21 UTC 2025","passed","Thu Dec 25 21:54:23 UTC 2025","[API][Products] > [Should NOT create product]","","",""
"","535","Create customer with 1 character length in street","sales-portal-api","Thu Dec 25 21:49:44 UTC 2025","passed","Thu Dec 25 21:49:45 UTC 2025","[API][Customers][Create Customer] > Positive DDT","","",""
"","2952","Order status transition from Draft with delivery to In Process","sales-portal-api","Thu Dec 25 21:51:45 UTC 2025","passed","Thu Dec 25 21:51:48 UTC 2025","[API][Orders][Positive Orders statuses transition]","","",""
"","9947","Order status transition from In Process to Canceled","sales-portal-api","Thu Dec 25 21:52:10 UTC 2025","passed","Thu Dec 25 21:52:20 UTC 2025","[API][Orders][Positive Orders statuses transition]","","",""
"","133","404 returned for non-existing id of valid format","sales-portal-api","Thu Dec 25 21:49:45 UTC 2025","passed","Thu Dec 25 21:49:45 UTC 2025","[API] [Sales Portal] [Customers] [Get By Id] > [Negative]","","",""
"","352","CST-003: GET /api/customers?country Filter customers by Russia","sales-portal-api","Thu Dec 25 21:49:48 UTC 2025","passed","Thu Dec 25 21:49:48 UTC 2025","CST-003 Get customers list (Filter by Country)","","",""
"","1837","Update full customer data","sales-portal-api","Thu Dec 25 21:49:53 UTC 2025","passed","Thu Dec 25 21:49:55 UTC 2025","[API][Customers] > [Update customer]","","",""
"","31511","Draft order without delivery: header buttons and pencils","sales-portal-ui","Thu Dec 25 21:57:06 UTC 2025","broken","Thu Dec 25 21:57:38 UTC 2025","[UI][Orders][Order Details]","","",""
"","29962","Should NOT receive products: More than 5 products in request","sales-portal-api","Thu Dec 25 21:52:55 UTC 2025","passed","Thu Dec 25 21:53:25 UTC 2025","[API][Orders][Receive] > [Negative][Invalid request body]","","",""
"","1435","Update name with 41 characters — bad request","sales-portal-api","Thu Dec 25 21:49:49 UTC 2025","passed","Thu Dec 25 21:49:51 UTC 2025","[API][Customers] > [Should NOT update customer]","","",""
"","10971","Update manager to another manager","sales-portal-api","Thu Dec 25 21:50:15 UTC 2025","passed","Thu Dec 25 21:50:26 UTC 2025","[API][Orders][Manager assignment flow] > Order in In Process status","","",""
"","8949","Should NOT unassign manager from order with non-existing orderId","sales-portal-api","Thu Dec 25 21:50:20 UTC 2025","passed","Thu Dec 25 21:50:29 UTC 2025","[API][Orders][Assign/Unassign Manager - Negative DDT] > Order in Draft status","","",""
"","2937","Create product with 99999 price","sales-portal-api","Thu Dec 25 21:54:32 UTC 2025","passed","Thu Dec 25 21:54:35 UTC 2025","[API][Products] > [Create product]","","",""
"","805","Update flat number","sales-portal-api","Thu Dec 25 21:49:51 UTC 2025","passed","Thu Dec 25 21:49:52 UTC 2025","[API][Customers] > [Update customer]","","",""
"","12961","404 returned for non-existing product id","sales-portal-api","Thu Dec 25 21:54:01 UTC 2025","passed","Thu Dec 25 21:54:14 UTC 2025","[API][Orders] > [Should NOT update order]","","",""
"","13923","400 returned for empty products array","sales-portal-api","Thu Dec 25 21:54:03 UTC 2025","passed","Thu Dec 25 21:54:17 UTC 2025","[API][Orders] > [Should NOT update order]","","",""
"","24005","Should NOT receive products: Invalid product id: date string","sales-portal-api","Thu Dec 25 21:53:46 UTC 2025","passed","Thu Dec 25 21:54:10 UTC 2025","[API][Orders][Receive] > [Negative][Invalid request body]","","",""
"","904","500 returned for id of invalid format","sales-portal-api","Thu Dec 25 21:54:51 UTC 2025","failed","Thu Dec 25 21:54:52 UTC 2025","[API] [Sales Portal] [Products] [Get By Id] > [Negative]","","",""
"","1146","Update house with negative number — bad request","sales-portal-api","Thu Dec 25 21:49:53 UTC 2025","passed","Thu Dec 25 21:49:54 UTC 2025","[API][Customers] > [Should NOT update customer]","","",""
"","13935","Should NOT update manager with non-existing managerId","sales-portal-api","Thu Dec 25 21:50:39 UTC 2025","passed","Thu Dec 25 21:50:53 UTC 2025","[API][Orders][Assign/Unassign Manager - Negative DDT] > Order in In Process status","","",""
"","3769","Create product with 3 character length in name","sales-portal-api","Thu Dec 25 21:54:17 UTC 2025","passed","Thu Dec 25 21:54:21 UTC 2025","[API][Products] > [Create product]","","",""
"","13897","Should NOT update manager with non-existing managerId","sales-portal-api","Thu Dec 25 21:50:23 UTC 2025","passed","Thu Dec 25 21:50:37 UTC 2025","[API][Orders][Assign/Unassign Manager - Negative DDT] > Order in Partially Received status","","",""
"","17947","ORD-PUT-003: Order status is DRAFT after update","sales-portal-api","Thu Dec 25 21:53:39 UTC 2025","passed","Thu Dec 25 21:53:57 UTC 2025","[API][Orders] > [Update order]","","",""
"","32514","In Process: receiving controls visible","sales-portal-ui","Thu Dec 25 21:57:15 UTC 2025","broken","Thu Dec 25 21:57:48 UTC 2025","[UI][Orders][Order Details]","","",""
"","918","Empty comment ID is rejected","sales-portal-api","Thu Dec 25 21:51:16 UTC 2025","passed","Thu Dec 25 21:51:17 UTC 2025","[API][Orders][Comment] > Not delete","","",""
"","5563","Create order with product quantity = 1 (min)","sales-portal-api","Thu Dec 25 21:51:17 UTC 2025","passed","Thu Dec 25 21:51:23 UTC 2025","[API][Orders][Create Order] > Positive DDT","","",""
"","219","Add regular sentence with punctuation","sales-portal-api","Thu Dec 25 21:51:07 UTC 2025","passed","Thu Dec 25 21:51:07 UTC 2025","[API][Orders][Comment] > Create","","",""
"","688","Should get order by valid id","sales-portal-api","Thu Dec 25 21:51:44 UTC 2025","passed","Thu Dec 25 21:51:45 UTC 2025","[API] [Sales Portal] [Orders] [Get By Id] > [Positive]","","",""
"","9933","Should NOT assign manager with non-existing managerId","sales-portal-api","Thu Dec 25 21:50:39 UTC 2025","passed","Thu Dec 25 21:50:49 UTC 2025","[API][Orders][Assign/Unassign Manager - Negative DDT] > Order in Canceled status","","",""
"","6947","Clear notes (empty string)","sales-portal-api","Thu Dec 25 21:54:55 UTC 2025","passed","Thu Dec 25 21:55:02 UTC 2025","[API][Products] > [Update product]","","",""
"","653","Create customer with with upper-case name","sales-portal-api","Thu Dec 25 21:49:44 UTC 2025","passed","Thu Dec 25 21:49:45 UTC 2025","[API][Customers][Create Customer] > Positive DDT","","",""
"","812","404 returned for non-existing id of valid format","sales-portal-api","Thu Dec 25 21:49:52 UTC 2025","passed","Thu Dec 25 21:49:53 UTC 2025","[API][Customers] > [Should NOT find customer to update]","","",""
"","13932","Order status transition from Received to Canceled","sales-portal-api","Thu Dec 25 21:52:28 UTC 2025","passed","Thu Dec 25 21:52:42 UTC 2025","[API][Orders][Negative Orders statuses transition]","","",""
"","5923","Update price to negative value — bad request","sales-portal-api","Thu Dec 25 21:55:18 UTC 2025","passed","Thu Dec 25 21:55:24 UTC 2025","[API][Products] > [Should NOT update product]","","",""
"","802","Add 250-char comment","sales-portal-api","Thu Dec 25 21:51:06 UTC 2025","passed","Thu Dec 25 21:51:07 UTC 2025","[API][Orders][Comment] > Create","","",""
"","6946","Update full product data","sales-portal-api","Thu Dec 25 21:55:09 UTC 2025","passed","Thu Dec 25 21:55:16 UTC 2025","[API][Products] > [Update product]","","",""
"","400","Create customer with empty notes","sales-portal-api","Thu Dec 25 21:49:42 UTC 2025","passed","Thu Dec 25 21:49:43 UTC 2025","[API][Customers][Create Customer] > Positive DDT","","",""
