"DESCRIPTION","DURATION IN MS","NAME","PARENT SUITE","START TIME","STATUS","STOP TIME","SUB SUITE","SUITE","TEST CLASS","TEST METHOD"
"","258","CST-009: Delete customer (Invalid Id)","sales-portal-api","Fri Dec 26 14:12:56 UTC 2025","passed","Fri Dec 26 14:12:56 UTC 2025","CST-008/009 Delete customer","","",""
"","320","Empty street [10]","sales-portal-api","Fri Dec 26 14:15:20 UTC 2025","passed","Fri Dec 26 14:15:21 UTC 2025","[API][Orders][Delivery] > [Add Delivery Info] > [Should NOT add Delivery Info]","","",""
"","1951","Update product name to 3 characters","sales-portal-api","Fri Dec 26 14:19:10 UTC 2025","passed","Fri Dec 26 14:19:12 UTC 2025","[API][Products] > [Update product]","","",""
"","5988","Update price to 100000 — bad request","sales-portal-api","Fri Dec 26 14:19:47 UTC 2025","passed","Fri Dec 26 14:19:53 UTC 2025","[API][Products] > [Should NOT update product]","","",""
"","1116","Update name with 41 characters — bad request","sales-portal-api","Fri Dec 26 14:13:00 UTC 2025","passed","Fri Dec 26 14:13:02 UTC 2025","[API][Customers] > [Should NOT update customer]","","",""
"","7011","Should NOT update manager with non-existing managerId","sales-portal-api","Fri Dec 26 14:13:09 UTC 2025","passed","Fri Dec 26 14:13:16 UTC 2025","[API][Orders][Assign/Unassign Manager - Negative DDT] > Order in Draft status","","",""
"","992","Update customer name to 1 character","sales-portal-api","Fri Dec 26 14:12:57 UTC 2025","passed","Fri Dec 26 14:12:58 UTC 2025","[API][Customers] > [Update customer]","","",""
"","310","Create customer with 10 characters length in phone","sales-portal-api","Fri Dec 26 14:12:55 UTC 2025","passed","Fri Dec 26 14:12:56 UTC 2025","[API][Customers][Create Customer] > Positive DDT","","",""
"","501","Create customer with 1 character length in name","sales-portal-api","Fri Dec 26 14:12:53 UTC 2025","passed","Fri Dec 26 14:12:54 UTC 2025","[API][Customers][Create Customer] > Positive DDT","","",""
"","315","Create customer with 1 character length in house","sales-portal-api","Fri Dec 26 14:12:55 UTC 2025","passed","Fri Dec 26 14:12:56 UTC 2025","[API][Customers][Create Customer] > Positive DDT","","",""
"","682","Update house number","sales-portal-api","Fri Dec 26 14:13:02 UTC 2025","passed","Fri Dec 26 14:13:02 UTC 2025","[API][Customers] > [Update customer]","","",""
"","8009","Update only manufacturer","sales-portal-api","Fri Dec 26 14:19:26 UTC 2025","passed","Fri Dec 26 14:19:34 UTC 2025","[API][Products] > [Update product]","","",""
"","1850","41 character name product not created","sales-portal-api","Fri Dec 26 14:19:02 UTC 2025","passed","Fri Dec 26 14:19:03 UTC 2025","[API][Products] > [Should NOT create product]","","",""
"","1821","404 returned for non-existing id of valid format","sales-portal-api","Fri Dec 26 14:18:59 UTC 2025","passed","Fri Dec 26 14:19:01 UTC 2025","[API][Products] > [Should Not Delete Product]","","",""
"","5009","Update city with 21 characters — bad request","sales-portal-api","Fri Dec 26 14:13:09 UTC 2025","passed","Fri Dec 26 14:13:14 UTC 2025","[API][Customers] > [Should NOT update customer]","","",""
"","1968","Add 250-char comment","sales-portal-api","Fri Dec 26 14:14:32 UTC 2025","passed","Fri Dec 26 14:14:34 UTC 2025","[API][Orders][Comment] > Create","","",""
"","1960","Negative amount product not created","sales-portal-api","Fri Dec 26 14:18:54 UTC 2025","passed","Fri Dec 26 14:18:56 UTC 2025","[API][Products] > [Should NOT create product]","","",""
"","6990","Order status transition from Draft to null","sales-portal-api","Fri Dec 26 14:16:08 UTC 2025","passed","Fri Dec 26 14:16:15 UTC 2025","[API][Orders][Invalid Orders statuses]","","",""
"","6968","Create product with 250 notes","sales-portal-api","Fri Dec 26 14:18:42 UTC 2025","passed","Fri Dec 26 14:18:49 UTC 2025","[API][Products] > [Create product]","","",""
"","1787","Update house with 1000 — bad request","sales-portal-api","Fri Dec 26 14:13:05 UTC 2025","passed","Fri Dec 26 14:13:07 UTC 2025","[API][Customers] > [Should NOT update customer]","","",""
"","9945","Should NOT unassign manager from order with non-existing orderId","sales-portal-api","Fri Dec 26 14:14:42 UTC 2025","passed","Fri Dec 26 14:14:52 UTC 2025","[API][Orders][Assign/Unassign Manager - Negative DDT] > Order in Canceled status","","",""
"","4122","Delete order with product quantity = 1 (min)","sales-portal-api","Fri Dec 26 14:14:52 UTC 2025","passed","Fri Dec 26 14:14:56 UTC 2025","[API][Orders][Delete Order]","","",""
"","478","Create customer with 3 characters length in house","sales-portal-api","Fri Dec 26 14:12:56 UTC 2025","passed","Fri Dec 26 14:12:56 UTC 2025","[API][Customers][Create Customer] > Positive DDT","","",""
"","113","Empty comment is rejected","sales-portal-api","Fri Dec 26 14:14:34 UTC 2025","passed","Fri Dec 26 14:14:34 UTC 2025","[API][Orders][Comment] > Not create","","",""
"","8928","Update notes to 251 characters — bad request","sales-portal-api","Fri Dec 26 14:19:43 UTC 2025","passed","Fri Dec 26 14:19:52 UTC 2025","[API][Products] > [Should NOT update product]","","",""
"","11910","Should NOT update manager with non-existing orderId","sales-portal-api","Fri Dec 26 14:14:28 UTC 2025","passed","Fri Dec 26 14:14:40 UTC 2025","[API][Orders][Assign/Unassign Manager - Negative DDT] > Order in In Process status","","",""
"","3732","Create product with 3 character length in name","sales-portal-api","Fri Dec 26 14:18:35 UTC 2025","passed","Fri Dec 26 14:18:39 UTC 2025","[API][Products] > [Create product]","","",""
"","1132","Update city with empty string — bad request","sales-portal-api","Fri Dec 26 14:13:00 UTC 2025","passed","Fri Dec 26 14:13:02 UTC 2025","[API][Customers] > [Should NOT update customer]","","",""
"","668","Create customer with with upper-case email","sales-portal-api","Fri Dec 26 14:12:55 UTC 2025","passed","Fri Dec 26 14:12:56 UTC 2025","[API][Customers][Create Customer] > Positive DDT","","",""
"","1146","Update notes with 251 characters — bad request","sales-portal-api","Fri Dec 26 14:13:01 UTC 2025","passed","Fri Dec 26 14:13:02 UTC 2025","[API][Customers] > [Should NOT update customer]","","",""
"","4954","Update price to negative value — bad request","sales-portal-api","Fri Dec 26 14:19:53 UTC 2025","passed","Fri Dec 26 14:19:58 UTC 2025","[API][Products] > [Should NOT update product]","","",""
"","302","Successfully update with future date [2]","sales-portal-api","Fri Dec 26 14:15:07 UTC 2025","passed","Fri Dec 26 14:15:08 UTC 2025","[API][Orders][Delivery] > [Add Delivery Info]","","",""
"","3984","Create order with product quantity = 1 (min)","sales-portal-api","Fri Dec 26 14:14:46 UTC 2025","passed","Fri Dec 26 14:14:50 UTC 2025","[API][Orders][Create Order] > Positive DDT","","",""
"","12007","Remove manager from order","sales-portal-api","Fri Dec 26 14:14:11 UTC 2025","passed","Fri Dec 26 14:14:23 UTC 2025","[API][Orders][Manager assignment flow] > Order in Canceled status","","",""
"","9949","Assign manager to order","sales-portal-api","Fri Dec 26 14:13:20 UTC 2025","passed","Fri Dec 26 14:13:30 UTC 2025","[API][Orders][Manager assignment flow] > Order in In Process status","","",""
"","2998","Create product with 1 price","sales-portal-api","Fri Dec 26 14:18:51 UTC 2025","passed","Fri Dec 26 14:18:54 UTC 2025","[API][Products] > [Create product]","","",""
"","206","CST-003: GET /api/customers?country Filter customers by Belarus","sales-portal-api","Fri Dec 26 14:12:56 UTC 2025","passed","Fri Dec 26 14:12:57 UTC 2025","CST-003 Get customers list (Filter by Country)","","",""
"","2939","Should get product by valid id","sales-portal-api","Fri Dec 26 14:19:05 UTC 2025","passed","Fri Dec 26 14:19:08 UTC 2025","[API] [Sales Portal] [Products] [Get By Id] > [Positive]","","",""
"","11961","Should NOT assign manager with non-existing orderId","sales-portal-api","Fri Dec 26 14:14:16 UTC 2025","passed","Fri Dec 26 14:14:28 UTC 2025","[API][Orders][Assign/Unassign Manager - Negative DDT] > Order in In Process status","","",""
"","1945","Comment with '>' is rejected","sales-portal-api","Fri Dec 26 14:14:47 UTC 2025","failed","Fri Dec 26 14:14:49 UTC 2025","[API][Orders][Comment] > Not create","","",""
"","14998","401 returned without token","sales-portal-api","Fri Dec 26 14:18:22 UTC 2025","passed","Fri Dec 26 14:18:37 UTC 2025","[API][Orders] > [Should NOT update order]","","",""
"","13978","Order status transition from Partially Received to Canceled","sales-portal-api","Fri Dec 26 14:15:35 UTC 2025","passed","Fri Dec 26 14:15:49 UTC 2025","[API][Orders][Negative Orders statuses transition]","","",""
"","2141","Delete existing comment","sales-portal-api","Fri Dec 26 14:14:52 UTC 2025","passed","Fri Dec 26 14:14:54 UTC 2025","[API][Orders][Comment] > Delete","","",""
"","1952","Name with special characters product not created","sales-portal-api","Fri Dec 26 14:18:49 UTC 2025","passed","Fri Dec 26 14:18:51 UTC 2025","[API][Products] > [Should NOT create product]","","",""
"","1825","Invalid ID format rejected","sales-portal-api","Fri Dec 26 14:14:40 UTC 2025","passed","Fri Dec 26 14:14:42 UTC 2025","[API][Orders][Comment] > Not delete","","",""
"","9933","Update price to 0 — bad request","sales-portal-api","Fri Dec 26 14:19:37 UTC 2025","passed","Fri Dec 26 14:19:47 UTC 2025","[API][Products] > [Should NOT update product]","","",""
"","3021","Create product without notes","sales-portal-api","Fri Dec 26 14:18:49 UTC 2025","passed","Fri Dec 26 14:18:52 UTC 2025","[API][Products] > [Create product]","","",""
"","6924","Create product with 40 character length in name","sales-portal-api","Fri Dec 26 14:18:39 UTC 2025","passed","Fri Dec 26 14:18:46 UTC 2025","[API][Products] > [Create product]","","",""
"","3004","Name with 2 spaces product not created","sales-portal-api","Fri Dec 26 14:18:44 UTC 2025","passed","Fri Dec 26 14:18:47 UTC 2025","[API][Products] > [Should NOT create product]","","",""
"","411","Create customer with empty notes","sales-portal-api","Fri Dec 26 14:12:54 UTC 2025","passed","Fri Dec 26 14:12:54 UTC 2025","[API][Customers][Create Customer] > Positive DDT","","",""
"","23916","Should NOT receive products: Invalid product id: date string","sales-portal-api","Fri Dec 26 14:17:58 UTC 2025","passed","Fri Dec 26 14:18:22 UTC 2025","[API][Orders][Receive] > [Negative][Invalid request body]","","",""
"","219","Successfully set delivery info with all required fields [0]","sales-portal-api","Fri Dec 26 14:14:57 UTC 2025","passed","Fri Dec 26 14:14:58 UTC 2025","[API][Orders][Delivery] > [Add Delivery Info]","","",""
"","978","Update email to valid format","sales-portal-api","Fri Dec 26 14:13:00 UTC 2025","passed","Fri Dec 26 14:13:01 UTC 2025","[API][Customers] > [Update customer]","","",""
"","13961","Order status transition from In Process to Draft","sales-portal-api","Fri Dec 26 14:16:16 UTC 2025","passed","Fri Dec 26 14:16:30 UTC 2025","[API][Orders][Negative Orders statuses transition]","","",""
"","10891","Should NOT unassign manager from order with non-existing orderId","sales-portal-api","Fri Dec 26 14:13:35 UTC 2025","passed","Fri Dec 26 14:13:46 UTC 2025","[API][Orders][Assign/Unassign Manager - Negative DDT] > Order in Draft status","","",""
"","12961","Order status transition from Canceled to Draft","sales-portal-api","Fri Dec 26 14:15:39 UTC 2025","passed","Fri Dec 26 14:15:52 UTC 2025","[API][Orders][Positive Orders statuses transition]","","",""
"","2046","Update phone without + sign — bad request","sales-portal-api","Fri Dec 26 14:13:07 UTC 2025","passed","Fri Dec 26 14:13:09 UTC 2025","[API][Customers] > [Should NOT update customer]","","",""
"","12968","Should NOT unassign manager from order with non-existing orderId","sales-portal-api","Fri Dec 26 14:13:37 UTC 2025","passed","Fri Dec 26 14:13:50 UTC 2025","[API][Orders][Assign/Unassign Manager - Negative DDT] > Order in Received status","","",""
"","884","Update notes to 250 characters","sales-portal-api","Fri Dec 26 14:13:03 UTC 2025","passed","Fri Dec 26 14:13:04 UTC 2025","[API][Customers] > [Update customer]","","",""
"","1956","0 price product not created","sales-portal-api","Fri Dec 26 14:18:54 UTC 2025","passed","Fri Dec 26 14:18:56 UTC 2025","[API][Products] > [Should NOT create product]","","",""
"","8924","Should NOT receive products: Draft status","sales-portal-api","Fri Dec 26 14:16:05 UTC 2025","passed","Fri Dec 26 14:16:14 UTC 2025","[API][Orders][Receive] > [Negative][Incorrect order status to receive]","","",""
"","604","Exceeded Max length city name (>20 chars) [11]","sales-portal-api","Fri Dec 26 14:15:21 UTC 2025","passed","Fri Dec 26 14:15:21 UTC 2025","[API][Orders][Delivery] > [Add Delivery Info] > [Should NOT add Delivery Info]","","",""
"","15959","Order status transition from Received to Canceled","sales-portal-api","Fri Dec 26 14:16:17 UTC 2025","passed","Fri Dec 26 14:16:33 UTC 2025","[API][Orders][Negative Orders statuses transition]","","",""
"","1015","Clear notes (empty string)","sales-portal-api","Fri Dec 26 14:13:04 UTC 2025","passed","Fri Dec 26 14:13:05 UTC 2025","[API][Customers] > [Update customer]","","",""
"","345","Special characters in street [14]","sales-portal-api","Fri Dec 26 14:15:20 UTC 2025","passed","Fri Dec 26 14:15:21 UTC 2025","[API][Orders][Delivery] > [Add Delivery Info] > [Should NOT add Delivery Info]","","",""
"","6953","Order status transition from Draft with delivery to Canceled","sales-portal-api","Fri Dec 26 14:15:24 UTC 2025","passed","Fri Dec 26 14:15:31 UTC 2025","[API][Orders][Positive Orders statuses transition]","","",""
"","27038","ORD-PUT-003: Order status is DRAFT after update","sales-portal-api","Fri Dec 26 14:17:33 UTC 2025","passed","Fri Dec 26 14:18:00 UTC 2025","[API][Orders] > [Update order]","","",""
"","11645","Should NOT unassign manager from order with non-existing orderId","sales-portal-api","Fri Dec 26 14:13:14 UTC 2025","passed","Fri Dec 26 14:13:26 UTC 2025","[API][Orders][Assign/Unassign Manager - Negative DDT] > Order in In Process status","","",""
"","340","Create customer with 20 characters length in city","sales-portal-api","Fri Dec 26 14:12:55 UTC 2025","passed","Fri Dec 26 14:12:55 UTC 2025","[API][Customers][Create Customer] > Positive DDT","","",""
"","17959","Update manager to another manager","sales-portal-api","Fri Dec 26 14:14:08 UTC 2025","passed","Fri Dec 26 14:14:26 UTC 2025","[API][Orders][Manager assignment flow] > Order in Partially Received status","","",""
"","1984","1000 amount product not created","sales-portal-api","Fri Dec 26 14:18:56 UTC 2025","passed","Fri Dec 26 14:18:58 UTC 2025","[API][Products] > [Should NOT create product]","","",""
"","938","Update street with empty string — bad request","sales-portal-api","Fri Dec 26 14:13:03 UTC 2025","passed","Fri Dec 26 14:13:04 UTC 2025","[API][Customers] > [Should NOT update customer]","","",""
"","7989","Update with 2 character name — bad request","sales-portal-api","Fri Dec 26 14:19:42 UTC 2025","passed","Fri Dec 26 14:19:50 UTC 2025","[API][Products] > [Should NOT update product]","","",""
"","113","404 returned for non-existing id of valid format","sales-portal-api","Fri Dec 26 14:15:18 UTC 2025","passed","Fri Dec 26 14:15:18 UTC 2025","[API] [Sales Portal] [Orders] [Get By Id] > [Negative]","","",""
"","1916","Not integer price product not created","sales-portal-api","Fri Dec 26 14:18:52 UTC 2025","passed","Fri Dec 26 14:18:54 UTC 2025","[API][Products] > [Should NOT create product]","","",""
"","20000","Processing: receive 1 product (becomes Partially Received)","sales-portal-api","Fri Dec 26 14:16:03 UTC 2025","passed","Fri Dec 26 14:16:23 UTC 2025","[API][Orders][Receive] > [Positive][Receive order]","","",""
"","6992","Should NOT change order status with non-existing orderId","sales-portal-api","Fri Dec 26 14:15:56 UTC 2025","passed","Fri Dec 26 14:16:03 UTC 2025","[API][Orders][Invalid Orders statuses]","","",""
"","7993","Update full product data","sales-portal-api","Fri Dec 26 14:19:34 UTC 2025","passed","Fri Dec 26 14:19:42 UTC 2025","[API][Products] > [Update product]","","",""
"","17929","500 returned on invalid ObjectId format for order","sales-portal-api","Fri Dec 26 14:18:26 UTC 2025","passed","Fri Dec 26 14:18:44 UTC 2025","[API][Orders] > [Should NOT update order]","","",""
"","25778","Should NOT receive products: Empty products array","sales-portal-api","Fri Dec 26 14:16:15 UTC 2025","passed","Fri Dec 26 14:16:41 UTC 2025","[API][Orders][Receive] > [Negative][Invalid request body]","","",""
"","8970","Assign manager to order","sales-portal-api","Fri Dec 26 14:13:12 UTC 2025","passed","Fri Dec 26 14:13:21 UTC 2025","[API][Orders][Manager assignment flow] > Order in Received status","","",""
"","10953","Order status transition from Received to In Process","sales-portal-api","Fri Dec 26 14:16:06 UTC 2025","passed","Fri Dec 26 14:16:17 UTC 2025","[API][Orders][Negative Orders statuses transition]","","",""
"","1927","Not integer amount product not created","sales-portal-api","Fri Dec 26 14:18:52 UTC 2025","passed","Fri Dec 26 14:18:54 UTC 2025","[API][Products] > [Should NOT create product]","","",""
"","2974","Attempt to update product name with existing one returns error","sales-portal-api","Fri Dec 26 14:20:13 UTC 2025","passed","Fri Dec 26 14:20:16 UTC 2025","[API][Products] > Should NOT update with existing name","","",""
"","1037","Negative price product not created","sales-portal-api","Fri Dec 26 14:18:51 UTC 2025","passed","Fri Dec 26 14:18:52 UTC 2025","[API][Products] > [Should NOT create product]","","",""
"","338","Create customer with upper-case street","sales-portal-api","Fri Dec 26 14:12:55 UTC 2025","passed","Fri Dec 26 14:12:55 UTC 2025","[API][Customers][Create Customer] > Positive DDT","","",""
"","1970","Empty name product not created","sales-portal-api","Fri Dec 26 14:18:52 UTC 2025","passed","Fri Dec 26 14:18:54 UTC 2025","[API][Products] > [Should NOT create product]","","",""
"","201","CST-003: GET /api/customers?country Filter customers by Ukraine","sales-portal-api","Fri Dec 26 14:12:59 UTC 2025","passed","Fri Dec 26 14:12:59 UTC 2025","CST-003 Get customers list (Filter by Country)","","",""
"","6002","Missing address field [2]","sales-portal-api","Fri Dec 26 14:15:09 UTC 2025","passed","Fri Dec 26 14:15:15 UTC 2025","[API][Orders][Delivery] > [Add Delivery Info] > [Should NOT add Delivery Info]","","",""
"","729","Update customer name to 40 characters","sales-portal-api","Fri Dec 26 14:12:58 UTC 2025","passed","Fri Dec 26 14:12:59 UTC 2025","[API][Customers] > [Update customer]","","",""
"","9545","Order status transition from Canceled to Canceled","sales-portal-api","Fri Dec 26 14:15:21 UTC 2025","passed","Fri Dec 26 14:15:31 UTC 2025","[API][Orders][Negative Orders statuses transition]","","",""
"","38896","Processing: receive 5 products (becomes Received)","sales-portal-api","Fri Dec 26 14:16:52 UTC 2025","passed","Fri Dec 26 14:17:31 UTC 2025","[API][Orders][Receive] > [Positive][Receive order]","","",""
"","546","Unicode characters in city [15]","sales-portal-api","Fri Dec 26 14:15:21 UTC 2025","passed","Fri Dec 26 14:15:21 UTC 2025","[API][Orders][Delivery] > [Add Delivery Info] > [Should NOT add Delivery Info]","","",""
"","4968","Update flat with 10000 — bad request","sales-portal-api","Fri Dec 26 14:13:09 UTC 2025","passed","Fri Dec 26 14:13:14 UTC 2025","[API][Customers] > [Should NOT update customer]","","",""
"","7963","Should NOT update manager with non-existing orderId","sales-portal-api","Fri Dec 26 14:13:27 UTC 2025","passed","Fri Dec 26 14:13:35 UTC 2025","[API][Orders][Assign/Unassign Manager - Negative DDT] > Order in Draft status","","",""
"","428","Should NOT create customer with existing email","sales-portal-api","Fri Dec 26 14:12:55 UTC 2025","passed","Fri Dec 26 14:12:56 UTC 2025","[API][Customers][Create Customer] > Unique email","","",""
"","1921","Update name with empty string — bad request","sales-portal-api","Fri Dec 26 14:13:07 UTC 2025","passed","Fri Dec 26 14:13:09 UTC 2025","[API][Customers] > [Should NOT update customer]","","",""
"","8916","Order status transition from Draft to undefined","sales-portal-api","Fri Dec 26 14:15:47 UTC 2025","passed","Fri Dec 26 14:15:56 UTC 2025","[API][Orders][Invalid Orders statuses]","","",""
"","12962","Should NOT update manager with non-existing orderId","sales-portal-api","Fri Dec 26 14:13:24 UTC 2025","passed","Fri Dec 26 14:13:37 UTC 2025","[API][Orders][Assign/Unassign Manager - Negative DDT] > Order in Received status","","",""
"","3543","Assign manager to order","sales-portal-api","Fri Dec 26 14:13:03 UTC 2025","passed","Fri Dec 26 14:13:07 UTC 2025","[API][Orders][Manager assignment flow] > Order in Draft status","","",""
"","188","CST-003: GET /api/customers?country Filter customers by Great Britain","sales-portal-api","Fri Dec 26 14:12:57 UTC 2025","passed","Fri Dec 26 14:12:57 UTC 2025","CST-003 Get customers list (Filter by Country)","","",""
"","137","404 returned for non-existing id of valid format","sales-portal-api","Fri Dec 26 14:12:56 UTC 2025","passed","Fri Dec 26 14:12:56 UTC 2025","[API] [Sales Portal] [Customers] [Get By Id] > [Negative]","","",""
"","995","Update name with special characters — bad request","sales-portal-api","Fri Dec 26 14:13:02 UTC 2025","passed","Fri Dec 26 14:13:03 UTC 2025","[API][Customers] > [Should NOT update customer]","","",""
"","3940","Clear notes (empty string)","sales-portal-api","Fri Dec 26 14:19:22 UTC 2025","passed","Fri Dec 26 14:19:26 UTC 2025","[API][Products] > [Update product]","","",""
"","952","Without manufacturer product not created","sales-portal-api","Fri Dec 26 14:18:56 UTC 2025","passed","Fri Dec 26 14:18:57 UTC 2025","[API][Products] > [Should NOT create product]","","",""
"","4975","Create product with 1 space in name","sales-portal-api","Fri Dec 26 14:18:46 UTC 2025","passed","Fri Dec 26 14:18:51 UTC 2025","[API][Products] > [Create product]","","",""
"","345","Create customer 250 characters length in notes","sales-portal-api","Fri Dec 26 14:12:55 UTC 2025","passed","Fri Dec 26 14:12:55 UTC 2025","[API][Customers][Create Customer] > Positive DDT","","",""
"","6024","Update notes with < or > — bad request","sales-portal-api","Fri Dec 26 14:19:52 UTC 2025","passed","Fri Dec 26 14:19:58 UTC 2025","[API][Products] > [Should NOT update product]","","",""
"","1923","Missing condition field [1]","sales-portal-api","Fri Dec 26 14:15:07 UTC 2025","passed","Fri Dec 26 14:15:09 UTC 2025","[API][Orders][Delivery] > [Add Delivery Info] > [Should NOT add Delivery Info]","","",""
"","204","Comment with '<' is rejected","sales-portal-api","Fri Dec 26 14:14:49 UTC 2025","failed","Fri Dec 26 14:14:49 UTC 2025","[API][Orders][Comment] > Not create","","",""
"","1909","Empty comment ID is rejected","sales-portal-api","Fri Dec 26 14:14:44 UTC 2025","passed","Fri Dec 26 14:14:46 UTC 2025","[API][Orders][Comment] > Not delete","","",""
"","17913","Should NOT update manager with non-existing managerId","sales-portal-api","Fri Dec 26 14:13:58 UTC 2025","passed","Fri Dec 26 14:14:16 UTC 2025","[API][Orders][Assign/Unassign Manager - Negative DDT] > Order in In Process status","","",""
"","9933","ORD-PUT-004: History entry recorded when order composition changes","sales-portal-api","Fri Dec 26 14:17:58 UTC 2025","passed","Fri Dec 26 14:18:08 UTC 2025","[API][Orders] > [Update order]","","",""
"","619","Update phone to valid format","sales-portal-api","Fri Dec 26 14:13:01 UTC 2025","passed","Fri Dec 26 14:13:02 UTC 2025","[API][Customers] > [Update customer]","","",""
"","2986","Update product name to 40 characters","sales-portal-api","Fri Dec 26 14:19:14 UTC 2025","passed","Fri Dec 26 14:19:17 UTC 2025","[API][Products] > [Update product]","","",""
"","873","400 returned for id of invalid format","sales-portal-api","Fri Dec 26 14:19:07 UTC 2025","failed","Fri Dec 26 14:19:08 UTC 2025","[API][Products] > [Should Not Delete Product]","","",""
"","11949","Should NOT assign manager with non-existing orderId","sales-portal-api","Fri Dec 26 14:14:20 UTC 2025","passed","Fri Dec 26 14:14:32 UTC 2025","[API][Orders][Assign/Unassign Manager - Negative DDT] > Order in Canceled status","","",""
"","12915","Should NOT assign manager with non-existing managerId","sales-portal-api","Fri Dec 26 14:13:50 UTC 2025","passed","Fri Dec 26 14:14:03 UTC 2025","[API][Orders][Assign/Unassign Manager - Negative DDT] > Order in Canceled status","","",""
"","286","CST-003: GET /api/customers?country Filter customers by Russia","sales-portal-api","Fri Dec 26 14:12:59 UTC 2025","passed","Fri Dec 26 14:12:59 UTC 2025","CST-003 Get customers list (Filter by Country)","","",""
"","8002","Update amount to 1000 — bad request","sales-portal-api","Fri Dec 26 14:19:29 UTC 2025","passed","Fri Dec 26 14:19:37 UTC 2025","[API][Products] > [Should NOT update product]","","",""
"","22966","Should NOT update manager with non-existing managerId","sales-portal-api","Fri Dec 26 14:14:55 UTC 2025","passed","Fri Dec 26 14:15:18 UTC 2025","[API][Orders][Assign/Unassign Manager - Negative DDT] > Order in Received status","","",""
"","9022","Remove manager from order","sales-portal-api","Fri Dec 26 14:13:43 UTC 2025","passed","Fri Dec 26 14:13:52 UTC 2025","[API][Orders][Manager assignment flow] > Order in In Process status","","",""
"","735","Non-existing commentId rejected","sales-portal-api","Fri Dec 26 14:14:57 UTC 2025","passed","Fri Dec 26 14:14:58 UTC 2025","[API][Orders][Comment] > Not delete","","",""
"","1914","Empty city [9]","sales-portal-api","Fri Dec 26 14:15:18 UTC 2025","passed","Fri Dec 26 14:15:20 UTC 2025","[API][Orders][Delivery] > [Add Delivery Info] > [Should NOT add Delivery Info]","","",""
"","3937","Create product with empty notes","sales-portal-api","Fri Dec 26 14:18:52 UTC 2025","passed","Fri Dec 26 14:18:56 UTC 2025","[API][Products] > [Create product]","","",""
