"DESCRIPTION","DURATION IN MS","NAME","PARENT SUITE","START TIME","STATUS","STOP TIME","SUB SUITE","SUITE","TEST CLASS","TEST METHOD"
"","46974","Processing: receive 1 product (becomes Partially Received)","sales-portal-api","Fri Dec 26 19:16:41 UTC 2025","passed","Fri Dec 26 19:17:28 UTC 2025","[API][Orders][Receive] > [Positive][Receive order]","","",""
"","3336","Update with empty email — bad request","sales-portal-api","Fri Dec 26 19:10:21 UTC 2025","passed","Fri Dec 26 19:10:24 UTC 2025","[API][Customers] > [Should NOT update customer]","","",""
"","21869","Should NOT change order status with non-existing orderId","sales-portal-api","Fri Dec 26 19:16:19 UTC 2025","passed","Fri Dec 26 19:16:41 UTC 2025","[API][Orders][Invalid Orders statuses]","","",""
"","3093","404 returned for non-existing id of valid format","sales-portal-api","Fri Dec 26 19:10:18 UTC 2025","passed","Fri Dec 26 19:10:21 UTC 2025","[API][Customers] > [Should NOT find customer to update]","","",""
"","49081","Should NOT receive products: Invalid product id: negative value string","sales-portal-api","Fri Dec 26 19:21:50 UTC 2025","broken","Fri Dec 26 19:22:40 UTC 2025","[API][Orders][Receive] > [Negative][Invalid request body]","","",""
"","21748","Update with 2 character name — bad request","sales-portal-api","Fri Dec 26 19:28:56 UTC 2025","passed","Fri Dec 26 19:29:17 UTC 2025","[API][Products] > [Should NOT update product]","","",""
"","1611","Create customer with empty notes","sales-portal-api","Fri Dec 26 19:09:49 UTC 2025","passed","Fri Dec 26 19:09:51 UTC 2025","[API][Customers][Create Customer] > Positive DDT","","",""
"","22068","Update notes to 251 characters — bad request","sales-portal-api","Fri Dec 26 19:28:34 UTC 2025","passed","Fri Dec 26 19:28:56 UTC 2025","[API][Products] > [Should NOT update product]","","",""
"","3120","Clear notes (empty string)","sales-portal-api","Fri Dec 26 19:10:23 UTC 2025","passed","Fri Dec 26 19:10:26 UTC 2025","[API][Customers] > [Update customer]","","",""
"","21581","Create product with 999 amount","sales-portal-api","Fri Dec 26 19:25:18 UTC 2025","passed","Fri Dec 26 19:25:40 UTC 2025","[API][Products] > [Create product]","","",""
"","27971","Assign manager to order","sales-portal-api","Fri Dec 26 19:12:58 UTC 2025","passed","Fri Dec 26 19:13:26 UTC 2025","[API][Orders][Manager assignment flow] > Order in Partially Received status","","",""
"","29905","Clear notes (empty string)","sales-portal-api","Fri Dec 26 19:27:42 UTC 2025","passed","Fri Dec 26 19:28:12 UTC 2025","[API][Products] > [Update product]","","",""
"","510","Special characters in street [14]","sales-portal-api","Fri Dec 26 19:14:51 UTC 2025","passed","Fri Dec 26 19:14:51 UTC 2025","[API][Orders][Delivery] > [Add Delivery Info] > [Should NOT add Delivery Info]","","",""
"","2678","Notes with < or > symbols product not created","sales-portal-api","Fri Dec 26 19:25:52 UTC 2025","passed","Fri Dec 26 19:25:55 UTC 2025","[API][Products] > [Should NOT create product]","","",""
"","48865","Should close modal whith close button","sales-portal-ui","Fri Dec 26 19:32:56 UTC 2025","broken","Fri Dec 26 19:33:45 UTC 2025","[UI][Orders][Create Order]","","",""
"","2772","Negative amount product not created","sales-portal-api","Fri Dec 26 19:25:55 UTC 2025","passed","Fri Dec 26 19:25:58 UTC 2025","[API][Products] > [Should NOT create product]","","",""
"","21387","Assign manager to order","sales-portal-api","Fri Dec 26 19:11:25 UTC 2025","passed","Fri Dec 26 19:11:47 UTC 2025","[API][Orders][Manager assignment flow] > Order in In Process status","","",""
"","34105","In Process: select all and save receiving marks all received","sales-portal-ui","Fri Dec 26 19:37:36 UTC 2025","passed","Fri Dec 26 19:38:10 UTC 2025","[UI][Orders][Order Details]","","",""
"","27874","Update name with special characters — bad request","sales-portal-api","Fri Dec 26 19:27:44 UTC 2025","passed","Fri Dec 26 19:28:12 UTC 2025","[API][Products] > [Should NOT update product]","","",""
"","187","Invalid condition value [4]","sales-portal-api","Fri Dec 26 19:14:40 UTC 2025","passed","Fri Dec 26 19:14:40 UTC 2025","[API][Orders][Delivery] > [Add Delivery Info] > [Should NOT add Delivery Info]","","",""
"","33163","ORD-PUT-004: History entry recorded when order composition changes","sales-portal-api","Fri Dec 26 19:21:56 UTC 2025","passed","Fri Dec 26 19:22:29 UTC 2025","[API][Orders] > [Update order]","","",""
"","3362","Update with invalid email format — bad request","sales-portal-api","Fri Dec 26 19:10:17 UTC 2025","passed","Fri Dec 26 19:10:21 UTC 2025","[API][Customers] > [Should NOT update customer]","","",""
"","14157","404 returned for non-existing id of valid format","sales-portal-api","Fri Dec 26 19:29:48 UTC 2025","failed","Fri Dec 26 19:30:02 UTC 2025","[API][Products] > [Should NOT find product to update]","","",""
"","24592","Update manager to another manager","sales-portal-api","Fri Dec 26 19:10:36 UTC 2025","passed","Fri Dec 26 19:11:01 UTC 2025","[API][Orders][Manager assignment flow] > Order in Draft status","","",""
"","34273","Update manager to another manager","sales-portal-api","Fri Dec 26 19:13:26 UTC 2025","passed","Fri Dec 26 19:14:00 UTC 2025","[API][Orders][Manager assignment flow] > Order in Partially Received status","","",""
"","19348","Order status transition from Draft to Draft","sales-portal-api","Fri Dec 26 19:15:04 UTC 2025","passed","Fri Dec 26 19:15:24 UTC 2025","[API][Orders][Negative Orders statuses transition]","","",""
"","2027","Should get customer by valid id","sales-portal-api","Fri Dec 26 19:09:56 UTC 2025","passed","Fri Dec 26 19:09:58 UTC 2025","[API] [Sales Portal] [Customers] [Get By Id] > [Positive]","","",""
"","394","Past date [6]","sales-portal-api","Fri Dec 26 19:14:52 UTC 2025","failed","Fri Dec 26 19:14:53 UTC 2025","[API][Orders][Delivery] > [Add Delivery Info] > [Should NOT add Delivery Info]","","",""
"","24348","Remove manager from order","sales-portal-api","Fri Dec 26 19:11:01 UTC 2025","passed","Fri Dec 26 19:11:25 UTC 2025","[API][Orders][Manager assignment flow] > Order in Draft status","","",""
"","45767","Should NOT receive products: Empty products array","sales-portal-api","Fri Dec 26 19:19:08 UTC 2025","broken","Fri Dec 26 19:19:54 UTC 2025","[API][Orders][Receive] > [Negative][Invalid request body]","","",""
"","3371","Update notes with 251 characters — bad request","sales-portal-api","Fri Dec 26 19:10:11 UTC 2025","passed","Fri Dec 26 19:10:14 UTC 2025","[API][Customers] > [Should NOT update customer]","","",""
"","25345","Order status transition from Draft to In Process","sales-portal-api","Fri Dec 26 19:15:26 UTC 2025","passed","Fri Dec 26 19:15:51 UTC 2025","[API][Orders][Negative Orders statuses transition]","","",""
"","21085","Order status transition from Received to Canceled","sales-portal-api","Fri Dec 26 19:16:43 UTC 2025","passed","Fri Dec 26 19:17:04 UTC 2025","[API][Orders][Negative Orders statuses transition]","","",""
"","18027","Should NOT assign manager with non-existing managerId","sales-portal-api","Fri Dec 26 19:12:08 UTC 2025","passed","Fri Dec 26 19:12:26 UTC 2025","[API][Orders][Assign/Unassign Manager - Negative DDT] > Order in In Process status","","",""
"","420","Missing country in address [3]","sales-portal-api","Fri Dec 26 19:14:45 UTC 2025","passed","Fri Dec 26 19:14:46 UTC 2025","[API][Orders][Delivery] > [Add Delivery Info] > [Should NOT add Delivery Info]","","",""
"","3338","Update phone with invalid format — bad request","sales-portal-api","Fri Dec 26 19:10:24 UTC 2025","passed","Fri Dec 26 19:10:28 UTC 2025","[API][Customers] > [Should NOT update customer]","","",""
"","2697","Negative price product not created","sales-portal-api","Fri Dec 26 19:25:52 UTC 2025","passed","Fri Dec 26 19:25:54 UTC 2025","[API][Products] > [Should NOT create product]","","",""
"","25016","Update manager to another manager","sales-portal-api","Fri Dec 26 19:12:07 UTC 2025","passed","Fri Dec 26 19:12:32 UTC 2025","[API][Orders][Manager assignment flow] > Order in In Process status","","",""
"","3347","Update house with negative number — bad request","sales-portal-api","Fri Dec 26 19:10:21 UTC 2025","passed","Fri Dec 26 19:10:24 UTC 2025","[API][Customers] > [Should NOT update customer]","","",""
"","247","Invalid ID format rejected","sales-portal-api","Fri Dec 26 19:13:51 UTC 2025","passed","Fri Dec 26 19:13:51 UTC 2025","[API][Orders][Comment] > Not delete","","",""
"","3384","Update house with 1000 — bad request","sales-portal-api","Fri Dec 26 19:10:24 UTC 2025","passed","Fri Dec 26 19:10:28 UTC 2025","[API][Customers] > [Should NOT update customer]","","",""
"","28731","Delete order with product quantity = 1 (min)","sales-portal-api","Fri Dec 26 19:14:11 UTC 2025","passed","Fri Dec 26 19:14:40 UTC 2025","[API][Orders][Delete Order]","","",""
"","24334","Order status transition from Partially Received to Canceled","sales-portal-api","Fri Dec 26 19:15:31 UTC 2025","passed","Fri Dec 26 19:15:55 UTC 2025","[API][Orders][Negative Orders statuses transition]","","",""
"","36249","Draft order with delivery: can process","sales-portal-ui","Fri Dec 26 19:37:06 UTC 2025","passed","Fri Dec 26 19:37:42 UTC 2025","[UI][Orders][Order Details]","","",""
"","3364","Update city with empty string — bad request","sales-portal-api","Fri Dec 26 19:10:11 UTC 2025","passed","Fri Dec 26 19:10:14 UTC 2025","[API][Customers] > [Should NOT update customer]","","",""
"","37961","ORD-PUT-013: PUT without changes does not add REQUIRED_PRODUCTS_CHANGED history entry","sales-portal-api","Fri Dec 26 19:23:05 UTC 2025","passed","Fri Dec 26 19:23:43 UTC 2025","[API][Orders] > [Update order]","","",""
"","262","Zero flat number [8]","sales-portal-api","Fri Dec 26 19:14:40 UTC 2025","passed","Fri Dec 26 19:14:41 UTC 2025","[API][Orders][Delivery] > [Add Delivery Info] > [Should NOT add Delivery Info]","","",""
"","1577","Create customer with 3 characters length in house","sales-portal-api","Fri Dec 26 19:09:55 UTC 2025","passed","Fri Dec 26 19:09:56 UTC 2025","[API][Customers][Create Customer] > Positive DDT","","",""
"","24248","Order status transition from Received to Draft","sales-portal-api","Fri Dec 26 19:15:55 UTC 2025","passed","Fri Dec 26 19:16:19 UTC 2025","[API][Orders][Negative Orders statuses transition]","","",""
"","1570","Create customer with 1 character length in street","sales-portal-api","Fri Dec 26 19:09:55 UTC 2025","passed","Fri Dec 26 19:09:56 UTC 2025","[API][Customers][Create Customer] > Positive DDT","","",""
"","24254","Order status transition from Draft to Canceled","sales-portal-api","Fri Dec 26 19:15:55 UTC 2025","passed","Fri Dec 26 19:16:19 UTC 2025","[API][Orders][Positive Orders statuses transition]","","",""
"","21731","Update notes with < or > — bad request","sales-portal-api","Fri Dec 26 19:28:56 UTC 2025","passed","Fri Dec 26 19:29:17 UTC 2025","[API][Products] > [Should NOT update product]","","",""
"","3141","Update house number","sales-portal-api","Fri Dec 26 19:10:14 UTC 2025","passed","Fri Dec 26 19:10:17 UTC 2025","[API][Customers] > [Update customer]","","",""
"","1626","Create customer with 1 character length in house","sales-portal-api","Fri Dec 26 19:09:53 UTC 2025","passed","Fri Dec 26 19:09:55 UTC 2025","[API][Customers][Create Customer] > Positive DDT","","",""
"","3132","Update phone to valid format","sales-portal-api","Fri Dec 26 19:10:12 UTC 2025","passed","Fri Dec 26 19:10:15 UTC 2025","[API][Customers] > [Update customer]","","",""
"","23076","Should NOT update manager with non-existing managerId","sales-portal-api","Fri Dec 26 19:12:08 UTC 2025","passed","Fri Dec 26 19:12:31 UTC 2025","[API][Orders][Assign/Unassign Manager - Negative DDT] > Order in Canceled status","","",""
"","439","Product without name not created","sales-portal-api","Fri Dec 26 19:25:54 UTC 2025","passed","Fri Dec 26 19:25:54 UTC 2025","[API][Products] > [Should NOT create product]","","",""
"","3341","Update street with 41 characters — bad request","sales-portal-api","Fri Dec 26 19:10:14 UTC 2025","passed","Fri Dec 26 19:10:17 UTC 2025","[API][Customers] > [Should NOT update customer]","","",""
"","7250","1000 amount product not created","sales-portal-api","Fri Dec 26 19:25:58 UTC 2025","passed","Fri Dec 26 19:26:05 UTC 2025","[API][Products] > [Should NOT create product]","","",""
"","540","Single character city name [3]","sales-portal-api","Fri Dec 26 19:14:23 UTC 2025","passed","Fri Dec 26 19:14:23 UTC 2025","[API][Orders][Delivery] > [Add Delivery Info]","","",""
"","20811","Should NOT unassign manager from order with non-existing orderId","sales-portal-api","Fri Dec 26 19:11:47 UTC 2025","passed","Fri Dec 26 19:12:08 UTC 2025","[API][Orders][Assign/Unassign Manager - Negative DDT] > Order in Draft status","","",""
"","23818","Order status transition from Received to In Process","sales-portal-api","Fri Dec 26 19:16:19 UTC 2025","passed","Fri Dec 26 19:16:43 UTC 2025","[API][Orders][Negative Orders statuses transition]","","",""
"","23310","Order status transition from Draft to testStatus","sales-portal-api","Fri Dec 26 19:15:55 UTC 2025","passed","Fri Dec 26 19:16:18 UTC 2025","[API][Orders][Invalid Orders statuses]","","",""
"","422","Missing address field [2]","sales-portal-api","Fri Dec 26 19:14:45 UTC 2025","passed","Fri Dec 26 19:14:45 UTC 2025","[API][Orders][Delivery] > [Add Delivery Info] > [Should NOT add Delivery Info]","","",""
"","54227","Check remove product from order before creation","sales-portal-ui","Fri Dec 26 19:33:23 UTC 2025","broken","Fri Dec 26 19:34:18 UTC 2025","[UI][Orders][Create Order]","","",""
"","24391","Order status transition from In Process to Draft","sales-portal-api","Fri Dec 26 19:17:05 UTC 2025","passed","Fri Dec 26 19:17:30 UTC 2025","[API][Orders][Negative Orders statuses transition]","","",""
"","3133","Update city to 20 characters","sales-portal-api","Fri Dec 26 19:10:18 UTC 2025","passed","Fri Dec 26 19:10:21 UTC 2025","[API][Customers] > [Update customer]","","",""
"","3411","Update name with 41 characters — bad request","sales-portal-api","Fri Dec 26 19:10:10 UTC 2025","passed","Fri Dec 26 19:10:14 UTC 2025","[API][Customers] > [Should NOT update customer]","","",""
"","14701","Should NOT receive products: Received status (already fully received)","sales-portal-api","Fri Dec 26 19:18:07 UTC 2025","passed","Fri Dec 26 19:18:22 UTC 2025","[API][Orders][Receive] > [Negative][Incorrect order status to receive]","","",""
"","18948","Update amount to negative — bad request","sales-portal-api","Fri Dec 26 19:27:30 UTC 2025","passed","Fri Dec 26 19:27:49 UTC 2025","[API][Products] > [Should NOT update product]","","",""
"","28598","Assign manager to order","sales-portal-api","Fri Dec 26 19:10:48 UTC 2025","passed","Fri Dec 26 19:11:16 UTC 2025","[API][Orders][Manager assignment flow] > Order in Received status","","",""
"","152","404 returned for empty id","sales-portal-api","Fri Dec 26 19:26:08 UTC 2025","failed","Fri Dec 26 19:26:09 UTC 2025","[API][Products] > [Should Not Delete Product]","","",""
"","35452","401 returned without token","sales-portal-api","Fri Dec 26 19:24:07 UTC 2025","passed","Fri Dec 26 19:24:42 UTC 2025","[API][Orders] > [Should NOT update order]","","",""
"","3391","Update name with special characters — bad request","sales-portal-api","Fri Dec 26 19:10:14 UTC 2025","passed","Fri Dec 26 19:10:17 UTC 2025","[API][Customers] > [Should NOT update customer]","","",""
"","32160","ORD-PUT-002: Successful update of customer in order","sales-portal-api","Fri Dec 26 19:20:45 UTC 2025","passed","Fri Dec 26 19:21:17 UTC 2025","[API][Orders] > [Update order]","","",""
"","369","CST-009: Delete customer (Invalid Id)","sales-portal-api","Fri Dec 26 19:09:56 UTC 2025","passed","Fri Dec 26 19:09:57 UTC 2025","CST-008/009 Delete customer","","",""
"","506","Empty street [10]","sales-portal-api","Fri Dec 26 19:14:45 UTC 2025","passed","Fri Dec 26 19:14:46 UTC 2025","[API][Orders][Delivery] > [Add Delivery Info] > [Should NOT add Delivery Info]","","",""
"","3090","Update flat number","sales-portal-api","Fri Dec 26 19:10:17 UTC 2025","passed","Fri Dec 26 19:10:20 UTC 2025","[API][Customers] > [Update customer]","","",""
"","20749","Update price with non-integer — bad request","sales-portal-api","Fri Dec 26 19:27:09 UTC 2025","passed","Fri Dec 26 19:27:29 UTC 2025","[API][Products] > [Should NOT update product]","","",""
"","196","404 returned for non-existing id of valid format","sales-portal-api","Fri Dec 26 19:26:10 UTC 2025","passed","Fri Dec 26 19:26:10 UTC 2025","[API][Products] > [Should Not Delete Product]","","",""
"","21290","Canceled: reopen visible, cancel/process hidden","sales-portal-ui","Fri Dec 26 19:37:35 UTC 2025","passed","Fri Dec 26 19:37:57 UTC 2025","[UI][Orders][Order Details]","","",""
"","29904","Should NOT update manager with non-existing orderId","sales-portal-api","Fri Dec 26 19:13:13 UTC 2025","passed","Fri Dec 26 19:13:42 UTC 2025","[API][Orders][Assign/Unassign Manager - Negative DDT] > Order in In Process status","","",""
"","48878","Should NOT receive products: Invalid product id: null string","sales-portal-api","Fri Dec 26 19:21:50 UTC 2025","broken","Fri Dec 26 19:22:39 UTC 2025","[API][Orders][Receive] > [Negative][Invalid request body]","","",""
"","3335","Update notes with < or > symbols — bad request","sales-portal-api","Fri Dec 26 19:10:14 UTC 2025","passed","Fri Dec 26 19:10:18 UTC 2025","[API][Customers] > [Should NOT update customer]","","",""
"","38086","404 returned for non-existing order","sales-portal-api","Fri Dec 26 19:23:03 UTC 2025","passed","Fri Dec 26 19:23:41 UTC 2025","[API][Orders] > [Should NOT update order]","","",""
"","30021","Should return list of all products","sales-portal-api","Fri Dec 26 19:27:29 UTC 2025","broken","Fri Dec 26 19:27:59 UTC 2025","[API] [Sales Portal] [Products] [Get All] > [Positive]","","",""
"","3293","Update customer name with mixed case","sales-portal-api","Fri Dec 26 19:10:05 UTC 2025","passed","Fri Dec 26 19:10:09 UTC 2025","[API][Customers] > [Update customer]","","",""
"","2429","100000 price product not created","sales-portal-api","Fri Dec 26 19:25:49 UTC 2025","passed","Fri Dec 26 19:25:51 UTC 2025","[API][Products] > [Should NOT create product]","","",""
"","1729","Create customer with 40 characters length in street","sales-portal-api","Fri Dec 26 19:09:49 UTC 2025","passed","Fri Dec 26 19:09:51 UTC 2025","[API][Customers][Create Customer] > Positive DDT","","",""
"","49521","Processing: receive 5 products (becomes Received)","sales-portal-api","Fri Dec 26 19:21:51 UTC 2025","broken","Fri Dec 26 19:22:40 UTC 2025","[API][Orders][Receive] > [Positive][Receive order]","","",""
"","317","CST-003: GET /api/customers?country Filter customers by Russia","sales-portal-api","Fri Dec 26 19:10:09 UTC 2025","passed","Fri Dec 26 19:10:09 UTC 2025","CST-003 Get customers list (Filter by Country)","","",""
"","25185","Remove manager from order","sales-portal-api","Fri Dec 26 19:12:33 UTC 2025","passed","Fri Dec 26 19:12:58 UTC 2025","[API][Orders][Manager assignment flow] > Order in In Process status","","",""
"","20745","Order status transition from Partially Received to Draft","sales-portal-api","Fri Dec 26 19:18:10 UTC 2025","passed","Fri Dec 26 19:18:31 UTC 2025","[API][Orders][Negative Orders statuses transition]","","",""
"","423","Too long comment (251) is rejected","sales-portal-api","Fri Dec 26 19:13:50 UTC 2025","passed","Fri Dec 26 19:13:50 UTC 2025","[API][Orders][Comment] > Not create","","",""
"","21460","Should NOT unassign manager from order with non-existing orderId","sales-portal-api","Fri Dec 26 19:11:25 UTC 2025","passed","Fri Dec 26 19:11:47 UTC 2025","[API][Orders][Assign/Unassign Manager - Negative DDT] > Order in Received status","","",""
"","34321","In Process: receiving controls visible","sales-portal-ui","Fri Dec 26 19:37:35 UTC 2025","passed","Fri Dec 26 19:38:10 UTC 2025","[UI][Orders][Order Details]","","",""
"","29658","Should NOT unassign manager from order with non-existing orderId","sales-portal-api","Fri Dec 26 19:13:16 UTC 2025","passed","Fri Dec 26 19:13:45 UTC 2025","[API][Orders][Assign/Unassign Manager - Negative DDT] > Order in Canceled status","","",""
"","54614","Should close modal whith cancel button","sales-portal-ui","Fri Dec 26 19:33:23 UTC 2025","broken","Fri Dec 26 19:34:18 UTC 2025","[UI][Orders][Create Order]","","",""
"","29795","500 returned on invalid ObjectId format for order","sales-portal-api","Fri Dec 26 19:25:19 UTC 2025","passed","Fri Dec 26 19:25:48 UTC 2025","[API][Orders] > [Should NOT update order]","","",""
"","367","CST-003: GET /api/customers?country Filter customers by Great Britain","sales-portal-api","Fri Dec 26 19:09:57 UTC 2025","passed","Fri Dec 26 19:09:57 UTC 2025","CST-003 Get customers list (Filter by Country)","","",""
"","22997","Update amount to 1000 — bad request","sales-portal-api","Fri Dec 26 19:27:49 UTC 2025","passed","Fri Dec 26 19:28:12 UTC 2025","[API][Products] > [Should NOT update product]","","",""
"","23123","400 returned for empty products array","sales-portal-api","Fri Dec 26 19:24:19 UTC 2025","passed","Fri Dec 26 19:24:42 UTC 2025","[API][Orders] > [Should NOT update order]","","",""
"","22040","Update price to 100000 — bad request","sales-portal-api","Fri Dec 26 19:28:34 UTC 2025","passed","Fri Dec 26 19:28:56 UTC 2025","[API][Products] > [Should NOT update product]","","",""
"","426","Not integer price product not created","sales-portal-api","Fri Dec 26 19:25:54 UTC 2025","passed","Fri Dec 26 19:25:55 UTC 2025","[API][Products] > [Should NOT create product]","","",""
"","20476","Assign manager to order","sales-portal-api","Fri Dec 26 19:12:12 UTC 2025","passed","Fri Dec 26 19:12:33 UTC 2025","[API][Orders][Manager assignment flow] > Order in Canceled status","","",""
"","23852","Order status transition from Canceled to Draft","sales-portal-api","Fri Dec 26 19:16:19 UTC 2025","passed","Fri Dec 26 19:16:43 UTC 2025","[API][Orders][Positive Orders statuses transition]","","",""
"","34823","Should NOT unassign manager from order with non-existing orderId","sales-portal-api","Fri Dec 26 19:13:34 UTC 2025","passed","Fri Dec 26 19:14:09 UTC 2025","[API][Orders][Assign/Unassign Manager - Negative DDT] > Order in Partially Received status","","",""
"","1561","Create customer with with upper-case email","sales-portal-api","Fri Dec 26 19:09:55 UTC 2025","passed","Fri Dec 26 19:09:56 UTC 2025","[API][Customers][Create Customer] > Positive DDT","","",""
"","168","Missing finalDate field [0]","sales-portal-api","Fri Dec 26 19:14:23 UTC 2025","passed","Fri Dec 26 19:14:24 UTC 2025","[API][Orders][Delivery] > [Add Delivery Info] > [Should NOT add Delivery Info]","","",""
"","3149","Update city to 1 character","sales-portal-api","Fri Dec 26 19:10:15 UTC 2025","passed","Fri Dec 26 19:10:18 UTC 2025","[API][Customers] > [Update customer]","","",""
"","28162","Should NOT update manager with non-existing managerId","sales-portal-api","Fri Dec 26 19:12:26 UTC 2025","passed","Fri Dec 26 19:12:54 UTC 2025","[API][Orders][Assign/Unassign Manager - Negative DDT] > Order in In Process status","","",""
"","379","CST-003: GET /api/customers?country Filter customers by Canada","sales-portal-api","Fri Dec 26 19:10:08 UTC 2025","passed","Fri Dec 26 19:10:09 UTC 2025","CST-003 Get customers list (Filter by Country)","","",""
"","24329","Order status transition from Canceled to In Process","sales-portal-api","Fri Dec 26 19:15:31 UTC 2025","passed","Fri Dec 26 19:15:55 UTC 2025","[API][Orders][Negative Orders statuses transition]","","",""
"","180","404 returned for non-existing id of valid format","sales-portal-api","Fri Dec 26 19:14:51 UTC 2025","passed","Fri Dec 26 19:14:51 UTC 2025","[API] [Sales Portal] [Orders] [Get By Id] > [Negative]","","",""
"","3184","Update email to valid format","sales-portal-api","Fri Dec 26 19:10:09 UTC 2025","passed","Fri Dec 26 19:10:12 UTC 2025","[API][Customers] > [Update customer]","","",""
"","384","Add regular sentence with punctuation","sales-portal-api","Fri Dec 26 19:13:50 UTC 2025","passed","Fri Dec 26 19:13:51 UTC 2025","[API][Orders][Comment] > Create","","",""
"","30962","Order status transition from Draft to 12345","sales-portal-api","Fri Dec 26 19:15:17 UTC 2025","passed","Fri Dec 26 19:15:48 UTC 2025","[API][Orders][Invalid Orders statuses]","","",""
"","20078","Update with 41 character name — bad request","sales-portal-api","Fri Dec 26 19:27:04 UTC 2025","passed","Fri Dec 26 19:27:24 UTC 2025","[API][Products] > [Should NOT update product]","","",""
"","25993","Remove manager from order","sales-portal-api","Fri Dec 26 19:10:21 UTC 2025","passed","Fri Dec 26 19:10:47 UTC 2025","[API][Orders][Manager assignment flow] > Order in Partially Received status","","",""
"","451","Successfully set pickup condition [1]","sales-portal-api","Fri Dec 26 19:14:22 UTC 2025","passed","Fri Dec 26 19:14:22 UTC 2025","[API][Orders][Delivery] > [Add Delivery Info]","","",""
"","14434","400 returned for id of invalid format","sales-portal-api","Fri Dec 26 19:30:35 UTC 2025","failed","Fri Dec 26 19:30:49 UTC 2025","[API][Products] > [Should NOT find product to update]","","",""
"","3375","Update flat with negative number — bad request","sales-portal-api","Fri Dec 26 19:10:28 UTC 2025","passed","Fri Dec 26 19:10:31 UTC 2025","[API][Customers] > [Should NOT update customer]","","",""
"","3166","Update street to valid format","sales-portal-api","Fri Dec 26 19:10:10 UTC 2025","passed","Fri Dec 26 19:10:14 UTC 2025","[API][Customers] > [Update customer]","","",""
"","2695","Empty name product not created","sales-portal-api","Fri Dec 26 19:25:54 UTC 2025","passed","Fri Dec 26 19:25:57 UTC 2025","[API][Products] > [Should NOT create product]","","",""
