"DESCRIPTION","DURATION IN MS","NAME","PARENT SUITE","START TIME","STATUS","STOP TIME","SUB SUITE","SUITE","TEST CLASS","TEST METHOD"
"","493","Create customer with with upper-case email","sales-portal-api","Wed Dec 24 16:26:23 UTC 2025","passed","Wed Dec 24 16:26:23 UTC 2025","[API][Customers][Create Customer] > Positive DDT","","",""
"","458","Should NOT create customer with existing email","sales-portal-api","Wed Dec 24 16:26:22 UTC 2025","passed","Wed Dec 24 16:26:23 UTC 2025","[API][Customers][Create Customer] > Unique email","","",""
"","10943","Order status transition from In Process to In Process","sales-portal-api","Wed Dec 24 16:29:20 UTC 2025","failed","Wed Dec 24 16:29:31 UTC 2025","[API][Orders][Negative Orders statuses transition]","","",""
"","11046","Should NOT update manager with non-existing orderId","sales-portal-api","Wed Dec 24 16:27:53 UTC 2025","passed","Wed Dec 24 16:28:04 UTC 2025","[API][Orders][Assign/Unassign Manager - Negative DDT] > Order in In Process status","","",""
"","15916","Order status transition from In Process to Draft","sales-portal-api","Wed Dec 24 16:29:33 UTC 2025","passed","Wed Dec 24 16:29:49 UTC 2025","[API][Orders][Negative Orders statuses transition]","","",""
"","6972","Should NOT unassign manager from order with non-existing orderId","sales-portal-api","Wed Dec 24 16:28:12 UTC 2025","passed","Wed Dec 24 16:28:19 UTC 2025","[API][Orders][Assign/Unassign Manager - Negative DDT] > Order in Canceled status","","",""
"","9944","Order status transition from Draft to 12345","sales-portal-api","Wed Dec 24 16:29:01 UTC 2025","passed","Wed Dec 24 16:29:11 UTC 2025","[API][Orders][Invalid Orders statuses]","","",""
"","20937","ORD-PUT-003: Order status is DRAFT after update","sales-portal-api","Wed Dec 24 16:30:52 UTC 2025","passed","Wed Dec 24 16:31:13 UTC 2025","[API][Orders] > [Update order]","","",""
"","632","Missing country in address [3]","sales-portal-api","Wed Dec 24 16:28:43 UTC 2025","passed","Wed Dec 24 16:28:43 UTC 2025","[API][Orders][Delivery] > [Add Delivery Info] > [Should NOT add Delivery Info]","","",""
"","8978","404 returned for non-existing customer","sales-portal-api","Wed Dec 24 16:31:37 UTC 2025","passed","Wed Dec 24 16:31:46 UTC 2025","[API][Orders] > [Should NOT update order]","","",""
"","3904","Create product with 999 amount","sales-portal-api","Wed Dec 24 16:31:45 UTC 2025","passed","Wed Dec 24 16:31:48 UTC 2025","[API][Products] > [Create product]","","",""
"","14987","Should NOT update manager with non-existing managerId","sales-portal-api","Wed Dec 24 16:27:26 UTC 2025","passed","Wed Dec 24 16:27:41 UTC 2025","[API][Orders][Assign/Unassign Manager - Negative DDT] > Order in In Process status","","",""
"","333","Empty street [10]","sales-portal-api","Wed Dec 24 16:28:42 UTC 2025","passed","Wed Dec 24 16:28:43 UTC 2025","[API][Orders][Delivery] > [Add Delivery Info] > [Should NOT add Delivery Info]","","",""
"","563","Update notes to 250 characters","sales-portal-api","Wed Dec 24 16:26:30 UTC 2025","passed","Wed Dec 24 16:26:31 UTC 2025","[API][Customers] > [Update customer]","","",""
"","1924","Delete product","sales-portal-api","Wed Dec 24 16:32:12 UTC 2025","failed","Wed Dec 24 16:32:14 UTC 2025","[API][Products] > [Delete Product]","","",""
"","207","Successfully set pickup condition [1]","sales-portal-api","Wed Dec 24 16:28:41 UTC 2025","passed","Wed Dec 24 16:28:42 UTC 2025","[API][Orders][Delivery] > [Add Delivery Info]","","",""
"","11014","Delete order with product quantity = 1 (min)","sales-portal-api","Wed Dec 24 16:28:20 UTC 2025","passed","Wed Dec 24 16:28:31 UTC 2025","[API][Orders][Delete Order]","","",""
"","956","Clear notes (empty string)","sales-portal-api","Wed Dec 24 16:26:31 UTC 2025","passed","Wed Dec 24 16:26:32 UTC 2025","[API][Customers] > [Update customer]","","",""
"","254","500 returned for id of invalid format","sales-portal-api","Wed Dec 24 16:32:25 UTC 2025","failed","Wed Dec 24 16:32:26 UTC 2025","[API] [Sales Portal] [Products] [Get By Id] > [Negative]","","",""
"","1003","Update name with empty string — bad request","sales-portal-api","Wed Dec 24 16:26:34 UTC 2025","passed","Wed Dec 24 16:26:35 UTC 2025","[API][Customers] > [Should NOT update customer]","","",""
"","834","Update with invalid email format — bad request","sales-portal-api","Wed Dec 24 16:26:30 UTC 2025","passed","Wed Dec 24 16:26:31 UTC 2025","[API][Customers] > [Should NOT update customer]","","",""
"","1080","Update name with special characters — bad request","sales-portal-api","Wed Dec 24 16:26:29 UTC 2025","passed","Wed Dec 24 16:26:30 UTC 2025","[API][Customers] > [Should NOT update customer]","","",""
"","6783","Should NOT assign manager with non-existing managerId","sales-portal-api","Wed Dec 24 16:27:58 UTC 2025","passed","Wed Dec 24 16:28:05 UTC 2025","[API][Orders][Assign/Unassign Manager - Negative DDT] > Order in Draft status","","",""
"","15996","500 returned on invalid ObjectId format for customer","sales-portal-api","Wed Dec 24 16:31:41 UTC 2025","passed","Wed Dec 24 16:31:57 UTC 2025","[API][Orders] > [Should NOT update order]","","",""
"","26761","Should NOT receive products: Empty products array","sales-portal-api","Wed Dec 24 16:29:35 UTC 2025","passed","Wed Dec 24 16:30:02 UTC 2025","[API][Orders][Receive] > [Negative][Invalid request body]","","",""
"","6926","Should NOT assign manager with non-existing managerId","sales-portal-api","Wed Dec 24 16:28:10 UTC 2025","passed","Wed Dec 24 16:28:17 UTC 2025","[API][Orders][Assign/Unassign Manager - Negative DDT] > Order in Received status","","",""
"","922","Update street with 41 characters — bad request","sales-portal-api","Wed Dec 24 16:26:29 UTC 2025","passed","Wed Dec 24 16:26:30 UTC 2025","[API][Customers] > [Should NOT update customer]","","",""
"","8033","Clear notes (empty string)","sales-portal-api","Wed Dec 24 16:32:29 UTC 2025","passed","Wed Dec 24 16:32:37 UTC 2025","[API][Products] > [Update product]","","",""
"","11925","Remove manager from order","sales-portal-api","Wed Dec 24 16:27:06 UTC 2025","passed","Wed Dec 24 16:27:18 UTC 2025","[API][Orders][Manager assignment flow] > Order in Received status","","",""
"","7962","Order status transition from Draft to Canceled","sales-portal-api","Wed Dec 24 16:28:59 UTC 2025","passed","Wed Dec 24 16:29:07 UTC 2025","[API][Orders][Positive Orders statuses transition]","","",""
"","7997","Update amount to negative — bad request","sales-portal-api","Wed Dec 24 16:32:31 UTC 2025","passed","Wed Dec 24 16:32:39 UTC 2025","[API][Products] > [Should NOT update product]","","",""
"","1989","Not integer price product not created","sales-portal-api","Wed Dec 24 16:31:57 UTC 2025","passed","Wed Dec 24 16:31:59 UTC 2025","[API][Products] > [Should NOT create product]","","",""
"","514","Exceeded Max length street name (>40 chars) [12]","sales-portal-api","Wed Dec 24 16:28:41 UTC 2025","passed","Wed Dec 24 16:28:41 UTC 2025","[API][Orders][Delivery] > [Add Delivery Info] > [Should NOT add Delivery Info]","","",""
"","9933","Order status transition from Draft to","sales-portal-api","Wed Dec 24 16:29:15 UTC 2025","passed","Wed Dec 24 16:29:25 UTC 2025","[API][Orders][Invalid Orders statuses]","","",""
"","6986","Remove manager from order","sales-portal-api","Wed Dec 24 16:26:37 UTC 2025","passed","Wed Dec 24 16:26:44 UTC 2025","[API][Orders][Manager assignment flow] > Order in Draft status","","",""
"","11911","Assign manager to order","sales-portal-api","Wed Dec 24 16:26:44 UTC 2025","passed","Wed Dec 24 16:26:56 UTC 2025","[API][Orders][Manager assignment flow] > Order in In Process status","","",""
"","858","404 returned for non-existing id of valid format","sales-portal-api","Wed Dec 24 16:26:30 UTC 2025","passed","Wed Dec 24 16:26:31 UTC 2025","[API][Customers] > [Should NOT find customer to update]","","",""
"","9934","Order status transition from Canceled to Draft","sales-portal-api","Wed Dec 24 16:29:07 UTC 2025","passed","Wed Dec 24 16:29:17 UTC 2025","[API][Orders][Positive Orders statuses transition]","","",""
"","296","Create customer with with upper-case name","sales-portal-api","Wed Dec 24 16:26:22 UTC 2025","passed","Wed Dec 24 16:26:23 UTC 2025","[API][Customers][Create Customer] > Positive DDT","","",""
"","7956","Update name with special characters — bad request","sales-portal-api","Wed Dec 24 16:32:34 UTC 2025","passed","Wed Dec 24 16:32:42 UTC 2025","[API][Products] > [Should NOT update product]","","",""
"","122","Product without amount not created","sales-portal-api","Wed Dec 24 16:31:57 UTC 2025","passed","Wed Dec 24 16:31:58 UTC 2025","[API][Products] > [Should NOT create product]","","",""
"","9989","Should NOT assign manager with non-existing orderId","sales-portal-api","Wed Dec 24 16:26:46 UTC 2025","passed","Wed Dec 24 16:26:56 UTC 2025","[API][Orders][Assign/Unassign Manager - Negative DDT] > Order in Draft status","","",""
"","26839","ORD-PUT-002: Successful update of customer in order","sales-portal-api","Wed Dec 24 16:30:45 UTC 2025","passed","Wed Dec 24 16:31:11 UTC 2025","[API][Orders] > [Update order]","","",""
"","1019","Product without price not created","sales-portal-api","Wed Dec 24 16:31:52 UTC 2025","passed","Wed Dec 24 16:31:53 UTC 2025","[API][Products] > [Should NOT create product]","","",""
"","15997","Order status transition from Partially Received to Canceled","sales-portal-api","Wed Dec 24 16:28:53 UTC 2025","passed","Wed Dec 24 16:29:09 UTC 2025","[API][Orders][Negative Orders statuses transition]","","",""
"","14021","Order status transition from Received to In Process","sales-portal-api","Wed Dec 24 16:29:21 UTC 2025","passed","Wed Dec 24 16:29:35 UTC 2025","[API][Orders][Negative Orders statuses transition]","","",""
"","2540","Update full customer data","sales-portal-api","Wed Dec 24 16:26:32 UTC 2025","passed","Wed Dec 24 16:26:34 UTC 2025","[API][Customers] > [Update customer]","","",""
"","23962","Order status transition from Partially Received to Draft","sales-portal-api","Wed Dec 24 16:29:51 UTC 2025","passed","Wed Dec 24 16:30:15 UTC 2025","[API][Orders][Negative Orders statuses transition]","","",""
"","13770","Should NOT assign manager with non-existing orderId","sales-portal-api","Wed Dec 24 16:26:42 UTC 2025","passed","Wed Dec 24 16:26:56 UTC 2025","[API][Orders][Assign/Unassign Manager - Negative DDT] > Order in Received status","","",""
"","2973","Attempt to update product name with existing one returns error","sales-portal-api","Wed Dec 24 16:33:21 UTC 2025","passed","Wed Dec 24 16:33:24 UTC 2025","[API][Products] > Should NOT update with existing name","","",""
"","888","Update house with negative number — bad request","sales-portal-api","Wed Dec 24 16:26:32 UTC 2025","passed","Wed Dec 24 16:26:32 UTC 2025","[API][Customers] > [Should NOT update customer]","","",""
"","129","Unicode characters in city [15]","sales-portal-api","Wed Dec 24 16:28:43 UTC 2025","passed","Wed Dec 24 16:28:43 UTC 2025","[API][Orders][Delivery] > [Add Delivery Info] > [Should NOT add Delivery Info]","","",""
"","15986","Should NOT assign manager with non-existing managerId","sales-portal-api","Wed Dec 24 16:26:52 UTC 2025","passed","Wed Dec 24 16:27:08 UTC 2025","[API][Orders][Assign/Unassign Manager - Negative DDT] > Order in Partially Received status","","",""
"","147","404 returned for non-existing id of valid format","sales-portal-api","Wed Dec 24 16:26:23 UTC 2025","passed","Wed Dec 24 16:26:23 UTC 2025","[API] [Sales Portal] [Customers] [Get By Id] > [Negative]","","",""
"","8965","Assign manager to order","sales-portal-api","Wed Dec 24 16:26:41 UTC 2025","passed","Wed Dec 24 16:26:50 UTC 2025","[API][Orders][Manager assignment flow] > Order in Received status","","",""
"","7965","Update amount with non-integer — bad request","sales-portal-api","Wed Dec 24 16:32:48 UTC 2025","passed","Wed Dec 24 16:32:55 UTC 2025","[API][Products] > [Should NOT update product]","","",""
"","1020","Update phone to valid format","sales-portal-api","Wed Dec 24 16:26:28 UTC 2025","passed","Wed Dec 24 16:26:29 UTC 2025","[API][Customers] > [Update customer]","","",""
"","382","Create customer with 1 character length in flat","sales-portal-api","Wed Dec 24 16:26:21 UTC 2025","passed","Wed Dec 24 16:26:21 UTC 2025","[API][Customers][Create Customer] > Positive DDT","","",""
"","15938","404 returned for non-existing product id","sales-portal-api","Wed Dec 24 16:31:25 UTC 2025","passed","Wed Dec 24 16:31:41 UTC 2025","[API][Orders] > [Should NOT update order]","","",""
"","845","Should get customer by valid id","sales-portal-api","Wed Dec 24 16:26:23 UTC 2025","passed","Wed Dec 24 16:26:24 UTC 2025","[API] [Sales Portal] [Customers] [Get By Id] > [Positive]","","",""
"","941","400 returned for id of invalid format","sales-portal-api","Wed Dec 24 16:32:17 UTC 2025","failed","Wed Dec 24 16:32:18 UTC 2025","[API][Products] > [Should Not Delete Product]","","",""
"","22967","Should NOT update manager with non-existing managerId","sales-portal-api","Wed Dec 24 16:28:17 UTC 2025","passed","Wed Dec 24 16:28:40 UTC 2025","[API][Orders][Assign/Unassign Manager - Negative DDT] > Order in Received status","","",""
"","919","Update city to 1 character","sales-portal-api","Wed Dec 24 16:26:29 UTC 2025","passed","Wed Dec 24 16:26:30 UTC 2025","[API][Customers] > [Update customer]","","",""
"","133","Zero flat number [8]","sales-portal-api","Wed Dec 24 16:28:40 UTC 2025","passed","Wed Dec 24 16:28:41 UTC 2025","[API][Orders][Delivery] > [Add Delivery Info] > [Should NOT add Delivery Info]","","",""
"","9918","Order status transition from Draft to In Process","sales-portal-api","Wed Dec 24 16:28:46 UTC 2025","passed","Wed Dec 24 16:28:56 UTC 2025","[API][Orders][Negative Orders statuses transition]","","",""
"","6996","Should NOT change order status with non-existing orderId","sales-portal-api","Wed Dec 24 16:29:23 UTC 2025","passed","Wed Dec 24 16:29:30 UTC 2025","[API][Orders][Invalid Orders statuses]","","",""
"","3162","Update phone with invalid format — bad request","sales-portal-api","Wed Dec 24 16:26:32 UTC 2025","passed","Wed Dec 24 16:26:35 UTC 2025","[API][Customers] > [Should NOT update customer]","","",""
"","1929","Name with special characters product not created","sales-portal-api","Wed Dec 24 16:31:49 UTC 2025","passed","Wed Dec 24 16:31:51 UTC 2025","[API][Products] > [Should NOT create product]","","",""
"","17061","400 returned for empty products array","sales-portal-api","Wed Dec 24 16:31:27 UTC 2025","passed","Wed Dec 24 16:31:45 UTC 2025","[API][Orders] > [Should NOT update order]","","",""
"","129","Exeeded Max house number (>999) [13]","sales-portal-api","Wed Dec 24 16:28:42 UTC 2025","passed","Wed Dec 24 16:28:43 UTC 2025","[API][Orders][Delivery] > [Add Delivery Info] > [Should NOT add Delivery Info]","","",""
"","2669","Assign manager to order","sales-portal-api","Wed Dec 24 16:26:30 UTC 2025","passed","Wed Dec 24 16:26:33 UTC 2025","[API][Orders][Manager assignment flow] > Order in Draft status","","",""
"","3001","Past date [6]","sales-portal-api","Wed Dec 24 16:28:48 UTC 2025","failed","Wed Dec 24 16:28:51 UTC 2025","[API][Orders][Delivery] > [Add Delivery Info] > [Should NOT add Delivery Info]","","",""
"","223","CST-003: GET /api/customers?country Filter customers by USA","sales-portal-api","Wed Dec 24 16:26:23 UTC 2025","passed","Wed Dec 24 16:26:24 UTC 2025","CST-003 Get customers list (Filter by Country)","","",""
"","9000","Update price to minimum (1)","sales-portal-api","Wed Dec 24 16:32:42 UTC 2025","passed","Wed Dec 24 16:32:51 UTC 2025","[API][Products] > [Update product]","","",""
"","2860","Update house with 1000 — bad request","sales-portal-api","Wed Dec 24 16:26:32 UTC 2025","passed","Wed Dec 24 16:26:35 UTC 2025","[API][Customers] > [Should NOT update customer]","","",""
"","1109","Update city with empty string — bad request","sales-portal-api","Wed Dec 24 16:26:28 UTC 2025","passed","Wed Dec 24 16:26:29 UTC 2025","[API][Customers] > [Should NOT update customer]","","",""
"","7961","Update price to maximum (99999)","sales-portal-api","Wed Dec 24 16:32:51 UTC 2025","passed","Wed Dec 24 16:32:59 UTC 2025","[API][Products] > [Update product]","","",""
"","549","Update customer name to 40 characters","sales-portal-api","Wed Dec 24 16:26:25 UTC 2025","passed","Wed Dec 24 16:26:26 UTC 2025","[API][Customers] > [Update customer]","","",""
"","989","Successfully set delivery info with all required fields [0]","sales-portal-api","Wed Dec 24 16:28:29 UTC 2025","passed","Wed Dec 24 16:28:30 UTC 2025","[API][Orders][Delivery] > [Add Delivery Info]","","",""
"","1056","Update street with empty string — bad request","sales-portal-api","Wed Dec 24 16:26:30 UTC 2025","passed","Wed Dec 24 16:26:31 UTC 2025","[API][Customers] > [Should NOT update customer]","","",""
"","384","Empty comment ID is rejected","sales-portal-api","Wed Dec 24 16:28:10 UTC 2025","passed","Wed Dec 24 16:28:11 UTC 2025","[API][Orders][Comment] > Not delete","","",""
"","9909","Order status transition from Draft with delivery to Canceled","sales-portal-api","Wed Dec 24 16:28:49 UTC 2025","passed","Wed Dec 24 16:28:59 UTC 2025","[API][Orders][Positive Orders statuses transition]","","",""
"","16877","ORD-PUT-004: History entry recorded when order composition changes","sales-portal-api","Wed Dec 24 16:31:09 UTC 2025","passed","Wed Dec 24 16:31:25 UTC 2025","[API][Orders] > [Update order]","","",""
"","422","Create customer with empty notes","sales-portal-api","Wed Dec 24 16:26:21 UTC 2025","passed","Wed Dec 24 16:26:21 UTC 2025","[API][Customers][Create Customer] > Positive DDT","","",""
"","8904","Update only manufacturer","sales-portal-api","Wed Dec 24 16:32:37 UTC 2025","passed","Wed Dec 24 16:32:46 UTC 2025","[API][Products] > [Update product]","","",""
"","1909","Update phone without + sign — bad request","sales-portal-api","Wed Dec 24 16:26:36 UTC 2025","passed","Wed Dec 24 16:26:37 UTC 2025","[API][Customers] > [Should NOT update customer]","","",""
"","2684","Order status transition from Draft to Draft","sales-portal-api","Wed Dec 24 16:28:44 UTC 2025","passed","Wed Dec 24 16:28:46 UTC 2025","[API][Orders][Negative Orders statuses transition]","","",""
"","702","Update city to 20 characters","sales-portal-api","Wed Dec 24 16:26:30 UTC 2025","passed","Wed Dec 24 16:26:30 UTC 2025","[API][Customers] > [Update customer]","","",""
"","8957","Update amount to 1000 — bad request","sales-portal-api","Wed Dec 24 16:32:39 UTC 2025","passed","Wed Dec 24 16:32:48 UTC 2025","[API][Products] > [Should NOT update product]","","",""
"","11933","Should NOT assign manager with non-existing orderId","sales-portal-api","Wed Dec 24 16:27:41 UTC 2025","passed","Wed Dec 24 16:27:53 UTC 2025","[API][Orders][Assign/Unassign Manager - Negative DDT] > Order in In Process status","","",""
"","6072","Update manager to another manager","sales-portal-api","Wed Dec 24 16:26:56 UTC 2025","passed","Wed Dec 24 16:27:02 UTC 2025","[API][Orders][Manager assignment flow] > Order in In Process status","","",""
"","14969","Update manager to another manager","sales-portal-api","Wed Dec 24 16:27:28 UTC 2025","passed","Wed Dec 24 16:27:43 UTC 2025","[API][Orders][Manager assignment flow] > Order in Canceled status","","",""
"","3596","Should get product by valid id","sales-portal-api","Wed Dec 24 16:32:14 UTC 2025","passed","Wed Dec 24 16:32:17 UTC 2025","[API] [Sales Portal] [Products] [Get By Id] > [Positive]","","",""
"","5979","Create product with 40 character length in name","sales-portal-api","Wed Dec 24 16:31:51 UTC 2025","passed","Wed Dec 24 16:31:57 UTC 2025","[API][Products] > [Create product]","","",""
"","842","Comment with '<' is rejected","sales-portal-api","Wed Dec 24 16:28:14 UTC 2025","failed","Wed Dec 24 16:28:15 UTC 2025","[API][Orders][Comment] > Not create","","",""
"","11907","Should NOT assign manager with non-existing managerId","sales-portal-api","Wed Dec 24 16:27:23 UTC 2025","passed","Wed Dec 24 16:27:35 UTC 2025","[API][Orders][Assign/Unassign Manager - Negative DDT] > Order in Canceled status","","",""
"","358","Create customer with with upper-case city","sales-portal-api","Wed Dec 24 16:26:22 UTC 2025","passed","Wed Dec 24 16:26:23 UTC 2025","[API][Customers][Create Customer] > Positive DDT","","",""
"","130","Non-existing commentId rejected","sales-portal-api","Wed Dec 24 16:28:31 UTC 2025","passed","Wed Dec 24 16:28:32 UTC 2025","[API][Orders][Comment] > Not delete","","",""
"","923","Update notes with < or > symbols — bad request","sales-portal-api","Wed Dec 24 16:26:29 UTC 2025","passed","Wed Dec 24 16:26:30 UTC 2025","[API][Customers] > [Should NOT update customer]","","",""
"","10002","Delete existing comment","sales-portal-api","Wed Dec 24 16:28:20 UTC 2025","passed","Wed Dec 24 16:28:30 UTC 2025","[API][Orders][Comment] > Delete","","",""
"","3024","Update amount to maximum (999)","sales-portal-api","Wed Dec 24 16:32:19 UTC 2025","passed","Wed Dec 24 16:32:22 UTC 2025","[API][Products] > [Update product]","","",""
"","6990","Update name with double spaces — bad request","sales-portal-api","Wed Dec 24 16:32:27 UTC 2025","passed","Wed Dec 24 16:32:34 UTC 2025","[API][Products] > [Should NOT update product]","","",""
"","1888","2 character name product not created","sales-portal-api","Wed Dec 24 16:32:08 UTC 2025","passed","Wed Dec 24 16:32:09 UTC 2025","[API][Products] > [Should NOT create product]","","",""
"","5384","Order status transition from Draft with delivery to In Process","sales-portal-api","Wed Dec 24 16:28:43 UTC 2025","passed","Wed Dec 24 16:28:49 UTC 2025","[API][Orders][Positive Orders statuses transition]","","",""
"","36873","Processing: receive 5 products (becomes Received)","sales-portal-api","Wed Dec 24 16:30:16 UTC 2025","passed","Wed Dec 24 16:30:52 UTC 2025","[API][Orders][Receive] > [Positive][Receive order]","","",""
"","1913","404 returned for non-existing id of valid format","sales-portal-api","Wed Dec 24 16:32:10 UTC 2025","passed","Wed Dec 24 16:32:12 UTC 2025","[API][Products] > [Should Not Delete Product]","","",""
"","1003","400 returned for id of invalid format","sales-portal-api","Wed Dec 24 16:33:19 UTC 2025","failed","Wed Dec 24 16:33:20 UTC 2025","[API][Products] > [Should NOT find product to update]","","",""
"","412","CST-009: Delete customer (Invalid Id)","sales-portal-api","Wed Dec 24 16:26:23 UTC 2025","passed","Wed Dec 24 16:26:23 UTC 2025","CST-008/009 Delete customer","","",""
"","16025","Should NOT assign manager with non-existing orderId","sales-portal-api","Wed Dec 24 16:27:22 UTC 2025","passed","Wed Dec 24 16:27:38 UTC 2025","[API][Orders][Assign/Unassign Manager - Negative DDT] > Order in Partially Received status","","",""
"","393","Create customer with 20 characters length in city","sales-portal-api","Wed Dec 24 16:26:22 UTC 2025","passed","Wed Dec 24 16:26:22 UTC 2025","[API][Customers][Create Customer] > Positive DDT","","",""
"","6926","Update price to negative value — bad request","sales-portal-api","Wed Dec 24 16:32:59 UTC 2025","passed","Wed Dec 24 16:33:05 UTC 2025","[API][Products] > [Should NOT update product]","","",""
"","255","CST-003: GET /api/customers?country Filter customers by Belarus","sales-portal-api","Wed Dec 24 16:26:23 UTC 2025","passed","Wed Dec 24 16:26:24 UTC 2025","CST-003 Get customers list (Filter by Country)","","",""
"","29956","Should NOT receive products: Invalid product id: date string","sales-portal-api","Wed Dec 24 16:31:09 UTC 2025","passed","Wed Dec 24 16:31:39 UTC 2025","[API][Orders][Receive] > [Negative][Invalid request body]","","",""
"","700","Missing condition field [1]","sales-portal-api","Wed Dec 24 16:28:42 UTC 2025","passed","Wed Dec 24 16:28:42 UTC 2025","[API][Orders][Delivery] > [Add Delivery Info] > [Should NOT add Delivery Info]","","",""
"","44003","Should NOT receive products: Invalid product id: negative value string","sales-portal-api","Wed Dec 24 16:30:24 UTC 2025","passed","Wed Dec 24 16:31:08 UTC 2025","[API][Orders][Receive] > [Negative][Invalid request body]","","",""
"","1001","Empty name product not created","sales-portal-api","Wed Dec 24 16:31:51 UTC 2025","passed","Wed Dec 24 16:31:52 UTC 2025","[API][Products] > [Should NOT create product]","","",""
"","459","Create customer with 4 characters length in flat","sales-portal-api","Wed Dec 24 16:26:22 UTC 2025","passed","Wed Dec 24 16:26:22 UTC 2025","[API][Customers][Create Customer] > Positive DDT","","",""
"","173","CST-003: GET /api/customers?country Filter customers by Great Britain","sales-portal-api","Wed Dec 24 16:26:24 UTC 2025","passed","Wed Dec 24 16:26:24 UTC 2025","CST-003 Get customers list (Filter by Country)","","",""
"","1291","Update name with 41 characters — bad request","sales-portal-api","Wed Dec 24 16:26:27 UTC 2025","passed","Wed Dec 24 16:26:29 UTC 2025","[API][Customers] > [Should NOT update customer]","","",""
"","37992","Should NOT receive products: More than 5 products in request","sales-portal-api","Wed Dec 24 16:29:54 UTC 2025","passed","Wed Dec 24 16:30:32 UTC 2025","[API][Orders][Receive] > [Negative][Invalid request body]","","",""
"","14969","Should NOT receive products: Received status (already fully received)","sales-portal-api","Wed Dec 24 16:29:39 UTC 2025","passed","Wed Dec 24 16:29:54 UTC 2025","[API][Orders][Receive] > [Negative][Incorrect order status to receive]","","",""
"","1925","0 price product not created","sales-portal-api","Wed Dec 24 16:31:53 UTC 2025","passed","Wed Dec 24 16:31:54 UTC 2025","[API][Products] > [Should NOT create product]","","",""
"","3944","Negative price product not created","sales-portal-api","Wed Dec 24 16:31:53 UTC 2025","passed","Wed Dec 24 16:31:57 UTC 2025","[API][Products] > [Should NOT create product]","","",""
"","13967","ORD-PUT-013: PUT without changes does not add REQUIRED_PRODUCTS_CHANGED history entry","sales-portal-api","Wed Dec 24 16:31:13 UTC 2025","passed","Wed Dec 24 16:31:27 UTC 2025","[API][Orders] > [Update order]","","",""
