"DESCRIPTION","DURATION IN MS","NAME","PARENT SUITE","START TIME","STATUS","STOP TIME","SUB SUITE","SUITE","TEST CLASS","TEST METHOD"
"","1954","Update phone with invalid format — bad request","sales-portal-api","Sun Dec 21 21:47:24 UTC 2025","passed","Sun Dec 21 21:47:26 UTC 2025","[API][Customers] > [Should NOT update customer]","","",""
"","6946","Update name with special characters — bad request","sales-portal-api","Sun Dec 21 21:53:36 UTC 2025","passed","Sun Dec 21 21:53:43 UTC 2025","[API][Products] > [Should NOT update product]","","",""
"","971","Update notes with 251 characters — bad request","sales-portal-api","Sun Dec 21 21:47:19 UTC 2025","passed","Sun Dec 21 21:47:19 UTC 2025","[API][Customers] > [Should NOT update customer]","","",""
"","171","Comment with '<' is rejected","sales-portal-api","Sun Dec 21 21:49:03 UTC 2025","failed","Sun Dec 21 21:49:03 UTC 2025","[API][Orders][Comment] > Not create","","",""
"","7905","Order status transition from Draft to","sales-portal-api","Sun Dec 21 21:50:11 UTC 2025","passed","Sun Dec 21 21:50:19 UTC 2025","[API][Orders][Invalid Orders statuses]","","",""
"","475","Create customer 250 characters length in notes","sales-portal-api","Sun Dec 21 21:47:12 UTC 2025","passed","Sun Dec 21 21:47:13 UTC 2025","[API][Customers][Create Customer] > Positive DDT","","",""
"","1930","Update notes with < or > symbols — bad request","sales-portal-api","Sun Dec 21 21:47:20 UTC 2025","passed","Sun Dec 21 21:47:22 UTC 2025","[API][Customers] > [Should NOT update customer]","","",""
"","6987","Create product with 3 character length in name","sales-portal-api","Sun Dec 21 21:52:39 UTC 2025","passed","Sun Dec 21 21:52:46 UTC 2025","[API][Products] > [Create product]","","",""
"","7881","Order status transition from Draft to undefined","sales-portal-api","Sun Dec 21 21:50:11 UTC 2025","passed","Sun Dec 21 21:50:19 UTC 2025","[API][Orders][Invalid Orders statuses]","","",""
"","23919","Order status transition from Received to Canceled","sales-portal-api","Sun Dec 21 21:50:31 UTC 2025","passed","Sun Dec 21 21:50:55 UTC 2025","[API][Orders][Negative Orders statuses transition]","","",""
"","14010","404 returned for non-existing customer","sales-portal-api","Sun Dec 21 21:52:27 UTC 2025","passed","Sun Dec 21 21:52:41 UTC 2025","[API][Orders] > [Should NOT update order]","","",""
"","419","Create customer with 3 characters length in house","sales-portal-api","Sun Dec 21 21:47:13 UTC 2025","passed","Sun Dec 21 21:47:13 UTC 2025","[API][Customers][Create Customer] > Positive DDT","","",""
"","16928","Remove manager from order","sales-portal-api","Sun Dec 21 21:47:53 UTC 2025","passed","Sun Dec 21 21:48:09 UTC 2025","[API][Orders][Manager assignment flow] > Order in Received status","","",""
"","9963","Should NOT assign manager with non-existing managerId","sales-portal-api","Sun Dec 21 21:48:18 UTC 2025","passed","Sun Dec 21 21:48:28 UTC 2025","[API][Orders][Assign/Unassign Manager - Negative DDT] > Order in Canceled status","","",""
"","204","CST-003: GET /api/customers?country Filter customers by Germany","sales-portal-api","Sun Dec 21 21:47:14 UTC 2025","passed","Sun Dec 21 21:47:14 UTC 2025","CST-003 Get customers list (Filter by Country)","","",""
"","8963","Should NOT unassign manager from order with non-existing orderId","sales-portal-api","Sun Dec 21 21:47:56 UTC 2025","passed","Sun Dec 21 21:48:05 UTC 2025","[API][Orders][Assign/Unassign Manager - Negative DDT] > Order in Draft status","","",""
"","2793","Assign manager to order","sales-portal-api","Sun Dec 21 21:47:23 UTC 2025","passed","Sun Dec 21 21:47:25 UTC 2025","[API][Orders][Manager assignment flow] > Order in Draft status","","",""
"","130","Product without amount not created","sales-portal-api","Sun Dec 21 21:52:54 UTC 2025","passed","Sun Dec 21 21:52:54 UTC 2025","[API][Products] > [Should NOT create product]","","",""
"","5914","Order status transition from Draft to In Process","sales-portal-api","Sun Dec 21 21:49:40 UTC 2025","passed","Sun Dec 21 21:49:46 UTC 2025","[API][Orders][Negative Orders statuses transition]","","",""
"","6942","Update price to 100000 — bad request","sales-portal-api","Sun Dec 21 21:53:51 UTC 2025","passed","Sun Dec 21 21:53:58 UTC 2025","[API][Products] > [Should NOT update product]","","",""
"","4964","Create order with product quantity = 1 (min)","sales-portal-api","Sun Dec 21 21:49:03 UTC 2025","passed","Sun Dec 21 21:49:08 UTC 2025","[API][Orders][Create Order] > Positive DDT","","",""
"","11985","Update manager to another manager","sales-portal-api","Sun Dec 21 21:47:41 UTC 2025","passed","Sun Dec 21 21:47:53 UTC 2025","[API][Orders][Manager assignment flow] > Order in Received status","","",""
"","495","Create customer with 20 characters length in phone","sales-portal-api","Sun Dec 21 21:47:13 UTC 2025","passed","Sun Dec 21 21:47:14 UTC 2025","[API][Customers][Create Customer] > Positive DDT","","",""
"","3102","Add 1-char comment","sales-portal-api","Sun Dec 21 21:48:40 UTC 2025","passed","Sun Dec 21 21:48:43 UTC 2025","[API][Orders][Comment] > Create","","",""
"","927","Name with 2 spaces product not created","sales-portal-api","Sun Dec 21 21:52:43 UTC 2025","passed","Sun Dec 21 21:52:44 UTC 2025","[API][Products] > [Should NOT create product]","","",""
"","12929","Should NOT update manager with non-existing orderId","sales-portal-api","Sun Dec 21 21:48:45 UTC 2025","passed","Sun Dec 21 21:48:58 UTC 2025","[API][Orders][Assign/Unassign Manager - Negative DDT] > Order in In Process status","","",""
"","973","100000 price product not created","sales-portal-api","Sun Dec 21 21:52:46 UTC 2025","passed","Sun Dec 21 21:52:47 UTC 2025","[API][Products] > [Should NOT create product]","","",""
"","6581","Update price with non-integer — bad request","sales-portal-api","Sun Dec 21 21:53:20 UTC 2025","passed","Sun Dec 21 21:53:26 UTC 2025","[API][Products] > [Should NOT update product]","","",""
"","312","Create customer with with upper-case name","sales-portal-api","Sun Dec 21 21:47:13 UTC 2025","passed","Sun Dec 21 21:47:13 UTC 2025","[API][Customers][Create Customer] > Positive DDT","","",""
"","11966","Remove manager from order","sales-portal-api","Sun Dec 21 21:47:58 UTC 2025","passed","Sun Dec 21 21:48:09 UTC 2025","[API][Orders][Manager assignment flow] > Order in In Process status","","",""
"","9639","Should NOT update manager with non-existing managerId","sales-portal-api","Sun Dec 21 21:47:28 UTC 2025","passed","Sun Dec 21 21:47:37 UTC 2025","[API][Orders][Assign/Unassign Manager - Negative DDT] > Order in Draft status","","",""
"","1952","Invalid ID format rejected","sales-portal-api","Sun Dec 21 21:48:58 UTC 2025","passed","Sun Dec 21 21:49:00 UTC 2025","[API][Orders][Comment] > Not delete","","",""
"","3668","Add regular sentence with punctuation","sales-portal-api","Sun Dec 21 21:48:45 UTC 2025","passed","Sun Dec 21 21:48:49 UTC 2025","[API][Orders][Comment] > Create","","",""
"","24976","Should NOT update manager with non-existing managerId","sales-portal-api","Sun Dec 21 21:49:10 UTC 2025","passed","Sun Dec 21 21:49:35 UTC 2025","[API][Orders][Assign/Unassign Manager - Negative DDT] > Order in Received status","","",""
"","361","Create customer with with upper-case city","sales-portal-api","Sun Dec 21 21:47:13 UTC 2025","passed","Sun Dec 21 21:47:13 UTC 2025","[API][Customers][Create Customer] > Positive DDT","","",""
"","2000","251 notes product not created","sales-portal-api","Sun Dec 21 21:52:58 UTC 2025","passed","Sun Dec 21 21:53:00 UTC 2025","[API][Products] > [Should NOT create product]","","",""
"","553","Create customer with empty notes","sales-portal-api","Sun Dec 21 21:47:11 UTC 2025","passed","Sun Dec 21 21:47:11 UTC 2025","[API][Customers][Create Customer] > Positive DDT","","",""
"","436","Empty city [9]","sales-portal-api","Sun Dec 21 21:49:36 UTC 2025","passed","Sun Dec 21 21:49:37 UTC 2025","[API][Orders][Delivery] > [Add Delivery Info] > [Should NOT add Delivery Info]","","",""
"","7053","Order status transition from Draft with delivery to Canceled","sales-portal-api","Sun Dec 21 21:49:41 UTC 2025","passed","Sun Dec 21 21:49:48 UTC 2025","[API][Orders][Positive Orders statuses transition]","","",""
"","815","Successfully set delivery info with all required fields [0]","sales-portal-api","Sun Dec 21 21:49:16 UTC 2025","passed","Sun Dec 21 21:49:16 UTC 2025","[API][Orders][Delivery] > [Add Delivery Info]","","",""
"","5950","Order status transition from Draft to null","sales-portal-api","Sun Dec 21 21:50:19 UTC 2025","passed","Sun Dec 21 21:50:25 UTC 2025","[API][Orders][Invalid Orders statuses]","","",""
"","1046","Update street to valid format","sales-portal-api","Sun Dec 21 21:47:18 UTC 2025","passed","Sun Dec 21 21:47:19 UTC 2025","[API][Customers] > [Update customer]","","",""
"","964","Name with special characters product not created","sales-portal-api","Sun Dec 21 21:52:48 UTC 2025","passed","Sun Dec 21 21:52:49 UTC 2025","[API][Products] > [Should NOT create product]","","",""
"","2020","Update street with 41 characters — bad request","sales-portal-api","Sun Dec 21 21:47:20 UTC 2025","passed","Sun Dec 21 21:47:22 UTC 2025","[API][Customers] > [Should NOT update customer]","","",""
"","446","Create customer with 20 characters length in city","sales-portal-api","Sun Dec 21 21:47:12 UTC 2025","passed","Sun Dec 21 21:47:13 UTC 2025","[API][Customers][Create Customer] > Positive DDT","","",""
"","1063","Update name with empty string — bad request","sales-portal-api","Sun Dec 21 21:47:27 UTC 2025","passed","Sun Dec 21 21:47:28 UTC 2025","[API][Customers] > [Should NOT update customer]","","",""
"","6967","Update amount with non-integer — bad request","sales-portal-api","Sun Dec 21 21:53:46 UTC 2025","passed","Sun Dec 21 21:53:53 UTC 2025","[API][Products] > [Should NOT update product]","","",""
"","453","Create customer with 1 character length in name","sales-portal-api","Sun Dec 21 21:47:11 UTC 2025","passed","Sun Dec 21 21:47:12 UTC 2025","[API][Customers][Create Customer] > Positive DDT","","",""
"","10868","Should NOT assign manager with non-existing orderId","sales-portal-api","Sun Dec 21 21:48:45 UTC 2025","passed","Sun Dec 21 21:48:56 UTC 2025","[API][Orders][Assign/Unassign Manager - Negative DDT] > Order in Canceled status","","",""
"","8949","Update amount to minimum (0)","sales-portal-api","Sun Dec 21 21:53:46 UTC 2025","passed","Sun Dec 21 21:53:55 UTC 2025","[API][Products] > [Update product]","","",""
"","1014","Product without price not created","sales-portal-api","Sun Dec 21 21:52:49 UTC 2025","passed","Sun Dec 21 21:52:50 UTC 2025","[API][Products] > [Should NOT create product]","","",""
"","24944","Processing: receive 3 products (becomes Partially Received)","sales-portal-api","Sun Dec 21 21:50:41 UTC 2025","passed","Sun Dec 21 21:51:06 UTC 2025","[API][Orders][Receive] > [Positive][Receive order]","","",""
"","18012","Should NOT update manager with non-existing orderId","sales-portal-api","Sun Dec 21 21:48:32 UTC 2025","passed","Sun Dec 21 21:48:50 UTC 2025","[API][Orders][Assign/Unassign Manager - Negative DDT] > Order in Partially Received status","","",""
"","14967","Assign manager to order","sales-portal-api","Sun Dec 21 21:48:10 UTC 2025","passed","Sun Dec 21 21:48:25 UTC 2025","[API][Orders][Manager assignment flow] > Order in Partially Received status","","",""
"","1971","Update product name to 40 characters","sales-portal-api","Sun Dec 21 21:53:20 UTC 2025","passed","Sun Dec 21 21:53:22 UTC 2025","[API][Products] > [Update product]","","",""
"","11969","Should NOT unassign manager from order with non-existing orderId","sales-portal-api","Sun Dec 21 21:48:50 UTC 2025","passed","Sun Dec 21 21:49:02 UTC 2025","[API][Orders][Assign/Unassign Manager - Negative DDT] > Order in Partially Received status","","",""
"","31842","Should NOT receive products: Invalid product id: dummy string","sales-portal-api","Sun Dec 21 21:50:55 UTC 2025","passed","Sun Dec 21 21:51:26 UTC 2025","[API][Orders][Receive] > [Negative][Invalid request body]","","",""
"","364","Empty street [10]","sales-portal-api","Sun Dec 21 21:49:37 UTC 2025","passed","Sun Dec 21 21:49:37 UTC 2025","[API][Orders][Delivery] > [Add Delivery Info] > [Should NOT add Delivery Info]","","",""
"","10978","Update manager to another manager","sales-portal-api","Sun Dec 21 21:47:47 UTC 2025","passed","Sun Dec 21 21:47:57 UTC 2025","[API][Orders][Manager assignment flow] > Order in In Process status","","",""
"","196","CST-003: GET /api/customers?country Filter customers by USA","sales-portal-api","Sun Dec 21 21:47:14 UTC 2025","passed","Sun Dec 21 21:47:14 UTC 2025","CST-003 Get customers list (Filter by Country)","","",""
"","1030","Update with empty email — bad request","sales-portal-api","Sun Dec 21 21:47:23 UTC 2025","passed","Sun Dec 21 21:47:24 UTC 2025","[API][Customers] > [Should NOT update customer]","","",""
"","3939","Update manager to another manager","sales-portal-api","Sun Dec 21 21:47:26 UTC 2025","passed","Sun Dec 21 21:47:29 UTC 2025","[API][Orders][Manager assignment flow] > Order in Draft status","","",""
"","759","Special characters in street [14]","sales-portal-api","Sun Dec 21 21:49:37 UTC 2025","passed","Sun Dec 21 21:49:38 UTC 2025","[API][Orders][Delivery] > [Add Delivery Info] > [Should NOT add Delivery Info]","","",""
"","20980","400 returned for empty products array","sales-portal-api","Sun Dec 21 21:52:25 UTC 2025","passed","Sun Dec 21 21:52:46 UTC 2025","[API][Orders] > [Should NOT update order]","","",""
"","1827","Update flat number","sales-portal-api","Sun Dec 21 21:47:20 UTC 2025","passed","Sun Dec 21 21:47:22 UTC 2025","[API][Customers] > [Update customer]","","",""
"","6975","Update product name with 1 space","sales-portal-api","Sun Dec 21 21:53:22 UTC 2025","passed","Sun Dec 21 21:53:29 UTC 2025","[API][Products] > [Update product]","","",""
"","5957","Create product with 99999 price","sales-portal-api","Sun Dec 21 21:52:59 UTC 2025","passed","Sun Dec 21 21:53:05 UTC 2025","[API][Products] > [Create product]","","",""
"","44969","Should NOT receive products: Product id with non-existing id","sales-portal-api","Sun Dec 21 21:51:27 UTC 2025","passed","Sun Dec 21 21:52:12 UTC 2025","[API][Orders][Receive] > [Negative][Invalid request body]","","",""
"","5092","Create product with empty notes","sales-portal-api","Sun Dec 21 21:52:58 UTC 2025","passed","Sun Dec 21 21:53:03 UTC 2025","[API][Products] > [Create product]","","",""
"","24023","Should NOT receive products: Empty products array","sales-portal-api","Sun Dec 21 21:50:25 UTC 2025","passed","Sun Dec 21 21:50:49 UTC 2025","[API][Orders][Receive] > [Negative][Invalid request body]","","",""
"","7967","Update notes to 250 characters","sales-portal-api","Sun Dec 21 21:53:24 UTC 2025","passed","Sun Dec 21 21:53:32 UTC 2025","[API][Products] > [Update product]","","",""
"","416","Create customer with upper-case street","sales-portal-api","Sun Dec 21 21:47:12 UTC 2025","passed","Sun Dec 21 21:47:13 UTC 2025","[API][Customers][Create Customer] > Positive DDT","","",""
"","8010","404 returned for non-existing product id","sales-portal-api","Sun Dec 21 21:52:20 UTC 2025","passed","Sun Dec 21 21:52:28 UTC 2025","[API][Orders] > [Should NOT update order]","","",""
"","1817","Missing condition field [1]","sales-portal-api","Sun Dec 21 21:49:32 UTC 2025","passed","Sun Dec 21 21:49:34 UTC 2025","[API][Orders][Delivery] > [Add Delivery Info] > [Should NOT add Delivery Info]","","",""
"","8929","Update name with double spaces — bad request","sales-portal-api","Sun Dec 21 21:53:27 UTC 2025","passed","Sun Dec 21 21:53:36 UTC 2025","[API][Products] > [Should NOT update product]","","",""
"","493","Should NOT create customer with existing email","sales-portal-api","Sun Dec 21 21:47:13 UTC 2025","passed","Sun Dec 21 21:47:13 UTC 2025","[API][Customers][Create Customer] > Unique email","","",""
"","882","Update house number","sales-portal-api","Sun Dec 21 21:47:19 UTC 2025","passed","Sun Dec 21 21:47:20 UTC 2025","[API][Customers] > [Update customer]","","",""
"","7975","Update price to 0 — bad request","sales-portal-api","Sun Dec 21 21:53:43 UTC 2025","passed","Sun Dec 21 21:53:51 UTC 2025","[API][Products] > [Should NOT update product]","","",""
"","656","Update customer name to 40 characters","sales-portal-api","Sun Dec 21 21:47:16 UTC 2025","passed","Sun Dec 21 21:47:16 UTC 2025","[API][Customers] > [Update customer]","","",""
"","6990","Update with 2 character name — bad request","sales-portal-api","Sun Dec 21 21:53:56 UTC 2025","passed","Sun Dec 21 21:54:03 UTC 2025","[API][Products] > [Should NOT update product]","","",""
"","33957","Order status transition from Partially Received to Draft","sales-portal-api","Sun Dec 21 21:50:53 UTC 2025","passed","Sun Dec 21 21:51:27 UTC 2025","[API][Orders][Negative Orders statuses transition]","","",""
"","10859","ORD-PUT-013: PUT without changes does not add REQUIRED_PRODUCTS_CHANGED history entry","sales-portal-api","Sun Dec 21 21:52:14 UTC 2025","passed","Sun Dec 21 21:52:25 UTC 2025","[API][Orders] > [Update order]","","",""
"","8953","Order status transition from In Process to In Process","sales-portal-api","Sun Dec 21 21:50:14 UTC 2025","failed","Sun Dec 21 21:50:23 UTC 2025","[API][Orders][Negative Orders statuses transition]","","",""
"","994","Invalid date format [5]","sales-portal-api","Sun Dec 21 21:49:34 UTC 2025","passed","Sun Dec 21 21:49:35 UTC 2025","[API][Orders][Delivery] > [Add Delivery Info] > [Should NOT add Delivery Info]","","",""
"","1926","Without manufacturer product not created","sales-portal-api","Sun Dec 21 21:52:54 UTC 2025","passed","Sun Dec 21 21:52:56 UTC 2025","[API][Products] > [Should NOT create product]","","",""
"","373","Create customer with 1 character length in city","sales-portal-api","Sun Dec 21 21:47:11 UTC 2025","passed","Sun Dec 21 21:47:11 UTC 2025","[API][Customers][Create Customer] > Positive DDT","","",""
"","1908","Update flat with 10000 — bad request","sales-portal-api","Sun Dec 21 21:47:33 UTC 2025","passed","Sun Dec 21 21:47:34 UTC 2025","[API][Customers] > [Should NOT update customer]","","",""
"","37929","Should NOT receive products: More than 5 products in request","sales-portal-api","Sun Dec 21 21:50:57 UTC 2025","passed","Sun Dec 21 21:51:35 UTC 2025","[API][Orders][Receive] > [Negative][Invalid request body]","","",""
"","13986","Should NOT update manager with non-existing orderId","sales-portal-api","Sun Dec 21 21:47:49 UTC 2025","passed","Sun Dec 21 21:48:02 UTC 2025","[API][Orders][Assign/Unassign Manager - Negative DDT] > Order in Received status","","",""
"","5910","Create product with 1 space in name","sales-portal-api","Sun Dec 21 21:52:50 UTC 2025","passed","Sun Dec 21 21:52:56 UTC 2025","[API][Products] > [Create product]","","",""
"","3104","Notes with < or > symbols product not created","sales-portal-api","Sun Dec 21 21:53:00 UTC 2025","passed","Sun Dec 21 21:53:03 UTC 2025","[API][Products] > [Should NOT create product]","","",""
"","1007","400 returned for id of invalid format","sales-portal-api","Sun Dec 21 21:54:17 UTC 2025","failed","Sun Dec 21 21:54:18 UTC 2025","[API][Products] > [Should NOT find product to update]","","",""
"","11952","Should NOT assign manager with non-existing orderId","sales-portal-api","Sun Dec 21 21:48:33 UTC 2025","passed","Sun Dec 21 21:48:45 UTC 2025","[API][Orders][Assign/Unassign Manager - Negative DDT] > Order in In Process status","","",""
"","2003","Negative amount product not created","sales-portal-api","Sun Dec 21 21:52:54 UTC 2025","passed","Sun Dec 21 21:52:56 UTC 2025","[API][Products] > [Should NOT create product]","","",""
"","8009","Delete existing comment","sales-portal-api","Sun Dec 21 21:49:12 UTC 2025","passed","Sun Dec 21 21:49:20 UTC 2025","[API][Orders][Comment] > Delete","","",""
"","7914","Assign manager to order","sales-portal-api","Sun Dec 21 21:47:33 UTC 2025","passed","Sun Dec 21 21:47:40 UTC 2025","[API][Orders][Manager assignment flow] > Order in Received status","","",""
"","907","Missing country in address [3]","sales-portal-api","Sun Dec 21 21:49:35 UTC 2025","passed","Sun Dec 21 21:49:36 UTC 2025","[API][Orders][Delivery] > [Add Delivery Info] > [Should NOT add Delivery Info]","","",""
"","1004","Single character city name [3]","sales-portal-api","Sun Dec 21 21:49:35 UTC 2025","passed","Sun Dec 21 21:49:36 UTC 2025","[API][Orders][Delivery] > [Add Delivery Info]","","",""
"","263","500 returned for id of invalid format","sales-portal-api","Sun Dec 21 21:53:21 UTC 2025","failed","Sun Dec 21 21:53:22 UTC 2025","[API] [Sales Portal] [Products] [Get By Id] > [Negative]","","",""
"","13786","Should NOT assign manager with non-existing orderId","sales-portal-api","Sun Dec 21 21:47:35 UTC 2025","passed","Sun Dec 21 21:47:48 UTC 2025","[API][Orders][Assign/Unassign Manager - Negative DDT] > Order in Received status","","",""
"","204","CST-003: GET /api/customers?country Filter customers by Ukraine","sales-portal-api","Sun Dec 21 21:47:16 UTC 2025","passed","Sun Dec 21 21:47:16 UTC 2025","CST-003 Get customers list (Filter by Country)","","",""
"","1983","Negative price product not created","sales-portal-api","Sun Dec 21 21:52:50 UTC 2025","passed","Sun Dec 21 21:52:52 UTC 2025","[API][Products] > [Should NOT create product]","","",""
"","356","Too long comment (251) is rejected","sales-portal-api","Sun Dec 21 21:48:52 UTC 2025","passed","Sun Dec 21 21:48:52 UTC 2025","[API][Orders][Comment] > Not create","","",""
"","1063","Update with invalid email format — bad request","sales-portal-api","Sun Dec 21 21:47:22 UTC 2025","passed","Sun Dec 21 21:47:23 UTC 2025","[API][Customers] > [Should NOT update customer]","","",""
"","6956","Update only manufacturer","sales-portal-api","Sun Dec 21 21:53:41 UTC 2025","passed","Sun Dec 21 21:53:48 UTC 2025","[API][Products] > [Update product]","","",""
"","185","404 returned for empty id","sales-portal-api","Sun Dec 21 21:53:17 UTC 2025","failed","Sun Dec 21 21:53:17 UTC 2025","[API] [Sales Portal] [Products] [Get By Id] > [Negative]","","",""
"","19984","ORD-PUT-001: Successful products update recalculates total_price","sales-portal-api","Sun Dec 21 21:51:35 UTC 2025","passed","Sun Dec 21 21:51:55 UTC 2025","[API][Orders] > [Update order]","","",""
"","870","Should get customer by valid id","sales-portal-api","Sun Dec 21 21:47:14 UTC 2025","passed","Sun Dec 21 21:47:14 UTC 2025","[API] [Sales Portal] [Customers] [Get By Id] > [Positive]","","",""
"","164","Zero flat number [8]","sales-portal-api","Sun Dec 21 21:49:35 UTC 2025","passed","Sun Dec 21 21:49:35 UTC 2025","[API][Orders][Delivery] > [Add Delivery Info] > [Should NOT add Delivery Info]","","",""
"","21637","Processing: receive 1 product (becomes Partially Received)","sales-portal-api","Sun Dec 21 21:50:19 UTC 2025","passed","Sun Dec 21 21:50:40 UTC 2025","[API][Orders][Receive] > [Positive][Receive order]","","",""
"","32945","Should NOT receive products: Invalid product id: date string","sales-portal-api","Sun Dec 21 21:52:04 UTC 2025","passed","Sun Dec 21 21:52:37 UTC 2025","[API][Orders][Receive] > [Negative][Invalid request body]","","",""
"","482","Create customer with 4 characters length in flat","sales-portal-api","Sun Dec 21 21:47:12 UTC 2025","passed","Sun Dec 21 21:47:13 UTC 2025","[API][Customers][Create Customer] > Positive DDT","","",""
"","148","Non-existing commentId rejected","sales-portal-api","Sun Dec 21 21:49:24 UTC 2025","passed","Sun Dec 21 21:49:24 UTC 2025","[API][Orders][Comment] > Not delete","","",""
"","1952","404 returned for non-existing id of valid format","sales-portal-api","Sun Dec 21 21:53:12 UTC 2025","passed","Sun Dec 21 21:53:14 UTC 2025","[API] [Sales Portal] [Products] [Get By Id] > [Negative]","","",""
"","1958","0 price product not created","sales-portal-api","Sun Dec 21 21:52:52 UTC 2025","passed","Sun Dec 21 21:52:54 UTC 2025","[API][Products] > [Should NOT create product]","","",""
"","466","Exceeded Max length street name (>40 chars) [12]","sales-portal-api","Sun Dec 21 21:49:35 UTC 2025","passed","Sun Dec 21 21:49:35 UTC 2025","[API][Orders][Delivery] > [Add Delivery Info] > [Should NOT add Delivery Info]","","",""
"","10983","Should NOT update manager with non-existing orderId","sales-portal-api","Sun Dec 21 21:47:45 UTC 2025","passed","Sun Dec 21 21:47:56 UTC 2025","[API][Orders][Assign/Unassign Manager - Negative DDT] > Order in Draft status","","",""
"","1917","Not integer price product not created","sales-portal-api","Sun Dec 21 21:52:52 UTC 2025","passed","Sun Dec 21 21:52:54 UTC 2025","[API][Products] > [Should NOT create product]","","",""
"","479","Create customer with 40 characters length in street","sales-portal-api","Sun Dec 21 21:47:11 UTC 2025","passed","Sun Dec 21 21:47:11 UTC 2025","[API][Customers][Create Customer] > Positive DDT","","",""
"","159","Exeeded Max house number (>999) [13]","sales-portal-api","Sun Dec 21 21:49:37 UTC 2025","passed","Sun Dec 21 21:49:37 UTC 2025","[API][Orders][Delivery] > [Add Delivery Info] > [Should NOT add Delivery Info]","","",""
"","22013","ORD-PUT-003: Order status is DRAFT after update","sales-portal-api","Sun Dec 21 21:51:54 UTC 2025","passed","Sun Dec 21 21:52:16 UTC 2025","[API][Orders] > [Update order]","","",""
"","9923","Order status transition from Received to In Process","sales-portal-api","Sun Dec 21 21:50:21 UTC 2025","passed","Sun Dec 21 21:50:31 UTC 2025","[API][Orders][Negative Orders statuses transition]","","",""
"","1363","Update street with empty string — bad request","sales-portal-api","Sun Dec 21 21:47:22 UTC 2025","passed","Sun Dec 21 21:47:23 UTC 2025","[API][Customers] > [Should NOT update customer]","","",""
"","16953","500 returned on invalid ObjectId format for customer","sales-portal-api","Sun Dec 21 21:52:37 UTC 2025","passed","Sun Dec 21 21:52:54 UTC 2025","[API][Orders] > [Should NOT update order]","","",""
