"DESCRIPTION","DURATION IN MS","NAME","PARENT SUITE","START TIME","STATUS","STOP TIME","SUB SUITE","SUITE","TEST CLASS","TEST METHOD"
"","901","CST-003: GET /api/customers?country Filter customers by Ukraine","sales-portal-api","Tue Dec 23 21:21:54 UTC 2025","passed","Tue Dec 23 21:21:55 UTC 2025","CST-003 Get customers list (Filter by Country)","","",""
"","946","Non-existing commentId rejected","sales-portal-api","Tue Dec 23 21:24:33 UTC 2025","passed","Tue Dec 23 21:24:34 UTC 2025","[API][Orders][Comment] > Not delete","","",""
"","1027","Should get order by valid id","sales-portal-api","Tue Dec 23 21:24:35 UTC 2025","passed","Tue Dec 23 21:24:36 UTC 2025","[API] [Sales Portal] [Orders] [Get By Id] > [Positive]","","",""
"","9108","Delete order with product quantity = 5 (max)","sales-portal-api","Tue Dec 23 21:24:27 UTC 2025","passed","Tue Dec 23 21:24:36 UTC 2025","[API][Orders][Delete Order]","","",""
"","14982","ORD-PUT-003: Order status is DRAFT after update","sales-portal-api","Tue Dec 23 21:25:52 UTC 2025","passed","Tue Dec 23 21:26:07 UTC 2025","[API][Orders] > [Update order]","","",""
"","21950","Remove manager from order","sales-portal-api","Tue Dec 23 21:23:20 UTC 2025","passed","Tue Dec 23 21:23:42 UTC 2025","[API][Orders][Manager assignment flow] > Order in In Process status","","",""
"","10959","ORD-PUT-004: History entry recorded when order composition changes","sales-portal-api","Tue Dec 23 21:25:59 UTC 2025","passed","Tue Dec 23 21:26:10 UTC 2025","[API][Orders] > [Update order]","","",""
"","1000","1000 amount product not created","sales-portal-api","Tue Dec 23 21:26:33 UTC 2025","passed","Tue Dec 23 21:26:34 UTC 2025","[API][Products] > [Should NOT create product]","","",""
